"","origLine","wordsToPredictBy","wordNoToTest","testWord","prediction1","source1","prediction2","source2","prediction3","source3","prediction4","source4","timeToPredict","Correct"
"607","We enjoyed the show until all the credits had rolled, but could not find a suitable place for dinner; the tourist season had yet to begin, so almost nothing was open. Instead, after a walk from one end of town to the other, we took the tram back to S√≥ller for a well-deserved dinner. We would head for Palma the following day, but for that evening we were happy to be living in the moment.","we enjoyed the show until all the credits had rolled but could not find a suitable place for dinner the tourist season had yet to begin so almost nothing was open instead after a walk from one end of town to the other we took the tram back to s„ller for a welldeserved",54,"dinner","a","52J","dinner","2","a","42F","good","51D",0.639999999999418,TRUE
"608","‚ÄúI hope through my practices to honor the women, children and men who have lost their lives and who are struggling to survive now,‚Äù said Nancy, a resident of Roswell, Ga. ‚ÄúMy daily journey will be much easier than theirs. But, I live in a society where people die from obesity and obesity related issues ‚Äì we die from too much. They die from not enough‚Ä¶‚Äù","‚Äúi hope through my practices to honor the women children and men who have lost their lives and who are struggling to survive now‚Äù said nancy a resident of roswell ga ‚Äúmy daily journey will be much easier than theirs but i live in a society where people die from obesity and obesity related issues ‚Äì",57,"we","the","21","a","21","not","21","you","21",0.309999999997672,FALSE
"609","Those of you who were up there in Northrend with me will remember my last operation was at Light‚Äôs Hammer just inside the gates of Icecrown Citadel. You might also remember that I spent most of that time hanging out there with Tirion Fordring. Who I‚Äôd already had my fill of, by the way, when I went to meet him with Thrall at his stupid-ass tournament place. (Like seriously, isn‚Äôt ONE pansy-ass traveling fair enough for the world?) So hopefully you people were all too busy forging your way into the citadel and fighting our enemies like the Horde soldiers that you are‚Ä¶but meanwhile I was stuck back there with Tirion‚Ä¶who pretty much had nothing to do for a good long time but talk. And talk.","those of you who were up there in northrend with me will remember my last operation was at light‚Äôs hammer just inside the gates of icecrown citadel you might also remember that i spent most of that time hanging out there with tirion fordring who i‚Äôd already had",49,"my","fill","3","us","32B","a","3","my","3",0.459999999999127,TRUE
"610","4. WWE INTERCONTIENTAL CHAMPIONSHIP MATCH: The Big Show (Champion) vs. Cody Rhodes (Challenger/Former Champion).","wwe intercontiental championship match the big show champion vs",10,"cody","cody","3","vs","41C","vs","31B","vs","32B",0.540000000000873,TRUE
"611","Start a school that teaches the ‚Äòchildren of a lesser god‚Äô for free, even better, pays the parents for sending the children to school.","start a school that teaches the ‚Äòchildren of a",10,"lesser","heart","41A","mask","41A","tree","41A","crank","41A",0.419999999998254,FALSE
"612","and streets paved with gold.","and",2,"streets","half","2","bit","2","think","2","suk","2",0.0500000000029104,FALSE
"613","Hendrix first looked deeper into marital psychology after his marriage ended in 1975. He thought the prevailing therapy of the time, loosely termed ‚Äòconflict resolution‚Äô, focused too much on compromise. ‚ÄúWhat we found, and what the whole discipline of marital therapy in America found, was that it simply didn‚Äôt work, because a part of us is always resentful if we have to give things up,‚Äù he says. ‚ÄúAlso, it was very cognitive ‚Äì ‚Äòthere‚Äôs the problem, here‚Äôs the solution‚Äô. Like fixing a car. But people are not like machines.‚Äù","hendrix first looked deeper into marital psychology after his marriage ended in he thought the prevailing therapy of the time loosely termed ‚Äòconflict resolution‚Äô focused too much on compromise ‚Äúwhat we found and what the whole discipline of marital therapy in america found was that it simply didn‚Äôt work because a part of us is always resentful if we have to give things up‚Äù he says ‚Äúalso it was very cognitive ‚Äì ‚Äòthere‚Äôs the",75,"problem","york","2","menu","2","hand","2","century","2",0.269999999996799,FALSE
"614","What's your favourite weekend breakfast?","whats",2,"your","on","2","going","2","dinner","2","favourite","2",0.0299999999988358,FALSE
"615","In 1854 England became involved with the Crimean war, which again increased the demand for ships.","in england became involved with the",7,"crimean","beer","31A","the","31B","woman","32A","with","32C",0.5,FALSE
"616","Responding to the claims of numerous European writers, philosophers and intellectuals, political commentator Bill O‚ÄôReilly noted that they should ‚Äúshut up‚Äù and ‚Äústop supporting terrorists with their panty armed leaflets and ‚Äòideas‚Äô and spineless flags with no stars or even stripes.‚Äù","responding to the claims of numerous european writers philosophers and intellectuals political commentator bill o‚Äôreilly noted that they should ‚Äúshut up‚Äù and ‚Äústop supporting terrorists with",27,"their","i","21","any","21","standing","21","competing","21",0.330000000001746,FALSE
"617","Today, our Program Director, Sarah Rial, and I will make the 7000-mile trek to our partner Kurnyuk School for Girls in the world‚Äôs newest nation. It‚Äôs a grueling itinerary‚Äî6 hours from Boston to Amsterdam; 8 hours to Nairobi; 11 hour-layover before the 1.5 hour trip to Juba. We overnight in South Sudan‚Äôs boomtown capital, before taking the 1.5 hour flight to less cosmopolitan Wau; .5 hour jumper to even less ‚Äúcosmo‚Äù Maluakon followed by the .5 hour drive over dusty, bumpy, potholed ‚Äúroad‚Äù to the Kurnyuk School located in quintessentially v-e-r-y rural Akon. Did I say the trip was grueling? Oh yes, and the temperatures average 106 degrees; the nighttime bugs can be fierce and latrines are often simple holes in the ground. That‚Äôs why our want ad reads, ‚ÄúDivas need not apply‚Ä¶.‚Äù","today our program director sarah rial and i will make the mile trek to our partner kurnyuk school for girls in the world‚Äôs newest nation it‚Äôs a grueling itinerary‚Äî hours from boston to amsterdam hours to nairobi hourlayover before the hour trip to juba we overnight in south sudan‚Äôs boomtown capital before taking the hour flight to less cosmopolitan wau hour jumper to even less ‚Äúcosmo‚Äù maluakon followed by the hour drive over dusty bumpy potholed ‚Äúroad‚Äù to the kurnyuk school located",83,"in","in","3","for","31B","until","42E","school","32C",0.569999999999709,TRUE
"618","Farid is the proud owner of the very first Black Dot Project print. Think you can get the second!?","farid is the proud",5,"owner","owner","4","proud","41C","of","3","proud","32B",0.459999999999127,TRUE
"619","The debut album ""Franklin Ave."" by Austin Hartley-Leonard delivers classic Americana songwriting combined with the textures of Nick Drake and The Band","the debut album franklin ave by austin hartleyleonard delivers classic americana songwriting combined with the textures of nick",19,"drake","nick","41C","and","3","nick","31B","of","42F",0.560000000004948,FALSE
"620","The two hours that we talked at a little round table, sharing a pot of tea, went extraordinarily fast and we seemed to be able to chat about all sorts of things quite easily.","the two hours that we talked at a little round table sharing a pot of tea went extraordinarily fast and we seemed to be able to chat about all sorts of things quite",34,"easily","easily","3","things","42F","details","42F","things","32C",0.510000000002037,TRUE
"621","I had to stand the husband in front of the microwave and ask him what he uses it for. He said, ""Um, well, to heat things up. I just used it...the other week. Oh, well. To boil water?"" He brought it in to work so other people can kill themselves slowly by using it. I Freecycled the toaster.","i had to stand the husband in front of the microwave and ask him what he uses it for he said um well to heat things up i just used itthe other week oh well to boil water he",40,"brought","he","41C","it","3","he","31B","water","42F",0.69999999999709,FALSE
"622","Whew. All those Protestant splinter groups while the holy, Catholic, and Apostolic Church sails on in her serene waters, untroubled by the bickering outside her walls.","whew all those protestant splinter groups while the holy catholic and apostolic church sails on in her serene waters untroubled by the bickering outside her",26,"walls","walls","3","i","32B","and","32A","but","32A",0.489999999997963,TRUE
"623","For the trip of a lifetime, though, these sacrifices can and must be made. After all, barring some catastrophic event, all of my adorable shoes will be waiting for me when I get home.","for the trip of a lifetime though these sacrifices can and must be made after all barring some catastrophic event all of my adorable",25,"shoes","shoes","4","shoes","3","adorable","41C","shoes","31A",0.940000000002328,TRUE
"624","Making ME happy! I have spent sooooooooooooooooo ‚Ä¶.yes isnt that a great deal of o‚Äôs!!! Yes, I have spent a great deal of years making sure EVERYONE was ok from the church to my family to my friends etc..etc.. and the list had the ability to go on like a bad credit report! However, I have PULLED the report and stopped it from growing‚Ä¶ I have cleaned it up and have been starting from scratch and it feels good!","making me happy i have spent sooooooooooooooooo ‚Äyes isnt that a great deal of o‚Äôs yes i have spent a great deal of years making sure everyone was ok from the church to my family to my friends etcetc and the list had the ability to go on like a bad credit report however i have pulled the report and stopped it from growing‚Ä i have cleaned it up",70,"and","and","4","up","51D","up","41C","to","42A",0.809999999997672,TRUE
"625","I think I might try to make it into a cute jumper, something like this one. This project might be down the line a bit, though, which is fine since the fabric is a bit thicker and fall-feeling. A perfect late summer/early autumn project!","i think i might try to make it into a cute jumper something like this one this",18,"project","this","41C","past","3","project","3","is","31A",0.580000000001746,TRUE
"626","Anyhoo some fairly good news which i will be announcing either late this thursday or early friday may mean i increase my work load but also enjoyment in Sheffield and mean i see some of you bloggers, writters, or plain old beer enthusiasts a little more often. Ill leave you guessing as to what this new found surprise may be. Back onto something i really love doing though, a good old beer review, followed by a little bit of beer related art from Thornbridge.","anyhoo some fairly good news which i will be announcing either late this thursday or early friday may mean i increase my work load but also enjoyment in sheffield and mean i see some of you bloggers writters or plain old beer enthusiasts a little more often ill leave you guessing as to what this new found surprise may be back onto something",64,"i","i","3","onto","42F","where","32A","fur","31B",0.480000000003201,TRUE
"627","Or I see a picture from high school. I remember walking down those paths lined with roses or crossing that lawn, going into that orchestra room, sitting on the steps of that gym. And you were there. You were always there. You are as much a part of that scene as the buildings in the background, I can‚Äôt think of that place without thinking of you, and how we were always together, as often as we possibly could be, because that was how much we loved each other.","or i",3,"see","to","3","a","3","have","3","say","3",0.150000000001455,FALSE
"628","According to La Tercera newspaper, Vallejo will be a ‚Äúguest of honor‚Äù of the UJC celebrations and her agenda in the Caribbean nation includes several activities and meetings with students.","according to la tercera newspaper vallejo will be a ‚Äúguest of honor‚Äù of the ujc celebrations and her agenda in the caribbean nation includes several activities",27,"and","me","2","control","2","thoughts","2","simplemy","2",0.349999999998545,FALSE
"629","Please turn off the sound on my playlist located at the bottom of this page before playing this video.","please turn off the",5,"sound","sound","4","the","41C","sound","31B","v","32A",0.510000000002037,TRUE
"630","I bought a bunch of fresh Chinese spinach from the wet market last weekend. My favourite way of cooking the spinach is by frying it in a hot wok. If the wok is hot enough, you will have a spinach dish with nice ‚Äòwok hei‚Äô (wok burnt) smell.","i bought a bunch of fresh chinese spinach from the wet market",13,"last","last","4","last","3","market","41C","wet","42F",0.709999999999127,TRUE
"631","Once you‚Äôve made it to your ‚Äúsafe zone‚Äù ,and established everyone is there, evaluate what you‚Äôve brought with you. If you‚Äôve done this in the middle of the night, take everything carried out and put it on the table. Do not add anything once you‚Äôve returned to the house.","once you‚Äôve made it to your ‚Äúsafe zone‚Äù and established",11,"everyone","by","2","totally","2","everyone","2","writers","2",0.309999999997672,TRUE
"632","Can I just say that Ashley‚Äôs dog is so cute. I want him!","can i",3,"just","the","3","my","3","say","3","see","3",0.150000000001455,FALSE
"633","And with its interaction","and with",3,"its","a","3","them","3","it","3","little","3",0.130000000004657,FALSE
"634","Best Moment this week: The week is not over but so far the best thing has been learning I've just entered into my 3rd trimester!","best moment this week the week is not over but so",12,"far","far","5","so","51D","the","4","far","41A",0.809999999997672,TRUE
"635","Here is a project I just made - with the help of my 4 year-old granddaughter. I got these printables from Daisy Company for the box and the candy wrappers - and used my new stamp set for the sentiment. It all ties together perfectly and I'm making them for all the girls at my husbands office for Christmas!","here is a project i just made with the help",11,"of","my","4","help","41C","the","52J","of","31A",0.610000000000582,TRUE
"636","-A compass (like the one you just gave your bard friend)","a compass",3,"like","the","3","the","2","like","3","like","2",0.129999999997381,TRUE
"637","Well, in addition to the service, the food was delicious and when our waiter brought around the desserts to choose from, I opted for the cr√®me brulee. I don‚Äôt know what possessed me to order that because I am NOT an adventuresome eater, but for some reason I thought it would have chocolate in it.","well in addition to the service the food was",10,"delicious","delicious","3","was","41C","food","42F","was","32B",0.569999999999709,TRUE
"638","Be sure to follow my blog for future reviews and giveaways as well","be sure to follow",5,"my","my","5","my","4","my","41A","my","41B",0.580000000001746,TRUE
"639","*Dress like a lizard and wear slippers‚Ä¶.‚ÄùLounge lizard‚Äù","dress",2,"like","the","2","a","2","as","2","not","2",0.0299999999988358,FALSE
"640","I received my copy free from the publisher at the AASL convetion.","i received my copy free from the publisher at the",11,"aasl","time","41A","the","41C","the","31B","the","32C",0.599999999998545,FALSE
"641","of strangers, but come out from the rest, that they may follow Him without","of strangers but come out from the rest that they may",12,"follow","follow","4","may","41C","they","42F","follow","31A",0.590000000003783,TRUE
"642","Come on over to The Crazy Challenge and play along, we have so outstanding inspiration this week by team and our guest designer Claudia.","come on over to the crazy challenge and",9,"play","play","3","and","31B","challenge","32C","not","42D",0.560000000004948,TRUE
"643","I have two daughters, so I knew I was going to write a heroine. But I wanted the books to have a mythic quality, after all we‚Äôre talking about Templars and monsters and archangels. So I based Billi on the mythic heroines like Athene, like Boudica and the Rani of Jhansi, all powerful warriors as well as being female.","i have two daughters so i knew i was going to write a heroine but i wanted the books to have a mythic quality after all",27,"we‚Äôre","all","31B","after","32C","time","3","you","3",0.44999999999709,FALSE
"644","Never sent We a messenger or a prophet before thee but when He recited (the message) Satan proposed (opposition) in respect of that which he recited thereof. But Allah abolisheth that which Satan proposeth. Then Allah establisheth His revelations. Allah is Knower, Wise;","never",2,"sent","of","2","forget","2","really","2","heard","2",0.069999999999709,FALSE
"645","But I did want her to have at least PART of my imaginary Paris experience, so I used her pretty Paris stamp to make her birthday card.","but i did want her to have at least",10,"part","part","4","least","51D","least","41C","at","52J",0.75,TRUE
"646","Informed readers of ‚ÄúModels of Sickness and Disability‚Äù might wonder why something that has been repeatedly shown not to be a successful model is being promoted by a UK Government.","informed readers of ‚Äúmodels of sickness and disability‚Äù might",10,"wonder","the","2","to","2","a","2","been","2",0.290000000000873,FALSE
"647","(Sunday Morning Edit ‚Äì on the basis that the Sunday papers appear to have nothing else in them other than Rangers, I will follow the new developments up later ‚Äì but I have typed this stuff, so it‚Äôs going in!)","sunday morning edit ‚Äì on",6,"the","back","2","internet","2","week","2","way","2",0.220000000001164,FALSE
"648","Let's attack it point by point. His biggest mistake: confusing the shilling Ales of the 19th century with the shilling Pale Ales of the 20th. Yes they were 60/- to 140/- or even 160/- Ales. But these were the thick sweet type of Ales than resembled Burton Ale.","lets attack it point by point his biggest mistake confusing the shilling ales of the th century with the shilling pale ales of the th yes they were to or even ales but these were the thick sweet type of ales",42,"than","than","4","than","3","ales","41C","than","31A",0.57999999999447,TRUE
"649","You can roll it on or brush it on.","you",2,"can","going","2","me","2","see","2","why","2",0.0100000000020373,FALSE
"650","Pretty cool. C","pretty cool",3,"c","im","3","well","3","and","3","to","3",0.160000000003492,FALSE
"651","And the melody that He gave to me","and",2,"the","half","2","bit","2","think","2","suk","2",0.0499999999956344,FALSE
"652","Wild organ, fast and hard drums, out of control tenor sax‚Äîthis was the sound of East Coast Young America. Jerry Gross, Arnie Silver and Mike Freda join in:","wild organ fast",4,"and","and","4","hard","3","and","31A","and","31B",0.220000000001164,TRUE
"653","Buying Guide","buying",2,"guide","a","2","i","2","then","2","night","2",0.0400000000008731,FALSE
"654","Beervana - was a phrase coined in Oregon to describe the burgeoning craft beer movement that had taken hold here in the 1980s. And indeed, it's an apt description, as those who are actively involved in the beer community think of it a near-religious experience to make and enjoy well-made brew.","beervana was a phrase coined in oregon to describe the burgeoning craft beer movement that had taken hold here in the s and indeed its an apt description as those who are actively involved",35,"in","in","3","saying","31B","the","42F","in","21",0.440000000002328,TRUE
"655","For he commandeth, and raiseth the stormy wind, which lifteth up the waves thereof.","for he commandeth and raiseth the stormy wind which",10,"lifteth","lifteth","3","which","31B","wind","32C","we","32A",0.529999999998836,TRUE
"656","I‚Äôm certain that I‚Äôve given, and oh how you can take","i‚Äôm certain that i‚Äôve given and oh how you can",11,"take","take","5","take","4","take","41A","take","41B",0.849999999998545,TRUE
"657","Previously, i had shared in [L]ife [M]anagement that i maintain specific spreadsheets to aid me in controlling my budget and other aspects of life.","previously i had shared in life management that i maintain specific spreadsheets to aid me in controlling my",19,"budget","miss","41B","my","41C","my","31B","budget","21",0.620000000002619,TRUE
"658","Mega Millions Mojo","mega millions",3,"mojo","mojo","3","other","2","mojo","21","people","2",0.110000000000582,TRUE
"659","lot people that if you strike your pup at the rear-end every time he barks, you will presently discover that he s not supposed to roar. This method, although successful, could make your pup live in dread of being physically reprimanded, and steal the grade of a person‚Äôs romantic relationship.","lot people that if you strike your pup at the rearend every time he barks you will presently discover that he s not supposed to roar this method although successful could make your pup live in dread of being physically reprimanded and steal the grade of a",48,"person‚Äôs","a","51D","a","41C","a","31B","a","42C",0.75,FALSE
"660","Summary of the day: I ate michiotes (you gotta try them, they‚Äôre SO good!), let my kid jump around in the bouncy castle like a madwoman on a hopping spree and entertained both myself and her with the clown. A Saturday well spent.","summary of the day i ate michiotes you gotta try them they‚Äôre so good let my kid jump around in the bouncy",23,"castle","castle","4","castle","3","castle","31A","the","42F",0.659999999996217,TRUE
"661","The truth is, if you aren't living as an ethical vegan, you are paying other human animals to imprison your fellow animals, to murder their babies and to murder them...to keep them from the 'available to all' pleasures of the Earth. Or maybe you're committing those horrors yourself, directly...I don't know.","the truth",3,"is","the","3","was","3","it","3","what","3",0.139999999999418,FALSE
"662","While I sound positive, my heart hurts.","while i sound positive my heart",7,"hurts","heart","31B","my","42F","playlist","32B","my","32C",0.529999999998836,FALSE
"663","Ben's dog is very pleased that I just gave her a new bone to chew on lol. Her name is Hershey and she misses her family VERY much. She didn't eat for the first couple of days. Now she's sleeping upstairs in Ben's room with me, eating her food, playing outside, and happy to have a bone. She doesn't like it when *I* leave to go home for a little bit though. She's taken things from Ben's room a couple of times, gotten into the trash, etc.","bens dog is very pleased that i just gave her a new bone to chew on lol her name is hershey and she misses her family very much she didnt eat for the first couple of days now shes sleeping upstairs in bens room with me eating her food playing outside and happy to have a bone she doesnt like it when i leave to go home for a little bit though shes taken things from",77,"bens","from","31B","to","3","things","32C","a","31A",0.440000000002328,FALSE
"664","But when the international community treats the Jewish state with contempt, Israelis tend to reciprocate. The result is a stiffening of hard-line attitudes.","but when the international community treats the",8,"jewish","jewish","3","the","31B","i","21","when","21",0.370000000002619,TRUE
"665","I joined the Palo Alto Run Club (PARC) last May, a group full of talented, hard working running and got a bunch of great runs in. Those ""easy"" five milers where we'd start hitting 6:25, 6:10 pace I think paid off. Do enough 6:25 miles in your regular runs, and it'll start seeming like nothing. And there's something about the shared experience of a run with others that makes all the hard work more meaningful.","i joined the palo alto run club parc last may a group full of talented hard working running and got a bunch of great runs in those easy five milers where wed start hitting pace i think paid off do enough miles in your regular runs and itll",49,"start","start","4","start","3","start","31A","and","32C",0.559999999997672,TRUE
"666","You see, for me there will be no spring ‚Äì not as you know it, anyway. There will be no winter either. Instead I will go beyond the parts, rising up into the clouds, soaring through the pink and the blue, merging with the vastness of infinity - that from which I sprung - as you did too.","you see for me there will be no spring ‚Äì not as you know it anyway there will be no winter either instead i will go beyond the parts rising up into the clouds soaring through the pink and the blue merging with the vastness of infinity that from which i",52,"sprung","sprung","4","i","41C","sprung","31B","i","32C",0.580000000001746,TRUE
"667","And you, my father, there on the sad height,","and you my father",5,"there","there","4","father","41C","there","31A","on","3",0.409999999996217,TRUE
"668","I rationalize this choice by convincing myself","i rationalize this choice by convincing",7,"myself","myself","3","convincing","31B","team","32B","by","32C",0.470000000001164,TRUE
"669","those summer storms swelling","those summer",3,"storms","storms","3","you","21","to","2","a","2",0.139999999999418,TRUE
"670","03) Kashmir (Led Zeppelin","kashmir",2,"led","zeppelin","2","led","2",NA,NA,NA,NA,0.0800000000017462,TRUE
