"","origLine","wordsToPredictBy","wordNoToTest","testWord","prediction1","source1","prediction2","source2","prediction3","source3","prediction4","source4","timeToPredict","Correct"
"354","Can you remember back to when you had babies to care for and how careful you were with their bedding? You'd make sure the sheets were clean and straight, you'd make the little bed several times a day and as soon as there was a wet sheet, into the washing machine it would go. You did those things, and more, because you knew how important that bed was to your baby. Well, I might be reverting to babyhood because I tend my bed as carefully as I would a cot or crib and I do it because sleep is important. Now let me declare my bias here up front. I LOVE my bed, always have, always will. I am a good sleeper. I'm rarely in bed more than ten minutes before I'm sound asleep. But I also do a lot of my thinking in bed in the cool dark hours of the morning and being in an uncomfortable bed would not be conducive to my sleeping or thinking. If I want to get the most out of every day, I need to sleep well.","can you remember back to when you had babies to care for and how careful you were with their bedding youd make sure the sheets were clean and straight youd make the little bed several times a day and as soon as there was a wet sheet into the washing machine it would go you did those things and more because you knew how important that bed was to your baby well i might be reverting to babyhood because i tend my bed as carefully as i would a cot or crib and i do it because sleep is important now let me declare my bias here up",109,"front","i","4","up","41C","i","3","front","31A",0.659999999996217,TRUE
"355","In her article, ‚ÄòShould the church connect with the Occupy movement?‚Äô, St. Francis of Assisi Pastoral Administrator Valerie Chapman, whom at least one local journalist erroneously identifies as ‚Äúpastor‚Äù of the Southwest Portland parish, attempts to convince readers that Catholic Social Teaching tends to support the work(s) of Occupy Wall Street.","in her article ‚Äòshould the church connect with the occupy movement‚Äô st francis of assisi pastoral administrator valerie chapman whom at least one local journalist erroneously identifies as ‚Äúpastor‚Äù of the southwest portland parish attempts to convince readers that catholic social teaching",43,"tends","social","32C","to","2","i","2","love","2",0.310000000004948,FALSE
"356","Bertie eyed the entrails hungrily. ‚ÄúIf you don‚Äôt want to, I could finish it off for you?‚Äù he offered gallantly, already starting to skulk forward. Reginald narrowed his eyes. Bertie waited. ‚ÄúAll the same, Bertie, I need to eat it all,‚Äù Reginald sniffed delicately, turning his head away with mild distaste, ‚Äùhowever much it may pain me to consume the revolting morsels,‚Äù he added and then looked incredulously at the bare ground where the revolting morsels were no longer in evidence. ‚ÄúThanks a lot Bertie!‚Äù he hissed. ‚ÄúYou are such a liability. And a major pain in the scruff.‚Äú","bertie eyed the entrails hungrily ‚Äúif you don‚Äôt want to i could finish it off for you‚Äù he offered gallantly already starting to skulk forward reginald narrowed his eyes bertie waited ‚Äúall the same bertie i need to eat it all‚Äù reginald",43,"sniffed","at","42F","narrowed","2","sniffed","2","all","42F",0.389999999999418,TRUE
"357","‚ÄúI‚Äôm sorry my transporter was malfunctioning, alright what‚Äôs the big emergency?","‚Äúi‚Äôm sorry my transporter",5,"was","was","3","transporter","31B","done","21","off","21",0.269999999996799,TRUE
"358","Depeche Mode Walking in my shoes UK","depeche",2,"mode","walking","2","mode","2",NA,NA,NA,NA,0.0400000000008731,TRUE
"359","‚ÄúThe insurgency‚Äôs safe haven in Pakistan, as well as the limited capacity of the Afghan government, remain the biggest risks to the process of turning security gains into a durable and sustainable Afghanistan,‚Äù according to the report.","‚Äúthe insurgency‚Äôs safe haven in pakistan as well as the limited capacity of the afghan government remain the biggest risks to the process of turning security gains into a durable and sustainable",33,"afghanistan‚Äù","longterm","2","and","42F","and","32C","the","32B",0.459999999999127,FALSE
"360","I've been away from the blog for so long, let's see if I remember how this goes......","ive been away from the blog for",8,"so","so","5","long","4","so","41A","so","41B",0.779999999998836,TRUE
"361","I couldn‚Äôt not like AVENGERS ASSEMBLE in the end, because where else can you see Jenny Agutter attempt to nuke Manhattan? She hasn‚Äôt wielded power like that since WALKABOUT.","i couldn‚Äôt not like avengers assemble in the end because where",12,"else","it","3","of","31B","is","3","else","3",0.5,TRUE
"362","Sometimes it seems unfair the way life happens doesn't it?","sometimes",2,"it","seems","2","the","2","to","2","in","2",0.0800000000017462,FALSE
"363","My former mother-in-law was an OB/GYN nurse and demanded to see the records of the delivery. She was convinced that somehow, the vacuum extractor was responsible for slicing and dicing my nether-regions.","my former motherinlaw was an obgyn nurse and demanded to see the records of the delivery she was",19,"convinced","born","41A","was","41C","was","31B","a","42D",0.720000000001164,FALSE
"364","OUR VIDEO:","our",2,"video","hop","2","the","2","of","2","to","2",0.0599999999976717,FALSE
"365","B is for Beatles","b is",3,"for","beatles","3","for","3","to","21","a","21",0.0900000000037835,TRUE
"366","There are four faces of this pyramid, one for each direction. The serpent is activated on the Spring (planting, open to receive new seeds) and Fall Equinoxes (harvesting the seeds planted from spring‚Ä¶ that is to say, Full use of all that was planted in spring.)","there are four faces of this pyramid one for each direction the serpent is activated on",17,"the","the","4","the","3","the","31B","activated","32C",0.610000000000582,TRUE
"367","The days have fallen into a simple routine of golf in the morning, before it gets too hot, a bit of a nap, lunch, another nap, a dip in the pool, a walk on the beach and a cocktail or two before dinner.","the days have fallen into a simple routine of golf in the morning",14,"before","morning","41C","and","42A","the","42F","and","4",0.799999999995634,FALSE
"368","‚ÄúGenius always comes out with current requirements of the customers. They have always addressed the demand of the hour at the right time. KM 110X is the need currently at the entry level. This product is cost-effective and well suits the entry-level combos with good features and hence adding a feature rich to the partners kitty,‚Äù said Sudhir S, Managing Director, Inspan Infotech.","‚Äúgenius always comes out with current requirements of the customers they have always addressed the demand of the hour at the right time km x is the need currently at the entry level this product is costeffective and well suits the entrylevel combos with good features and hence adding a feature rich to the partners kitty‚Äù said sudhir s managing director",62,"inspan","director","31B","director","21","managing","32C","the","2",0.450000000004366,FALSE
"369","10. Yesterday, I was reminded how great a family I‚Äôve got. My older sister was fighting a sinus headache and went to bed early, so my brother-in-law, who doesn‚Äôt often feel well, took charge of little A. until bedtime, when my mom took over. Before that, my mom was finishing a project for work, so I was able to clean the kitchen and make a cake she had to have for today. That‚Äôs the sort of thing my mom has taught us and it‚Äôs really wonderful to be able to help each other. My dad is great to help out, too, as are Sisters  and , though Sis  isn‚Äôt home that often. I just love the attitude of servanthood in a house. It makes life so much easier for everyone!","yesterday i was reminded how great a family i‚Äôve got my older sister was fighting a sinus headache and went to bed early so my brotherinlaw who doesn‚Äôt often feel well took charge",34,"of","of","4","of","3","of","31A","took","42F",0.629999999997381,TRUE
"370","We are 100% debt free now.","we are debt",4,"free","now","4","now","3","free","31A","free","4",0.260000000002037,TRUE
"371","I‚Äôm a very weird person. I like taking pictures of everything‚Ä¶.literally. I say literally more than the average human being. I suppose by saying literally it will enforce the fact that what I am saying is so literal that you can have zero questions about it. Its weird. I have an odd obsession with pronouncing words correctly. People make fun of me and the way I say ‚Äúclothes‚Äù. I literally (here we go) say kuh-lo-thiz. Thats probably phonetically wrong but it just sounds like it is spelled. I was terrible in English though. I don‚Äôt know why I have that habit. I‚Äôm severely random. I get excited about new things, hence the reason I started a blog. I make weird faces and noises. All day, errrryday. But that‚Äôs me. When I‚Äôm really tired I start to get even weirder. Ok, done rambling.","i‚Äôm a very weird person i like taking pictures of everything‚Äliterally i say literally more than the average human being i suppose by saying literally it will enforce the fact that what i am saying is so literal that you can have zero questions about it its weird i have an odd obsession with pronouncing words correctly people make fun of me and the way i say ‚Äúclothes‚Äù i literally here we go say kuhlothiz thats probably phonetically wrong but it just sounds like it is spelled i was terrible in english though i don‚Äôt know why i",99,"have","i","51D","has","51D","you","4","that","4",0.629999999997381,FALSE
"372","As much as she enjoys making the pint-size desserts, Colleen seems to have just as much fun naming them, particularly since it allows her to blend her two loves: food and music.","as much as she enjoys making the pintsize desserts",10,"colleen","to","31A","choose","2","colleen","2","desserts","21",0.470000000001164,TRUE
"373","I started a blog about a year and a half ago, but after about 10 or 15 entries that were just so damn depressing, I stopped. I think maybe a couple of my friends were reading, but I decided that no one should be subjected to my despondent ramblings.","i started a blog about a year and a half ago but after about or entries that",18,"were","were","4","were","3","were","31B","i","32A",0.540000000000873,TRUE
"374","These disciplines are indicative only, as papers","these disciplines are",4,"indicative","not","31A","so","31A","few","31A","rules","31A",0.139999999999418,FALSE
"375","12. Get Up","get",2,"up","day","2","us","2","get","2","lost","2",0.0500000000029104,FALSE
"376","You can set your own rules and your own standards. I live on my writing income, so if I'd written three wonderful novels and not yet sold them, that would be a failure. If you're a full-time pilot with five children and no partner, writing two pages might be a massive success. Be realistic.","you can set",4,"your","own","4","own","3","your","31A","your","4",0.32999999999447,TRUE
"377","As well as Kouhaku, the sun rising over Mount Fuji was broadcast on live on tv, and I ate soba! So that was my fairly authenic seeing-in of the new year. By the way, my Chinese horoscope is Dragon, so 2012 is my year!","as well as kouhaku the sun rising over mount fuji was broadcast on live on tv and i ate soba so that was my fairly authenic seeingin of the new year by the way my chinese horoscope",38,"is","is","3","dragon","2","horoscope","31B","mom","42F",0.540000000000873,TRUE
"378","I hope you‚Äôre enjoying your weekend! For us it is a four day weekend! Woot Woot!","i hope you‚Äôre enjoying",5,"your","it","32A","are","2","in","2","it","2",0.269999999996799,FALSE
"379","Paris Cookbook Festival","paris cookbook",3,"festival","country","2","early","2","love","2","festival","2",0.120000000002619,TRUE
"380","I really need to start planning more seriously before buying. And then follow through on those plans. Before Christmas I had a vague, half formed idea in my head that it would be really good to make dried apricots in brandy as a gift for my lovely mother. Sadly, time ran away with me and they never did get made. I did accomplish the first step of the plan to make them though... I bought the dried apricots. Really quite a lot of apricots as it happens, because the Kilner jar I was planning on using can take quite a lot of fruit and I thought having a few spare wouldn't be a problem.","i really need to start planning more seriously before buying and then follow through on those plans before christmas i had a vague half formed idea in my head that it would be really good to make dried apricots in brandy as a gift for my lovely mother sadly time ran away with me and they never did get made i did accomplish the first step of the plan to make them though i bought the dried apricots really quite a lot of apricots as it happens because the",90,"kilner","the","31B","because","32C","is","3","bad","3",0.559999999997672,FALSE
"381","I always pictured us on that frame with a huge family.","i always pictured us on that frame",8,"with","a","4","frame","41C","a","3","with","31A",0.680000000000291,TRUE
"382","Take an optimist viewpoint. Look for the opportunity in a seemingly ‚Äúbad‚Äù situation.","take an optimist viewpoint look for",7,"the","for","31B","boys","3","heartbeat","3","the","3",0.400000000001455,TRUE
"383","Right here we have a cross-pollination of a zombie flick, jungle action, Rambo shoot-em-up, voodoo horror and Friday the 13th gore job. This is like a discount closeout at the Everything Must Go Cliche Store with macho mercenaries, damsels in distress, harrowing escapes, creatures leaping out of the shadows, shocking bloody effects and an ending that is as nihilistic as it is stupid. It's like the film-makers had to do something with all of these leftovers from every other movie made in 1989 so they lumped them all in here, slapped a title on it and hoped for the best.","right here we have a crosspollination of a zombie flick jungle action rambo shootemup voodoo horror and friday the th gore job this is like a discount closeout at the everything must go cliche store with macho mercenaries damsels in distress harrowing escapes creatures leaping out of the shadows shocking bloody effects and an ending that is as nihilistic as it is stupid its like the filmmakers had to do something with all of these leftovers from every other movie made in so they lumped them all",88,"in","in","4","all","41C","in","31A","day","42D",0.75,TRUE
"384","I jumped off the tram at the University stop and headed down to the Bath to see if it was open, but as we all now know it wasn't, though teasingly the lights were on. So I popped in Betty's for a fishcake butty (my evening meal) before heading up to Harrisons 1854. Here the Deception was back on form so I had a pint or two of that and caught up with Barraharri before I made the rash decision to go and get some late tipples at Dada.","i jumped off the tram at the university stop and headed down to the bath to see if it was open but as we all now know it wasnt though teasingly the lights were on so i popped in bettys for a fishcake butty my evening meal before heading up to harrisons here the deception was back on form so i had a pint or two of that and caught",71,"up","up","4","and","52J","you","41C","up","31A",0.720000000001164,TRUE
"385","Soaring Spirit","soaring",2,"spirit","the","2","and","2","pink","2","quality","2",0.0799999999944703,FALSE
"386","Someone once said to me that if you have been to one wedding, you have been to them all - and yes this someone was the cynical architect with the colourful jumpers and no heart who sits next to me in the office... but my response to him was this:","someone once said to",5,"me","that","4","to","41C","me","31A","me","31B",0.5,TRUE
"387","Which brings me to Recording Software.","which brings",3,"me","to","3","it","3","the","3","with","3",0.150000000001455,FALSE
"388","Charles, The Duke of Radcliffe, never expects to see this girl again after he‚Äôd seduced and released her. Charles is painfully aware that he should never have touched the chit delivered to his bed by mistake, but the young beauty is just too tempting, and watching the next morning as she is ostracized by an unforgiving Ton only complicates matters. Unable to stand by as Madison‚Äôs future is ripped from her, The Duke, who has inexplicably fallen for the lady he soiled and deserted, makes plans to forge a new future for Madison, a future where he is her husband‚Ä¶whether she likes it or not.","charles the duke of radcliffe never expects to see this girl again after he‚Äôd seduced and released her charles is painfully aware that he should never have touched",29,"the","the","3","touched","31B","have","42F","last","2",0.599999999998545,TRUE
"389","Frank Zappa and the Mothers","frank zappa",3,"and","the","3","the","2","and","3","mothers","2",0.17000000000553,TRUE
"390","Where await the spectral ships on the crimson tide","where await the",4,"spectral","spectral","3","the","31B","spectral","21","of","31A",0.279999999998836,TRUE
"391","One day, I‚Äôd like to be in a drama. If I were to pick a genre, it‚Äôd be romantic comedy. Personally, I want my love life to be like a drama-like too.","one day i‚Äôd like to be in a drama",10,"if","if","51A","if","51B","i","4","if","41A",0.970000000001164,TRUE
"392","I will never claim to be a genius or a scholar, but as a gardener, I've observed the best solar around! Have you noticed all the pictures of flowers in this post? They've been directly powered by the sun too.","i will never claim to be a genius or a scholar but as a gardener ive observed the best solar around have you noticed all the pictures of flowers in",31,"this","this","4","post","3","this","31B","this","3",0.5,TRUE
"393","7:20: I toast up some frozen waffles for Junebug.","i",2,"toast","wait","2","spent","2","longer","2","together","2",0.0499999999956344,FALSE
"394","Margarita, my favorite dance partner from Los Consagrados milonga also goes to the Sunday afternoon Confiteria Ideal milonga and had been trying to get me to come for quite some time, so I finally decided to check it out. I had fun dancing several tandas with her there. Afterwards I walked over to my regular Sunday night milonga at El Beso.","margarita my favorite dance",5,"partner","the","31B","this","31B","from","31B","and","2",0.220000000001164,FALSE
"395","Place 1 tbsp filling in the center of each wonton wrapper. Brush the edges of the wrappers with egg, and pinch the edges to seal into a square.","place tbsp filling in the center of each wonton wrapper brush",12,"the","the","3","brush","31B","wrapper","32C","the","21",0.529999999998836,TRUE
"396","We operate in strict ways, for the benefit and survival of the pack. Everyone is important and everyone has their role to play. It is easy and everyone understands.","we operate in strict ways for the benefit and survival",11,"of","the","3","survival","31B","the","42E","and","42F",0.560000000004948,FALSE
"397","Mike Pinder- Keyboards/Vocals","mike pinder",3,"keyboardsvocals","at","21","him","21","join","21","said","21",0.0599999999976717,FALSE
"398","Pure Shiraz from the Medlands vineyard on the Barossa Valley floor.","pure shiraz from the medlands vineyard on the barossa",10,"valley","valley","3","floor","2","the","32C","valley","2",0.5,TRUE
"399","The ‚ÄúPuffy-Shirt‚Äù from the ‚ÄúPuffy-Shirt‚Äù episode is on display in the Smithsonian.","the ‚Äúpuffyshirt‚Äù",3,"from","york","21","menu","21","hand","21","century","21",0.0299999999988358,FALSE
"400","‚ÄúAnd it happened, in the spring of the year, at the time kings go out to battle, that Joab led out the armed forces and ravaged the country of the people of Ammon, and came and besieged Rabbah. But David stayed at Jerusalem. And Joab defeated Rabbah and overthrew it.‚Äù 1 Chronicles 20:1","‚Äúand it happened in the spring of the year at the time kings go out to battle that joab led out the armed forces and ravaged the country of",30,"the","the","4","the","3","the","51C","it","51C",0.660000000003492,TRUE
"401","I have two stories I would like to tell today, the first is both humorous and embarrassing. The second involves the published Author Chris D'Lacey","i have two stories i",6,"would","would","4","i","51D","i","41C","like","3",1.15999999999622,TRUE
"402","Spoon out about 1/3 cup of dough for each shortcake onto the baking sheet, leaving about 3 inches of space between the mounds. Pat each mound down until it is between 3/4 and 1 inch high. (The shortcakes can be made to this point and frozen on the baking sheet, then wrapped airtight and kept in the freezer for up to 2 months. Bake without defrosting ‚Äì just add at least 5 more minutes to the oven time.)","spoon out about cup of dough for each shortcake onto the baking sheet leaving about inches of space between the mounds pat each mound down until",27,"it","it","4","is","3","it","31A","down","42F",0.540000000000873,TRUE
"403","I have seen some ebook formatters charge outrageous fees for enhanced ebooks doing no more than what I do as part of my standard service, to me this is highway robbery. I usually charge a nominal fee for each external link (mostly less than .25 per link to write and insert the code) but I have seen some business charge $200 ‚Äì $400 more on top of the formatting and conversion charge.","i have seen some ebook formatters charge outrageous fees for enhanced ebooks doing no more than what i do as part of my standard service to",27,"me","to","31B","pay","3","service","32C","this","3",0.55000000000291,FALSE
"404","To answer that question, we need to think about the speed of the moral revolution that has pushed this question to the forefront of our culture. In less than a generation, homosexuality has gone from being almost universally condemned to being almost fully normalized in the larger society.","to answer that question we need to think about the speed of the moral revolution that has pushed this question to the forefront of our culture in less than",30,"a","a","4","than","41C","a","31A","less","42F",0.609999999993306,TRUE
"405","Who ran to help the elderly couple?","who ran",3,"to","in","3","help","3","to","3","over","3",0.120000000002619,TRUE
"406","After church I decided to wander over to the library and see if it's open on Sundays (it isn't), and on the way there I stopped at the Commonwealth Avenue mall. (Mall as in ""long, narrow park"", not ""place where you drink an Orange Julius and wish you had money"".)","after church i decided to wander over to the library and see if its open on sundays it isnt and on the way there i stopped at the commonwealth avenue mall mall",33,"as","as","4","in","3","as","31A","as","31B",0.5,TRUE
"407","Favorite song?","favorite",2,"song","the","2","of","2","as","2","you","2",0.069999999999709,FALSE
"408","One morning I was laying in bed praying about an ""Titanic idea"" when the prodigal son story popped into my mind. Was it possible that the seed of the idea I had so many years prior fit on the Titanic? I dug back through my old computer files and found the original prologue. Then, in my mind's eye, the story of a younger son, an older son, a woman who cared for them both--and the loving father--played out in my mind.","one morning i was laying in bed praying about an titanic idea when the prodigal son story popped into my mind was it possible that the seed of the idea i had so many years",36,"prior","years","51D","years","41C","many","52J","was","4",0.809999999997672,FALSE
"409","(Non police readers who want to know more about what a ‚Äòduty inspector does - or police officers, for that matter! ‚Äì should read the bottom few paragraphs, which outline the role a bit more.)","non police readers who want to know more about what a ‚Äòduty inspector does or police officers",18,"for","officers","31B","on","3","for","3","police","32C",0.5,TRUE
"410","(waits for laughter to die down)","waits for laughter to",5,"die","die","4","down","3","die","31B","laughter","32C",0.390000000006694,TRUE
"411","A few weeks back, I was an enjoying a dinner with some good friends. Over dinner, the conversation turned to ice cream (this is a common occurrence when you hang out with me). Specifically, my friends expressed their delight at being members of the Dairy Queen Blizzard Fan Club. Every couple of months, they receive coupons for free Blizzards. All this time, DQ had been handing out free ice cream I‚Äôd been paying full price like a chump! Not long after we parted ways, I too signed up for the DQ Blizzard Club. Over the past few weeks, my husband has signed up, my sisters have signed up, and if it were allowed I‚Äôd get my cat to sign up too. I‚Äôve now become accustomed to a weekly Blizzard, with or without coupons. It‚Äôs crossed over to that dangerous place when I eat an item of food so much I give it an obnoxious nickname. Observe:","a few weeks back i was an enjoying a dinner with some good friends over dinner the conversation turned to ice cream this is a common occurrence when you hang out with me specifically my friends expressed their delight at being members of the dairy queen blizzard fan club every couple of months they receive coupons for free blizzards all this time dq had",65,"been","been","4","had","51D","had","41C","handing","3",0.719999999993888,TRUE
