"","origLine","wordsToPredictBy","wordNoToTest","testWord","prediction1","source1","prediction2","source2","prediction3","source3","prediction4","source4","timeToPredict","Correct"
"179","Audi‚Äôs Q3 is an interesting proposition. It‚Äôs aimed squarely at the BMW X1 and offers decent performance from a range of small petrol and diesel engines. Combining sporty premium SUV features in a compact body, the Q3 range starts at R370,000. It looks a little ordinary but its strength will be in ride, road holding and luxury interior. In a move that is most unlike Audi, there are some really funky colours available for the Q3. Google ‚ÄúSamoa Orange‚Äù if you don‚Äôt believe me.","audi‚Äôs q is an interesting proposition it‚Äôs aimed squarely at the bmw x and offers decent performance from a range of small petrol and diesel engines combining sporty premium suv features in a compact body the q range starts at r it looks a little ordinary but its strength will be in ride road holding and luxury interior in",60,"a","a","4","move","3","a","31A","a","31B",0.629999999997381,TRUE
"180","I also purchased various dried herbs- these are often served on a Greek salad and mixes for making authentic tzatziki. And of course some real Feta cheese. Rich and creamy, salty, moist and slightly sour, semi-solid and certainly not hard and tasteless like you often find here.","i also purchased",4,"various","a","2","extra","2","various","2","to","31B",0.180000000000291,TRUE
"181","As if these were not enough of a reason for both to remember the fixture, Alan Ball broke his leg by, in his own words, sitting on it. That injury kept the England midfielder out of his country‚Äôs end of season tour; the FA had to do something given England‚Äôs failure to qualify for the World Cup finals in West Germany that summer.","as if these were not enough of a reason for both to remember the fixture alan ball broke his leg by in his own words",26,"sitting","words","51D","words","41C","own","52J","on","3",0.739999999997963,FALSE
"182","Although there is beautiful scenery, ‚ÄúTreasure Island‚Äù takes an unflinching look at the hardships of the seafaring life and features genuine tension. After the camp silliness of ‚ÄúPirates of the Caribbean,‚Äù the authenticity is refreshing. As for all the stabbing and the like, well, as Long John Silver says, without violence or the threat of it, ‚Äúother men take what‚Äôs yours and they live the life that should be yours.‚Äù","although there is beautiful scenery ‚Äútreasure island‚Äù takes an unflinching look at the hardships of the seafaring life and features",21,"genuine","genuine","3","and","32C","a","2","this","31B",0.510000000002037,TRUE
"183","The cellphone number was not answered on Sunday, however.","the cellphone number",4,"was","was","3","number","31B","was","21","of","31A",0.239999999997963,TRUE
"184","Excellent hook! I can‚Äôt imagine anyone not wanting to read what comes after that. Let‚Äôs reel ‚Äòem in with an excerpt ‚Ä¶ three sentences long! Yep, that‚Äôs it. Three!","excellent hook i can‚Äôt imagine anyone not wanting to read what comes after that let‚Äôs reel ‚Äòem",18,"in",NA,NA,NA,NA,NA,NA,NA,NA,NA,FALSE
"185","I also have no idea what she's eating, how much she's exercising, what she's learning, how she's learning, whether she's tidying up after herself, whether she's minding her manners, how she's spending her money, what music she's listening to, how much TV she's watching, whether she's brushing her teeth and wearing her retainers, and so on and so on. I don't ask, she doesn't offer, I just don't know.","i also have no idea what shes eating how much shes exercising what shes learning how shes learning whether shes tidying up after herself whether shes minding her manners how shes spending her money what music shes listening to how much tv shes watching whether shes brushing her teeth and wearing her retainers and so on and so on i dont",62,"ask","ask","51A","ask","51B","dont","51D","she","4",1.28000000000611,TRUE
"186","Won‚Äôt force it because to break this beautiful cycle would be suicide.","won‚Äôt force it because to break this beautiful",9,"cycle","cycle","3","beautiful","31B","the","32C","to","32C",0.629999999997381,TRUE
"187","I slammed on my brakes and surveyed the scene. I could hardly breathe and was momentarily overwhelmed with the sights and sounds of those few seconds. As a neighbor and Mr. Dorsey rushed to Michael‚Äôs aid I turned around and rode as fast as I could to his house, back up the hill on Rittenhouse and a right turn onto 48th Avenue. A block later as I turned left, onto our street, I passed Michael‚Äôs five-year old sister Sandy at the corner and shouted to her as I passed, ‚ÄúMichael‚Äôs been hit by a car!‚Äù Climbing the stairs to their front porch I pounded on the open screen door and shouted inside repeating to his parents what I had just told Sandy moments before. His dad rushed out the door and leaped from their porch yelling frantically ‚ÄúWhere? Where?‚Äù I said ‚ÄúDown the hill on Rittenhouse Street!‚Äù I struggled on my bike to keep up with Michael‚Äôs father as he ran like a racehorse to his son‚Äôs side. Michael‚Äôs mother arrived soon behind as I watched from a short distance away.","i slammed on my brakes and surveyed the scene i could hardly breathe and was momentarily overwhelmed with the sights and sounds of those few seconds as a neighbor and mr dorsey rushed to michael‚Äôs aid i turned around and rode as fast as i could to his house back up the hill on rittenhouse and a right turn onto th avenue a block later as i turned left onto our street i passed michael‚Äôs fiveyear old sister sandy at the corner and shouted to her as i passed ‚Äúmichael‚Äôs been hit by a car‚Äù climbing the stairs to their front porch i pounded on the open screen door and shouted inside repeating to his parents what i had just told sandy moments before his dad rushed out the",130,"door","door","4","the","41C","door","31A","out","42F",0.669999999998254,TRUE
"188","-Necklace-J Crew Factory","necklacej crew",3,"factory","crew","21","that","2","these","2","thought","2",0.110000000000582,FALSE
"189","There‚Äôs lots to talk about in the wonderful world of CurrantC‚Ñ¢. Mother‚Äôs Day is right around the corner and we‚Äôre featuring a new gift basket, perfect for mom. It contains our now famous Dark Chocolate with Black Currants, our brand new delicious Black Currant coulis, a beautiful fragrant currant candle, CurrantC‚Ñ¢ All Natural Black Currant Nectar and delicious and healthy genuine dried Black Currants. Click here to order.","there‚Äôs lots to talk about in the wonderful world of currantc‚Ñ mother‚Äôs day is right around the corner and we‚Äôre featuring a new gift basket",26,"perfect","perfect","3","basket","41C","basket","31B","gift","42F",0.569999999999709,TRUE
"190","if there was some malice afoot; after all, these had generally been allies of the British, culturally and historically, and their exclusion and segregation may have been intended to create an artificial rift in this historical symbiosis on the part of an unashamedly anti-British regime.","if there was some malice afoot after all these had generally been allies of",15,"the","the","4","the","3","the","31B","the","31A",0.489999999997963,TRUE
"191","We lost touch after that as we were living very different lives. One day as I was bravely pushing a double pram up a hill in my local shopping centre, his mother walked by. She stopped to chat and I proudly showed off my two babies. I asked how my ex was doing and she told me that he was about to be married for the second time, and that he had recovered from ‚Äòhis breakdown‚Äô. Immediately I remembered the shaking hands and the lost look in his eye. So the past had caught up with him after all.","we lost touch after that as we were living very different lives one day as i was bravely pushing a double pram up a hill in my local shopping centre his mother walked by she stopped to chat and i proudly showed off my two babies i asked how my ex was doing and she told me that he was about to be married for the second time and that he had recovered from ‚Äòhis breakdown‚Äô",77,"immediately",NA,NA,NA,NA,NA,NA,NA,NA,NA,FALSE
"192","As kings and queens bow and play for you","as kings and",4,"queens","queens","4","queens","31B","you","3","bow","3",0.280000000006112,TRUE
"193","The following recipe for homemade chocolate ice cream posted by Joana is too tempting to pass up. The next week is littered with time in the community, so it will be long, hot days sitting on concrete floors in pagodas and listening to translations. (It's surprising how tiring translations can be.) Chocolate ice cream would be a nice treat ...","the following recipe for homemade chocolate ice cream posted by joana is too tempting to pass up the next week is littered with time in the community so it will be long hot days sitting on concrete floors in pagodas and listening to translations its surprising how",48,"tiring","how","31B","i","31A","do","31A","a","21",0.479999999995925,FALSE
"194","He is not wrapped in warm garment,","he is not wrapped",5,"in","in","5","in","4","in","41A","in","41B",0.540000000000873,TRUE
"195","The first time I saw the end of Michelangelo Antonioni‚Äôs L‚ÄôEclisse I felt I had been caught off guard, disoriented. The film ends with a string of desolate shots without any narrative progression, shown one after another. For most of the film we had been following the drama of the central characters. Suddenly, for the last seven minutes, the characters we have come to know have disappeared ‚Äî and yet the film continues. We see deserted streets, shadows, anonymous strangers. Without the characters to ground us in story, the presence of the camera itself seems stronger. We become aware of it as an apparatus, a seeing-device that acts as its own separate entity. There is camera movement (panning, following a figure walking on a street) which suggests that something is about to be revealed; it seems Antonioni is trying to tell us something. There are some wide, long takes from above that slowly pan around as if surveying the streets. Trees rustle in the wind. A man in a suit rounds a corner. A toddler looks up at his mother. A close up of a man‚Äôs earlobe. A stream of water flows into the gutter. ‚ÄúYes, what is it Antonioni?‚Äù I remember thinking, ‚ÄúWhat are you trying to show us?‚Äù I was searching for meaning, for story. A streetlamp burns brightly. The music crescendos. The film is over. There is an elegance to this sequence that I cannot quite explain.","the first time i saw the end of michelangelo antonioni‚Äôs l‚Äôeclisse i felt i had been caught off guard disoriented the film ends with a string of desolate shots without any narrative progression shown one after another for most of the film we had been following the drama of the central characters suddenly for the last seven minutes the characters we have come to know have disappeared ‚Äî and yet the film continues we see deserted streets shadows anonymous strangers without the characters to ground us in story the presence of the camera itself seems stronger we become aware of it as an apparatus a seeingdevice that acts as its own separate entity there is camera movement panning following a figure walking on a street which suggests that something is about to be revealed it seems antonioni is trying to tell us something there are some wide long takes from above that slowly pan",155,"around","as","3","pan","31B","slowly","32C","around","3",0.459999999999127,TRUE
"196","If this is your first novel, there's a lot of merit to the advice I hear from established writers: put the first one under the bed, and write the next.","if this is your first novel theres a lot of merit to the advice i hear from established writers",20,"put","her","32C","by","21","the","2","a","2",0.430000000000291,FALSE
"197","Through trial and error I have found what works for me and what doesn't.","through trial and error i have found what works for me and what",14,"doesnt","doesnt","4","doesnt","31A","and","42F","time","41C",0.669999999998254,TRUE
"198","06-Eyesight To The Blind","eyesight to the",4,"blind","the","31B","front","3","service","3","the","3",0.220000000001164,FALSE
"199","They've never really done one before and I have to say, this one was quite a doozy! Our backyard is right at the tee box of a golf course, so they sat in our yard and caught all the golfers passing. At 25 cents a cup (and they sold some cookies for 50 cents each) $15 total is not a bad profit! They were stoked. And wanted to do it again the next day. I told them they couldn't or the city might shut them down for making too much money. :)","theyve never really done one before and i have to say this one was quite a doozy our backyard is right at the tee box of a golf course so they sat in our yard and caught all the golfers passing at cents a cup and",47,"they","they","5","and","51D","sold","4","they","41A",0.860000000000582,TRUE
"200","as the baby Jesus","as the baby",4,"jesus","jesus","4","jesus","31A","the","3","i","3",0.260000000002037,TRUE
"201","I finished the whole costume by putting on more clay divets.","i finished the whole costume by",7,"putting","putting","3","by","41C","by","31B","by","32B",0.529999999998836,TRUE
"202","‚ÄòOh, I don‚Äôt mind,‚Äô she said. ‚ÄòI‚Äôm in no hurry. I‚Äôm on my way to a hospice.‚Äô","‚Äòoh i don‚Äôt mind‚Äô she said",7,"‚Äòi‚Äôm","was","3","he","3","i","3","those","3",0.389999999999418,FALSE
"203","We laugh about it now, but it wasn't funny then.","we laugh",3,"about","it","3","about","3","the","2","a","2",0.139999999999418,TRUE
"204","As I walk with you I'm learning","as",2,"i","way","2","go","2","moved","2","new","2",0.0500000000029104,FALSE
"205","Writers worry a lot about theft and plagiarism. They really don't need to; theft of unpublished work is so rare as to be functionally nonexistent. It's not till your work is published--i.e., exposed to a wide audience--that the issue of plagiarism comes into play.","writers worry a lot about theft and plagiarism they really dont need to theft of unpublished work is so rare as to be functionally nonexistent its not till your work is publishedie exposed to a wide audiencethat the",39,"issue","first","31A","issue","21","of","32C","shot","32C",0.439999999995052,TRUE
"206","Just another feeling.","just",2,"another","one","2","another","2","say","2","want","2",0.0500000000029104,TRUE
"207","I got a bit carried away and assumed that a couple of good performances in the Carling Cup augured a fine career. I mean, if that was how well they could play on their debuts then they could only improve from there, right?","i got a bit carried",6,"away","away","4","carried","41C","and","3","away","31A",0.669999999998254,TRUE
"208","I have been so busy.","i have",3,"been","say","3","not","3","seen","3","an","3",0.110000000000582,FALSE
"209","60,000 - The number of people in Zimbabwe now infected by cholera, according to the World Health Organization (WHO). Cholera has now claimed the lives of more than 3,000 people in Zimbabwe. The epidemic of the disease, has been fueled by the collapse of Zimbabwe‚Äôs water, sanitation and health systems. Many hospitals have shut down and most towns suffer from poor water supply, broken sewers and uncollected waste. With the upcoming rainy season even more infections could occur as water sources become contaminated.","the number of people in zimbabwe now infected by cholera according to the world health organization who cholera has now claimed the lives of more than people in zimbabwe the epidemic of the disease has been fueled by the collapse of zimbabwe‚Äôs water sanitation and health systems many hospitals have shut down and most towns suffer from",58,"poor","poor","3","from","31B","suffer","32C","the","21",0.510000000002037,TRUE
"210","We demand immediate release of the 11 arrested along with all other activists.","we",2,"demand","like","2","work","2","the","2","of","2",0.0299999999988358,FALSE
"211","Im lame but I dont read often!! hah if I could chose one book it would be twilight, the last book, because it is really the only book I can remember reading in the past few years.","im lame but i dont read often hah if i could chose one book it would be twilight the last book because it is really the only book i can",31,"remember","remember","4","can","41C","can","51D","list","51D",0.860000000000582,TRUE
"212","June 21, 2011 ‚Äî A defence-called forensic botanist challenges the prosecution‚Äôs theory of when the body was placed at the crime scene. An expert in analytical chemistry who works with Dr. Vass challenges the process of testing for the presence of chloroform.","june ‚Äî a defencecalled forensic botanist challenges the prosecution‚Äôs theory",11,"of","that","2","when","2","food","2","body","2",0.279999999998836,FALSE
"213","The poor Gaga-a-like stood there, tears tripping her, till she were pushed into the wall and the hordes chased the ticket-stealer.","the poor gagaalike stood there tears tripping her till she were pushed into the wall and the",18,"hordes","hordes","4","the","41A","the","41C","hordes","31A",0.720000000001164,TRUE
"214","Let's go where they keep on wearin'","lets go",3,"where","with","3","they","3","up","3","walk","3",0.180000000000291,FALSE
"215","Tomorrow a favourite colour palette of mine, until then, check out some more of my stitched book paper pieces here.","tomorrow a",3,"favourite","favourite","3","ill","21","are","21","i","21",0.120000000002619,TRUE
"216","Can you see her with little white pumpkins dancing across her mantel for Thanksgiving?","can you see her with little white pumpkins dancing across her mantel",13,"for","for","3","thanksgiving","2","mantel","31B","her","32C",0.519999999996799,TRUE
"217","Start Proclaiming Life and Power!","start proclaiming",3,"life","and","2","life","2","get","21","the","21",0.069999999999709,TRUE
"218","Nmachi‚Äôs, which means ‚Äúbeauty of God‚Äù in Nigerian, joins sisters Chisom, four, and Dunebi, two.","nmachi‚Äôs which means ‚Äúbeauty of god‚Äù in nigerian joins",10,"sisters","joins","31B","chisom","2","joins","21","sisters","2",0.410000000003492,TRUE
"219","Make Real Estate Work for the City ‚Äì especially in the cases of cities like Baltimore and Detroit which have declined from larger populations, there is a huge untapped potential in the vacant housing and real estate for economic development. First, rehabilitation of vacant housing and real estate can be the foundation for a direct job creation program with extremely valuable production. Second, selling that housing cheaply (in the case of Baltimore for a dollar) or just giving it away to working people literally spreads the wealth while expanding the city‚Äôs tax base. As occupancy rates in these properties rise, so does the value of housing and land the city owns ‚Äì building up the Metropolitan Reserve Banks in turn. Third, it can provide a real solution for homelessness by just giving people a key to an apartment and access to facilities.","make real estate work for the city ‚Äì especially in the cases of cities like baltimore and detroit which have declined from larger populations",25,"there","larger","32C","the","2","is","2","country","2",0.32999999999447,FALSE
"220","MEA CULPA follows one angels quest to save his best friend.","mea culpa follows one",5,"angels","angels","3","one","31B","follows","32C","angels","21",0.30000000000291,TRUE
"221","So I've made the move across the country - I actually made the move in June, but I wouldn't say that I've really settled in until now. I've got a job, I just moved into a new apartment in Portland, and I really feel like I'm beginning my life out here.","so ive made the move across the country i actually made the move in june but i wouldnt say that ive really settled in until now ive got a job i just moved into a new apartment in portland and i really feel like",45,"im","im","4","like","41C","you","42A","blab","42D",0.779999999998836,TRUE
"222","And if you missed LM's previous planning posts on CB, you can catch up right here:","and if you missed lms previous planning posts on",10,"cb","cb","4","you","3","cb","31A","cb","31B",0.480000000003201,TRUE
"223","Director: Mark Goldblatt","director",2,"mark","the","2","rial","2","school","2","mark","2",0.0499999999956344,TRUE
"224","I‚Äôd never even thought about this point ‚Äì that there‚Äôs free, fun exercise equipment for kids all over the place, but nothing similar for grownups ‚Äì until our recent trip to Heerenveen, in the Netherlands, and discovered that such a thing actually exists. Right in downtown Heerenveen, there‚Äôs a park with ‚Ä¶.","i‚Äôd never even thought about this point ‚Äì that there‚Äôs free fun exercise equipment for kids all over the place but nothing similar for grownups ‚Äì until our recent trip to heerenveen in the netherlands and discovered that such a thing actually exists right in downtown heerenveen there‚Äôs",49,"a","the","21",NA,NA,NA,NA,NA,NA,0.310000000004948,FALSE
"225","However, they have a new EP coming out in a month and a bit with a song on it called The Wrong Car. I think they may have finally made a song I'm going to love more than Cold Days From The Birdhouse. I've had it on repeat since I first heard it last week - it's that good.","however they have a new ep coming out in a month and a bit with a song on it called the wrong car i think they may have finally made a song im going to",36,"love","to","51D","to","41C","going","52J","to","42C",0.779999999998836,FALSE
"226","I started playing with some old schoolers recently because I just lost the spark to run anything. I wanted to play. GM burnout you know! I was somewhat disappointed that with this old school group Pathfinder was the only game being played. Damn. I made a Wizard who was a Necromancer.","i started playing with some old schoolers recently because i just lost the spark to run anything i wanted to play gm burnout you know",26,"i","i","4","know","41C","i","31A","you","42F",0.669999999998254,TRUE
"227","Produce C-G to H such that C-G =G-H Produce B-C to D such that C-D =2‚Äù","produce cg to h such that cg",8,"gh","gh","5","gh","4","gh","51A","gh","51B",1.13999999999942,TRUE
"228","The Good: A must read. Stassen accomplishes much with few pages (less than 80!) and few words. He tells of life before and after the Genocide; he includes the various factions and entities present, from the UN peacekeeping force to the Rwandan Patriotic Front to the Interahamwe. The brevity helps; too many words would drown this story. The simplicity emphasizes the horror.","the good a must read stassen accomplishes much with few pages less than and few words he tells of life before and after the genocide he includes the various factions and entities present from the un peacekeeping force to the rwandan patriotic front to the interahamwe the brevity helps too many words would drown",55,"this","this","3","story","2","drown","31B","would","42F",0.520000000004075,TRUE
"229","The year before last, for example, I took advantage of the economy direct flights to Pisa and took an apartment in the centre of Lucca, a short train ride away. Last year, I flew to Rome, and after spending a couple of days there, took the train up to the Tuscany/Umbria border, where I collected a car to drive the short distance to my rented apartment in a village near Lake Trasimeno.","the year before last for example i took advantage of the economy direct flights to pisa and took an apartment in the centre",24,"of","of","4","of","31A","the","42F","a","3",0.609999999993306,TRUE
"230","The home should be a place of joy and laughter. Your home should be fun! Fun for your kids, fun for friends to come over, fun between you and your spouse. People want to ""hang out"" in places they enjoy with people they enjoy. Make your home that place.","the home should be a place of joy and laughter your home should be fun fun for your kids fun for friends to come over fun between you and",30,"your","your","4","and","41C","you","42F","your","31B",0.690000000002328,TRUE
"231","I'll tell you about this in a later blog, it gets worse. For now all I'll say is be prepared to rough it as a runner.","ill tell you about this in a later blog it",11,"gets","gets","5","gets","4","it","51D","gets","41A",0.930000000000291,TRUE
