"","origLine","wordsToPredictBy","wordNoToTest","testWord","prediction1","source1","prediction2","source2","prediction3","source3","prediction4","source4","timeToPredict","Correct"
"1","We love you Mr. Brown.","we love you mr",5,"brown","brown","5","brown","4","brown","3","brown","41A",0.610000000000582,TRUE
"2","With graduation season right around the corner, Nancy has whipped up a fun set to help you out with not only your graduation cards and gifts, but any occasion that brings on a change in one's life. I stamped the images in Memento Tuxedo Black and cut them out with circle Nestabilities. I embossed the kraft and red cardstock with TE's new Stars Impressions Plate, which is double sided and gives you 2 fantastic patterns. You can see how to use the Impressions Plates in this tutorial Taylor created. Just one pass through your die cut machine using the Embossing Pad Kit is all you need to do - super easy!","with graduation season right around the corner nancy has whipped up a fun set to help you out with not only your graduation cards and gifts but any occasion that brings on a change in ones life i stamped the images in memento tuxedo black and cut them out with circle nestabilities i embossed the kraft and red cardstock with tes new stars impressions plate which is double sided and gives you fantastic patterns you can see how to use the impressions",83,"plates","the","52J","simple","42E","the","42F","by","41C",0.809999999997672,FALSE
"3","If you have an alternative argument, let's hear it! :)","if you have an",5,"alternative","elvis","41B","to","41C","or","41C","cups","41C",0.440000000002328,FALSE
"4","Other friends have similar stories, of how they were treated brusquely by Laurelwood staff, and as often as not, the same names keep coming up. About a half-dozen friends of mine refuse to step foot in there ever again because of it. How many others they‚Äôre telling - and keeping away - one can only guess.","other friends have similar stories of how they were treated brusquely by laurelwood staff and as often as not",20,"the","the","5","the","4","not","51D","the","41A",0.94999999999709,TRUE
"5","Although our beloved Cantab can‚Äôt claim the international recognition afforded the Station Inn, otherwise these two joints feel like twins separated by nothing more than distance. They share a complete lack of pretense that can‚Äôt be imitated or approximated. Their very ordinariness makes them special.","although our beloved cantab can‚Äôt claim the international recognition afforded the station inn otherwise these two",17,"joints","two","31B","yoga","3","these","32C","books","3",0.440000000002328,FALSE
"6","Peter Schiff: Hard to tell. It will look pretty bad for most Americans when prices will go way up and they can‚Äôt afford to buy stuff. It could also get very bad as far as loss of individual liberty. A lot of people will blame it on capitalism, on freedom, and they will claim we need more government. It could be used as an impetus for more regulation, which would be a disaster, or it could be an impetus to get rid of all the regulation that was causing the problem. But whether we will do the right or the wrong thing here in America, there will be a lot of pain first. We got some serious problems we have to deal with, but we are not dealing with the problems, we only make the problems worse.","peter schiff hard to tell it will look pretty bad for most americans when prices will go way up and they can‚Äôt afford to buy stuff it",28,"could","could","4","it","41C","also","3","could","31A",1.11000000000058,TRUE
"7","3. Winter is the time when all sleeps on some level. It is a time of turning within to make contact with your own innermost being. Winter is the best time to do this and, as a result, get answers for yourself about whatever concerns you. It is also a tremendously creative time, a time for artists of all kinds to turn within and to seek images of forms he or she wishes to produce in whatever medium chosen, so that an image of balance can be presented. Those of you that write, we suggest that you do so to come up with plots and ideas that will speak of balance coming to an imbalanced situation, person, or world. To those of you who, like Priscilla, work with making patterns and designs, we would say remember the images and designs brought about by winter. White will challenge you to see what changes will manifest in the images you produce. We ask that you do this in your own environment.","winter is the time when all sleeps on some level it is a time of turning within to make contact with your own innermost being winter is the best time to do this and as a result get answers for yourself about whatever concerns you it is also a tremendously creative time a time for artists of all kinds to turn within and to seek images of forms he or she wishes to produce in whatever medium chosen so that an image of balance can be presented those of you",91,"that","who","4","who","31A","do","4","of","32C",0.519999999996799,FALSE
"8","Pure large leaf Assam. No waffling with the leaf, thank you. I want it strong and dark with no herby frills. And for goodness sake no fruit mixers and no sweetener. Why would you do that to tea?","pure large leaf assam",5,"no","no","4","no","3","waffling","2","no","31A",0.389999999999418,TRUE
"9","State contracts worth over 100 MILLION ringgit!","state contracts worth over million",6,"ringgit","million","31B","barrels","3","ringgit","3","over","32C",0.400000000001455,TRUE
"10","We attend our friend Kendra's wedding -- such a joy to watch people see an end to year's of waiting.","we attend our friend",5,"kendras","friend","41C","friend","31B","amy","3","kendras","3",0.360000000000582,TRUE
"11","Fallout by Ellen Hopkins (p.1-140)","fallout by ellen hopkins",5,"p","p","4","p","3","p","2","p","31A",0.44999999999709,TRUE
"12","Either Obama/Congress, etc. give in or, more likely, refuse. The group announces that the next device will be detonated in a populated area, with no warning. Again, ‚ÄúObama,‚Äù et al., refuse to submit. This time the device is detonated in a mid-sized to major city. Tens of thousands die. (Think the atomic bombs that ended WWII.)","either obamacongress etc give in or more likely refuse the group announces that the next device will be detonated in a populated area with no warning again ‚Äúobama‚Äù et al refuse to submit",34,"this","submit","41C","to","42F","foot","31B","time","3",0.580000000001746,FALSE
"13","for I did not come to condemn the world but to save the world.","for i did not come to condemn the world but to save",13,"the","the","4","save","41C","the","31A","to","42F",0.720000000001164,TRUE
"14","Come join us next Tuesday February 21 st for discussion on Chapter 3. We will talk about personal will, self control and the ability to stay true to ourselves as we travel through this life. The gathering is fun, free and another opportunity to meet new people.","come join us next tuesday february st for discussion on chapter we will talk about personal will self control and the ability to stay true to ourselves as we travel through this life the gathering is fun free and",40,"another","another","4","and","41C","another","31B","of","3",0.639999999999418,TRUE
"15","""The ANC had earlier approached the South Gauteng High Court to grant us leave to appeal its earlier ruling that the singing of the freedom song was unconstitutional and fitted the crime of incitement.","the anc had earlier approached the south gauteng high court to grant us leave to appeal its earlier ruling that the singing of the freedom song was unconstitutional and fitted the crime of",34,"incitement","incitement","3","of","41C","crime","42F","the","51C",0.659999999996217,TRUE
"16","Prepare chicken fillets by flattening out a little on a board- They need to be thin and able to 'roll up' with a filling.","prepare chicken fillets by flattening out a little on a board they need to be thin and able to roll up",22,"with","with","5","up","51D","a","4","with","41A",0.870000000002619,TRUE
"17","It's a sickening feeling.","its a sickening",4,"feeling","feeling","3","feeling","2","idea","31B","for","31B",0.180000000000291,TRUE
"18","Complaining and repeating everything we already know every day will do you no good if you do not even have a dog as an early warning system or you allow your daughters to go gallivanting in the streets at night.","complaining and repeating everything we already know every",9,"day","theo","41C","will","3","day","3","from","31B",0.459999999999127,TRUE
"19","How many times have you heard someone say that so-and-so is too nice to tell the person they‚Äôre seeing that they want to call it quits, too nice to address unfair working conditions with their employer or too nice to ask someone to stop using that seat on the subway as a foot stool? There certainly are people who are soft-spoken and decidedly non-confrontational. But that doesn‚Äôt mean they‚Äôre nicer relative to everyone else. It‚Äôs just their personality. You can be assertive, honest and even outspoken and still be a very nice person.","how many times have you heard someone say that soandso is too nice to tell the person they‚Äôre seeing that they want to call it quits too nice to address unfair",32,"working","the","42F","and","31B","unfair","31B","as","2",0.489999999997963,FALSE
"20","Hmmm... In terms of traditional instruments we have things like a zither, a euphonium and a harmonium in there and I think a nose flute made it to the finished mix too. But I'm no Harry Partch or even Thomas Truax come to that. Life's hard enough. Having said that, I wouldn't mind having a bash on Truax's Mother Superior!","hmmm in terms of traditional instruments we have things like a zither a euphonium and a harmonium in there and i think a nose flute made it to the finished mix too but im no harry partch or even thomas truax come to that lifes hard",47,"enough","enough","3","hard","41C","hard","31B","lifes","42F",0.5,TRUE
"21","On The Lovin‚Äô People, he has the benefit of a good backing band consisting of Pretty Purdie on drums, Artie Butler on organ & piano, and Joe Mack and Bill Salter on bass. The band, who play both loose and funky without ever sounding sloppy, helped produce a more laid back vibe and Chandler sounds more relaxed than he did on the earlier album. He has some better songs on this one, too, such as the title cut warm, poppy number about...well, ‚ÄúLovin‚Äô People,‚Äù on which the presence of a chorus (made up on the spot of people who had gathered to provide assistance to a mothers‚Äô help organization) also helps temper Chandler‚Äôs unfortunate tendency towards over-earnestness. ‚ÄúThe Naked Fool‚Äù is about a relationship gone bad, which doesn‚Äôt have anything new to say but will have a few toes tapping. ‚ÄúSold Out, No More Reservations‚Äù is an interesting number about a male groupie, and ‚ÄúBound to Fly‚Äù has a nice soaring quality, and Chandler‚Äôs lyrics and delivery mesh well on it. If anything the problem here is that Chandler is sometimes eclipsed by his backing band‚Äîcheck ‚ÄúBehind Your Eyes‚Äù where the band goes off on some nice free jazz-psychedelic tangents while Chandler seems to be trying to channel Sammy Davis, Jr.","on the lovin‚Äô people he has the benefit of a good backing band consisting of pretty purdie on drums artie butler on organ piano and joe mack and bill salter on bass the band",35,"who","who","5","who","4","who","41A","who","41B",0.80000000000291,TRUE
"22","Thus began my frantic sprint down the corridor, pulling my reluctant suitcase as it bobbed off of anything in its path.","thus began",3,"my","my","3","my","21","in","21","i","21",0.169999999998254,TRUE
"23","M. Blakeman Ingle","m",2,"blakeman","the","2","is","2","last","2","h","2",0.0600000000049477,FALSE
"24","Actually, this April 15, 1912, headline was based on preliminary news and was in error. The final tally shows that 1,513 lives were lost in the sinking of the Titanic, and there were only 711 survivors.","actually this april headline was based",7,"on","based","31B","giving","3","on","3","was","32C",0.479999999995925,TRUE
"25","the autumn rains in righteousness.","the autumn",3,"rains","in","3","in","2","rains","3","project","2",0.160000000003492,TRUE
"26","I found myself chuckling out loud enough that the wife banished me to the easy chair in the living room at night (can't read this one in bed). I'd get up to get another soft drink and find that I had a big grin on my face.","i found myself chuckling out loud enough that the wife banished me to the easy chair in the living room at night cant read this one in bed id get up to get",34,"another","get","51D","out","41B","get","52D","get","52G",1.08999999999651,FALSE
"27","- Food and drink disliking. I‚Äôm not really sure what the correct term is for this, but I developed a dislike for almost all of the foods that I once liked, and couldn‚Äôt drink fizzy pop at all! I think I may have literally lived on pickled onion space raiders and fruit juice for the entire first trimester‚Ä¶and possibly a lot of the second.","food and drink disliking i‚Äôm not really sure what the correct term is for this but i developed a dislike for almost all of the foods that i once liked and couldn‚Äôt drink fizzy pop at all i think i may have literally lived on pickled onion space raiders and fruit juice for the entire",56,"first","first","4","lemon","51D","entire","41C","first","31A",0.830000000001746,TRUE
"28","Of course it goes without saying that all the music above would probably have been familiar to Gardel's audience, too. But it's not that widely known here. It's not difficult or inaccessible music, but it's not a routine part of the popular culture in the same way that it would have been when Gardel was playing El dia que mi quieras, or even as it was when my grandmother's relations were making their own entertainment in Australia with performances of Bizet's Au fond du temple saint.","of course it goes without saying that all the music above would probably have been familiar to gardels audience too but its not that widely known here its not difficult or inaccessible music but its not a routine part of the popular culture in the same way that it would have been when gardel was playing el dia que mi quieras or even as it was when my grandmothers relations were making their own entertainment",76,"in","in","3","salsas","32B","own","32C","have","2",0.519999999996799,TRUE
"29","We talked for a few minutes, and I thanked the secretaries for taking care of my son, and I suggested we go home. My son aggreed and said thank you to the secretaries and placed a death grip on my hand and didn't let go all the way to the parking lot.","we talked for a few minutes and i thanked the secretaries for taking care of my son and i suggested we go home my son aggreed and said thank you to the secretaries and placed a death grip on my hand and didnt let",45,"go","all","4","let","41C","didnt","52J","all","3",0.620000000002619,FALSE
"30","In shrouds of words,","in",2,"shrouds","past","2","same","2","end","2","morning","2",0.0500000000029104,FALSE
"31","Valentines Day falls on February 14th each year. It is a holiday in which lovers express said love for each other, traditionally with flowers, candle lit dinners, heart shaped things, chocolate and greeting cards. The first Valentines cards were hand written but over time have made way for more mass produced greetings. These cards, for the most part, depict images of hearts, cupids and love struck victims.","valentines day falls on february th each year it is a holiday in which lovers express said love for each other traditionally with flowers candle lit dinners heart shaped things chocolate and greeting cards the",36,"first","most","3","the","31B","cards","32C","first","3",0.519999999996799,TRUE
"32","Nicholas Ridley agreed with the Act of Supremacy, supporting Henry‚Äôs action. He became the king‚Äôs chaplain and later, in the time of Edward VI, he was Bishop of Rochester. He helped to write the Book of Common Prayer. He became Bishop of London and worked to improve the conditions of the poor.","nicholas ridley agreed with the act of supremacy supporting henry‚Äôs action he became the king‚Äôs chaplain and later in the time of edward vi he was bishop of rochester he helped to write the book of common prayer he became bishop of london and worked",46,"to","to","4","worked","41C","no","3","to","31A",0.669999999998254,TRUE
"33","‚ÄúYes,‚Äù he said. ‚ÄúMaybe a puppet, or a special toy, or maybe just a stuffed animal you loved very much. Did you have a special friend like that, Tom?‚Äù","‚Äúyes‚Äù he said ‚Äúmaybe a puppet or",8,"a","a","4","special","3","a","31B","a","3",0.510000000002037,TRUE
"34","Outfit Specs: Click piccy to be taken to it's flickr page for more information.","outfit specs",3,"click","click","3","piccy","2","click","2","i","21",0.169999999998254,TRUE
"35","When PC came out with the ""Love You a Latte"" Lite Cartridge I knew I had to have it!","when pc came out with the love you a latte lite cartridge i knew i",16,"had","i","41C","going","4","i","32B","going","3",0.599999999998545,FALSE
"36","How can you start your day any other way than happy with that face wanting to cuddle with you first thing?","how can",3,"you","get","3","start","3","take","3","pull","3",0.139999999999418,FALSE
"37","And that is where we changed from being social beings amongst each other to digital social addicts.","and that is where we changed from being social beings amongst each other to digital social",17,"addicts","social","31B","work","31A","media","31A","the","32C",0.470000000001164,FALSE
"38","The product is a milky white liquid that applies like emulsion, not too creamy and thick, but not like water (or jelly) either. After spreading it out on your face, it dries within a few minutes. After which the fun begins! According to the SA, after it dries, you start rubbing it like you‚Äôre trying to rub dirt off your face, until you rub off most of it. If required, wash off the remaining with lukewarm water. So I started rubbing and it actually takes quite a bit of effort to rub it all off! It comes off in little bits like you‚Äôre rubbing off a layer of your skin.","the product is a milky white liquid that applies like emulsion not too creamy and thick but not like water or jelly either after spreading it out on your face it dries within a few minutes after which the fun begins according to the sa after it dries you start rubbing it like you‚Äôre trying to rub dirt off your face until you rub off most of it if required wash off the remaining with lukewarm water so i started rubbing and it actually takes quite a bit of effort to rub it all off it",97,"comes","comes","5","it","51D","off","4","comes","41A",1.12000000000262,TRUE
"39","I have mixed emotions about the start to this book. As I‚Äôve already mentioned I very much enjoyed the characters and the voice of the protagonist. But as much as I was enjoying it, it took me a little while to get into the story. We‚Äôre presented with a huge case of insta-love right from the start. Lucas, the mysterious and hot new neighbor, comes on strong. I‚Äôm pretty sure they start making out on their second or third meeting! I‚Äôm warning you now. There‚Äôs not a lot of rationalization for the insta-love‚Ä¶you won‚Äôt really understand the reasons until the end of the book. Which is why, in retrospect, I kinda like that I had to wait for all of the info to be revealed.","i have mixed emotions about the start to this book as i‚Äôve already mentioned i very much enjoyed the characters and the voice of the protagonist but as much as i was enjoying it it took me a little while to get into the story we‚Äôre presented with a huge case of instalove right from the start lucas the mysterious and hot new neighbor comes on strong i‚Äôm pretty sure they start making out on their second or third meeting i‚Äôm warning you now there‚Äôs not a lot of",90,"rationalization","done","41C","of","32B","of","41C","of","31B",0.519999999996799,FALSE
"40","""If I could keep you little,","if i could keep",5,"you","you","5","you","4","you","41A","you","41B",0.510000000002037,TRUE
"41","After catching a cab to dinner at Boon Tong Kee (post to come shortly), a restaurant recommended by my uncle - also a foodie! :) - we dragged ourselves back onto the HiPPO boat for one last ride, to capture the nighttime experience and views.","after catching a cab to dinner at boon tong kee",11,"post","post","4","kee","41C","to","3","post","31A",0.680000000000291,TRUE
"42","C.A.T. is looking for more pictures of cute animals with their tongues sticking out. Email cuteanimaltongues at gmail dot com with yours!","cat is looking for more pictures of cute animals with their tongues sticking out email cuteanimaltongues",17,"at","email","32C","my","21","or","21","en","21",0.360000000000582,FALSE
"43","And there you have it ‚Äì something which can‚Äôt be ignored","and there you have it ‚Äì something which can‚Äôt",10,"be","been","21","turn","21","the","21","of","21",0.290000000000873,FALSE
"44","individually and as a band in the studio, along with interviews","individually and as",4,"a","as","31B","soon","3","a","3","as","3",0.220000000001164,TRUE
"45","to do this in remembrance of Him. Luke 22:19","to do this in",5,"remembrance","own","4","other","41B","as","41C","just","41C",0.419999999998254,FALSE
"46","Frightful's Daughter Meets the Baron Weasel (2007) - Picture Book","frightfuls daughter meets the",5,"baron","planet","3","the","31B","baron","3","the","21",0.279999999998836,TRUE
"47","Her father smiled. ""They take just a tiny bit of your qi, your soul energy, when you're initiated and at various other points during your time there. I don't know how, but they make gold from it.""","her father smiled they take just a tiny bit of your qi your soul energy when youre initiated and at various",22,"other","other","4","other","31A","from","3","at","32C",0.580000000001746,TRUE
"48","The City Council prefers to manage the council housing instead of an Arms Length Management Organisation in order to ‚Äúsave money by not having a separate organisation‚Äù.","the city council prefers to manage the council housing instead of an arms length management organisation in order to ‚Äúsave",21,"money","the","41C","some","41C","out","41C","miss","41C",0.459999999999127,FALSE
"49","This stuff is actually happening. It‚Äôs threatening our survival. And it‚Äôs not just the environment. And I‚Äôm writing it to know that, among the peaceful: you are not crazy for thinking that we are approaching a turning point in our country where the realities of decades of profit-over-all-else mentality are becoming not just undeniable, but are confronting us in our day to day lives in ways we did not think was possible in a country that now seems, in retrospect, to have been the least Western, least democratically-minded country to be considered so. And that turning point might require widespread civil disobedience, in the name of the environmental and economic survival of our country and our people (as well, of course, as the vast masses like us all around the world, in other countries).","this stuff is actually happening it‚Äôs threatening our survival and it‚Äôs not just the environment and i‚Äôm writing it to know that among the peaceful you are not crazy for thinking that we are approaching a turning point in our country where the realities of decades of profitoverallelse mentality are becoming not just undeniable but are confronting us in our day to day lives in ways we did not think was possible in a country that now seems in retrospect to have been the least western least democraticallyminded country to be",92,"considered","be","31B","work","31B","able","3","way","3",0.430000000000291,FALSE
"50","I decided to get creative with the leftovers of the rainbow cake... instead of doing the mini cupcake rainbow I had planned. It worked out SO well and I don't think it turned out too bad.","i decided to get creative with the leftovers of the rainbow cake instead",14,"of","instead","31B","cake","42F","a","42E","of","3",0.599999999998545,TRUE
"51","At the back of the shop there is a little cafe which is the pretence of this post- the menu is pretty simple, just fry ups (¬£3.50) sandwiches (around ¬£1.50) and jacket potatoes (around ¬£2). I had a tuna mayo salad and a latte which came to a grand total of ¬£3.50.","at the back of the shop there is a little cafe which is the pretence of this post",19,"the","the","4","the","31A","year","51D","post","51D",0.970000000001164,TRUE
"52","Sunday the festivities continued. I went BACK to Shadowbox to see Back to the Garden again. (Told ya I love that place). Then after that was over, I had to work at the store. It was Survivor finale night, and we do a special Survivor crop each season, so I had to go host that.","sunday the festivities continued i went back to shadowbox to see back to the garden again told ya i love that place then after that was over i had to work at the store it was survivor finale night and we",42,"do","a","4","we","41C","we","32B","do","4",0.480000000003201,TRUE
"53","He grabs my arm and yanks me around to face him. I slam into his chest with a thud that jars my bones and knocks the fight right out of me. I stumble back, away from him, and fold my arms across my chest to cover the logo of Sam‚Äôs sweatshirt.","he grabs my arm and yanks me around to face him i slam into his chest with a thud that jars my bones and knocks the",27,"fight","fight","4","fight","3","the","41C","knocks","42F",0.619999999995343,TRUE
