"1201","#TriviaMonday @ 8pm, warm up now! Who said: ""When you are a man, sometimes you wear stretchy pants in your room. It's for fun.""","pm warm up now who said when you are a man sometimes you wear stretchy pants in your room",20,"its","said","lol","fun","every","friends","set","drama","stays","events","except",0,FALSE
"1202","Wish I had a girl :(","wish i had a",5,"girl","feeling",NA,NA,NA,NA,NA,NA,NA,NA,NA,0.0100000000020373,FALSE
"1203","~ RT : We still have reservations available for Easter Brunch... Call and make your reservations now 202.661.2700","rt we",3,"still",NA,NA,NA,NA,NA,NA,NA,NA,NA,NA,NA,FALSE
"1204","Joint birthday party?","joint",2,"birthday","birthday","western",NA,NA,NA,NA,NA,NA,NA,NA,0.0199999999967986,TRUE
"1205","i want to! i miss the north west :(","i want to i miss the",7,"north","u","guys","much","still","love","retweet","place","friday","ill","amazing",0.0100000000020373,FALSE
"1206","Where are you to be cold like that?","where are you",4,"to","going","gonna","guys","coming","on",NA,NA,NA,NA,NA,0.0199999999967986,FALSE
"1207","Woo!!!! Thanks for the follow gang! We set up our collection bin last week!","woo thanks for the follow gang we set up our collection bin",13,"last","last",NA,NA,NA,NA,NA,NA,NA,NA,NA,0.0100000000020373,TRUE
"1208","Free coffee was Tuesday.","free coffee was",4,"tuesday","lol","late","forgot","silly","achieved","brewed","cumin","lovers","myselfhappy","paper",0.0200000000040745,FALSE
"1209","Omg, are you at LOEX? I'm so jealous! Was just following the loex tag and saw you here!","omg are you at loex im so jealous was just following the loex",14,"tag","im","tag",NA,NA,NA,NA,NA,NA,NA,NA,0,TRUE
"1210","Haven't even seen in a week and he can't even go to dinner with me what the fuck.","havent even seen in a week and he cant even go to dinner with me",16,"what","point","will","fuck","top","cheese","salad","date","delish","relaxing","rest",0,FALSE
"1211","Families are like fudge... mostly sweet with a few nuts. ~Author Unknown","families are like",4,"fudge","really","like","going","im","see","us","good","one","boys","clown",0.0199999999967986,FALSE
"1212","Visiting #ASU Libraries archival project to process & catalog six bilingual collections on Mexican-American history in the Southwest.","visiting libraries archival project to process catalog six bilingual collections on",12,"mexicanamerican",NA,NA,NA,NA,NA,NA,NA,NA,NA,NA,NA,FALSE
"1213","so should 46, 19, 17, according to most. Need more from everyone.","so should",3,"according",NA,NA,NA,NA,NA,NA,NA,NA,NA,NA,NA,FALSE
"1214","I need a trip to Cali and quick.... well when it warms up","i need a trip to cali and quick",9,"well","birthday","well","stay","move","cuz","absorbing",NA,NA,NA,NA,0.0199999999967986,TRUE
"1215","hello there","hello",2,"there","new","hello","ya","friends","ian","kitty","longest","missouri","rain","valerie",0,FALSE
"1216","And the dream was that she was in Hollywood. And that Arthur supported her ambitions.","and the dream was that she was in hollywood",10,"and","arthur","sights",NA,NA,NA,NA,NA,NA,NA,NA,0,FALSE
"1217","or any packers jersey, anywhere, anytime....acceptable??","or any",3,"packers",NA,NA,NA,NA,NA,NA,NA,NA,NA,NA,NA,FALSE
"1218","Nothing great was ever achieved without enthusiasm - Ralph Waldo Emerson","nothing great was",4,"ever","seeing",NA,NA,NA,NA,NA,NA,NA,NA,NA,0.0100000000020373,FALSE
"1219","Anybody who watches three games of football in a row should be declared brain dead.","anybody who watches three games of football in a row",11,"should","computer","white","declared",NA,NA,NA,NA,NA,NA,NA,0,FALSE
"1220","#ThingsiLoveToSee Elderly Couples ..","elderly",2,"couples","couples",NA,NA,NA,NA,NA,NA,NA,NA,NA,0,TRUE
"1221","1 of our favorite furry feline friends (say THAT 12 times fast!) just went to the vet. First time since his nuggets were chopped.","of our favorite",4,"furry","kind","time","years","people","album","news","interview","part","tv","quote",0.0299999999988358,FALSE
"1222","yes man.","yes",2,"man","yes","rt","can","maam","sir","go","know","just","glad","sure",0.0200000000040745,FALSE
"1223","Pretty sure that's in violation of something. City Ordinance...","pretty sure thats in",5,"violation","great","true","point","real","fantastic","okay","just","im","ready","year",0.0199999999967986,FALSE
"1224","Having some technical difficulties","having some technical",4,"difficulties","business",NA,NA,NA,NA,NA,NA,NA,NA,NA,0,FALSE
"1225","I was impressed by the awesome beer selection & great staff recommendations at Bayview's Cafe Centraal. Definitely going back.","i was impressed by the awesome",7,"selection","rt","night","just","time","welcome","favorite","people","awesome","beer","show",0.0100000000020373,FALSE
"1226","Follow Us ! Support #TeamJayTate !","follow",2,"us","back","follow","please","us","u","d","friday","ill","get","glad",0,TRUE
"1227","Only Like 6 People In My Class , This S*** Crazy !!!","only like people in",5,"my","my",NA,NA,NA,NA,NA,NA,NA,NA,NA,0.0199999999967986,TRUE
"1228","Great to visit with George Benson today before the game.","great to visit with george benson today before",9,"the","going","good","excited","fun","thanks","got","much","want","im","see",0,FALSE
"1229","That is awful! Best of luck getting it back.","that",2,"is",NA,NA,NA,NA,NA,NA,NA,NA,NA,NA,NA,FALSE
"1230","IAN! hope all is well...working on getting the band back into place, and a new record.","ian hope all is wellworking",6,"on","getting",NA,NA,NA,NA,NA,NA,NA,NA,NA,0.0199999999967986,FALSE
"1231","A Bulls player get hurt every damn game. Ya'll training staff suck lol","a bulls player",4,"get","go","get","made","month","named","kyle",NA,NA,NA,NA,0,TRUE
"1232","Thank god.","thank",2,"god","much","rt","god","im","though","service","one","happy","great","everyone",0.0100000000020373,TRUE
"1233","4:30 was way to early to wake up.","was way",3,"to","go","get","can","end","back","want","find","though","home","start",0.0199999999967986,FALSE
"1234","making jerseys backstage lol","making jerseys",3,"backstage","pretty","backstage",NA,NA,NA,NA,NA,NA,NA,NA,0,TRUE
"1235","Its a shame they had a rat in the house","its",2,"a",NA,NA,NA,NA,NA,NA,NA,NA,NA,NA,NA,FALSE
"1236","OSI fellowship application submitted!","osi",2,"fellowship","fellowship",NA,NA,NA,NA,NA,NA,NA,NA,NA,0,TRUE
"1237","thanks for following!!","thanks for",3,"following","the","following","making","sharing","being",NA,NA,NA,NA,NA,0,TRUE
"1238","All that I know I learned after I was thirty. Georges Clemenceau","all that i",4,"know","dont","was",NA,NA,NA,NA,NA,NA,NA,NA,0.0200000000040745,FALSE
"1239","Love it! #Orioles RT : Yep, can't stand that a**hole!","love it rt yep cant stand that",8,"ahole","said","hate","foot","alone","ahole",NA,NA,NA,NA,NA,0.0199999999967986,TRUE
"1240","I'm hearing an alarm go off and it's not in this house.. That's one loud alarm clock!!","im hearing",3,"an","radio","alarm","beats",NA,NA,NA,NA,NA,NA,NA,0.0100000000020373,FALSE
"1241","#moodle 2.2. mobile app will let you download course content to your mobile device to read/view","mobile",2,"app","app","site","device",NA,NA,NA,NA,NA,NA,NA,0,TRUE
"1242","Greg Bailey formally announces his presidential campaign for 2012.","greg bailey",3,"formally","formally",NA,NA,NA,NA,NA,NA,NA,NA,NA,0.0199999999967986,TRUE
"1243","#Google. Famazing. Thanks to Les Paul & props to the 'sha.","famazing thanks to les paul",6,"props","look","quite","b","jones","bostaph","budnitz","duguid","props",NA,NA,0.0100000000020373,TRUE
"1244","Good news is that for the first time in 5 games we somehow made it through a whole game w/o anyone getting hurt!","good",2,"news","morning","luck","thing","day","one","start","time","cause","point","question",0.0199999999967986,FALSE
"1245","Where Are You Moving :o","where are",3,"you","you",NA,NA,NA,NA,NA,NA,NA,NA,NA,0,TRUE
"1246","Summer Nights is awesome.","summer nights",3,"is","work","hour","episode","awesome","real","game","aint","shooting","rest","left",0.0100000000020373,FALSE
"1247","i find the sarah phillips story fascinating, though i must confess i dont understand 1 word of it //glad i'm not the only one","i find the sarah",5,"phillips","trying","phillips","silverman","vowells",NA,NA,NA,NA,NA,NA,0.0200000000040745,TRUE
"1248","a well deserved break. Thanks Learning Times and Adam for hosting the Virtual conference. Really good sessions.","a well deserved",4,"break","just","break",NA,NA,NA,NA,NA,NA,NA,NA,0,TRUE
"1249","Actor Tom Savini of ""Night of the Living Dead"" fame, completed work on Cartoon Network's ""Aqua Teen Hunger Force"".","actor tom savini",4,"of","night",NA,NA,NA,NA,NA,NA,NA,NA,NA,0.0199999999967986,FALSE
"1250","mention me i followed u","mention me i followed",5,"u","u","wouldnt","soy",NA,NA,NA,NA,NA,NA,NA,0.0100000000020373,TRUE
"1251","Just knowing that you're hurting, makes me hurt too.","just knowing that youre hurting makes me hurt",9,"too","night","get","u","every","ask","doesnt","lil","others",NA,NA,0.0199999999967986,FALSE
"1252","When something you Want/Desire says 'No'...AWESOME!","when something you wantdesire",5,"says","says",NA,NA,NA,NA,NA,NA,NA,NA,NA,0,TRUE
"1253","I guess I've always needed to be needed by someone. It's a comforting feeling being under someone's thumb.","i guess ive always needed to be needed by someone its a",13,"comforting","beautiful",NA,NA,NA,NA,NA,NA,NA,NA,NA,0.0100000000020373,FALSE
"1254","When This Song Come On I'm Spending Money","when this song come",5,"on","check","see","soon","say","now","get","back","im","new","dont",0.0199999999967986,FALSE
"1255","Happy with the win, but I wish our ""leader"" would start playing like one consistently","happy with the win but i wish",8,"our","it",NA,NA,NA,NA,NA,NA,NA,NA,NA,0,FALSE
"1256",":)....I'm so happy my husband has left a couple for you to enjoy!","im so happy my husband has left a",9,"couple","us","old","stay","something","stage","couple","vote","second","mall","lames",0,TRUE
"1257","""u made my days better just by 1 word,I love u l'll see u tomorrow because I couldn't live my life without u","u made my days better just by wordi love u lll see u",14,"tomorrow","r","know","like","still","love","dont","never","ever","u","get",0,FALSE
"1258","Good god, is there anything that NATO isn't going to complicate this weekend?","good god is there anything that nato isnt going to",11,"complicate","be","bed","have","the","go","win","sleep",NA,NA,NA,0.0100000000020373,FALSE
"1259","...it's fair to say that we always think of ACH in its global context and not as a regional DH association. [-]","its fair to say that we always think of ach in its global context and not",17,"as","everyones","regional",NA,NA,NA,NA,NA,NA,NA,NA,0.0199999999967986,FALSE
"1260","why that one?","why",2,"that",NA,NA,NA,NA,NA,NA,NA,NA,NA,NA,NA,FALSE
"1261","Fingers crossed we can join everyone at Farragut Friday with our new spring menu =)","fingers crossed we can join everyone at farragut friday with",11,"our","night","get","morning","going","im","new","year","good","still","th",0.0300000000061118,FALSE
"1262","Tattoos tomorrow! So excited :)","tattoos tomorrow so",4,"excited","morning","night","though","friend","happy","excited","dont","can","take","first",0.0199999999967986,TRUE
"1263","I guess that explains a lot","i guess",3,"that","think","sure","year","lol","people","th","thats","ill","way","offer",0.0100000000020373,FALSE
"1264","Happy Friday!","happy",2,"friday","birthday","mothers","new","happy","thanksgiving","joy","hour","friday","easter","holidays",0.0199999999967986,TRUE
"1265","I think you mean backcourt...and I wouldn't say ""far better"" however I'm a fan as well. And these were chosen before tourney","i think you",4,"mean","will","like","time","really","might","last","now","know","going","im",0.0100000000020373,FALSE
"1266","Let's just all admit Soccer is better than basketball! (:","lets just all admit soccer is",7,"better","better","great","weekend","goal","ice",NA,NA,NA,NA,NA,0.0199999999967986,TRUE
"1267","3:38 p.m ah my least favorite time of the day!","pm ah my least favorite",6,"time","kind","time","years","people","album","news","interview","part","tv","quote",0.0100000000020373,TRUE
"1268","You hear that sound off in the distance? That's the sound of the fail boat coming to pick up the Brewers","you hear that",4,"sound","can","are","could","back","rt","say","enjoyed","well","song","tell",0.0200000000040745,FALSE
"1269","I am too young to feel this old.","i am too young",5,"to","feel","people","lady","age","soul","needs","advertising","moms","youth",NA,0.0199999999967986,FALSE
"1270","What color bracelet do you have?","what color",3,"bracelet","want","made","yet","bracelet","jealous","shoe",NA,NA,NA,NA,0.0100000000020373,TRUE
"1271","CONGRATS!!! Got married 4 years ago today - and she still talks to me!","congrats got married years ago",6,"today","im","dont","today","havent","didnt","highest","oo","sticking","wasted",NA,0,TRUE
"1272","I called this over a year ago, sticking to it... Tebow will be a DOLPHIN.. Phins will overpay","i called this over a year ago sticking to it tebow will",13,"be","get","never","post","follow","make","one","ever","help","take","first",0,FALSE
"1273","Some Mondays require special circumstance to get going: Quad Latte is in order this am. Happy pre-Super Bowl week.","some mondays require special circumstance to get going quad latte is in order",14,"this","now","happy","say","tonight","card","water",NA,NA,NA,NA,0.0199999999967986,FALSE
"1274","#3wordsforyou I want you . :/","i want",3,"you","to",NA,NA,NA,NA,NA,NA,NA,NA,NA,0.0100000000020373,FALSE
"1275","Thanks for the follow - glad we connected. Happy Easter!","thanks for the follow glad we",7,"connected","like","im","liked","got","see","make","happy","great","can","help",0.0199999999967986,FALSE
"1276",""": Check up on it!"" Tht was my jam","check up on",4,"it","week","us","next","movie","facebook","lose","sweet","favorites","brand","giant",0.0100000000020373,FALSE
"1277","school bro","school",2,"bro","tomorrow","district","like","time","im","thing","year","never","help","work",0,FALSE
"1278","I try but I just dont feel the fun anymore. It hasn't been fun since Christmas, and emotionally significant since Valentine","i try but i just dont feel the fun anymore it hasnt been fun since",16,"christmas","im","us","u","probably","win","way","birds","christmas","moved","shot",0.0199999999967986,TRUE
"1279","who was the most famous 1950's saxophone player? go.","who was the",4,"most","best",NA,NA,NA,NA,NA,NA,NA,NA,NA,0,FALSE
"1280","just now saw this. That calorie count seems way off. Heh","just now saw this that",6,"calorie","police","us","one","tweet","s","life","top","chris","press","tweets",0.0300000000061118,FALSE
"1281","USC lost to Stanford last I checked...","usc lost to stanford last i",7,"checked","night","year","nights","day","week","tweet","one","weekend","name","person",0.0199999999967986,FALSE
"1282","So proud of my fellow UP Church Choir Member Kim Yarbrough on The Voice 2!","so proud of my fellow up church choir member kim yarbrough",12,"on","voice",NA,NA,NA,NA,NA,NA,NA,NA,NA,0,FALSE
"1283","uggh, -__-. lemme find out who did it, ill whoop ass. its ok, not your fault. :/","uggh lemme find out who did it ill whoop its",11,"ok","ass",NA,NA,NA,NA,NA,NA,NA,NA,NA,0.0100000000020373,FALSE
"1284","loverly. Lit committee hashed over Pulitzer mess (fiction)","loverly",2,"lit","lit",NA,NA,NA,NA,NA,NA,NA,NA,NA,0.0199999999967986,TRUE
"1285","This got a little park and recreation going tonight..","this got a little park and",7,"recreation","weekend","black","project","afternoon","chula","la","concert","recreation",NA,NA,0.0100000000020373,TRUE
"1286","no shit. Just starting that myself. Wiskey Travels. Take it with you to Starbucks or something.","no just starting that myself wiskey travels",8,"take","take",NA,NA,NA,NA,NA,NA,NA,NA,NA,0.0199999999967986,TRUE
"1287","#AtJustinsParty the best thing to wear is a customized Justin T shirt!!!!","the best thing to wear is a",8,"customized","great","must",NA,NA,NA,NA,NA,NA,NA,NA,0,FALSE
"1288","Hey thanks! We're kind of in love with that happening too :-)","hey thanks were kind of",6,"in","like","make","love","free","fun","place","boring","wish","host","professional",0.0100000000020373,FALSE
"1289","#FF TY for the follow, Lorelai, & greetings from Florida. Happy to follow back.","ty for the",4,"follow","follow","rt","first","retweet","next","mention","week","month","and",NA,0,TRUE
"1290","sweet shit. I live in Minneapolis. Let me know if you guys play anywhere on the cities yeah?","sweet i live in minneapolis let me know if you guys play anywhere on",15,"the","else","best","cities",NA,NA,NA,NA,NA,NA,NA,0.0200000000040745,FALSE
"1291","we'll still have to do that photo adventure. I'm counting on it.","well still have",4,"to","make","go","like","time","sure","better","friend","can","play","take",0.0199999999967986,FALSE
"1292","holy moly today is frustrating... ready for it to be over..","holy moly today is frustrating ready for",8,"it","the","some",NA,NA,NA,NA,NA,NA,NA,NA,0.0100000000020373,FALSE
"1293","Masters Home Improvement Uses Oracle Retail Platform to Support New Business Growth","masters",2,"home","home","hes","degrees","champ","finish",NA,NA,NA,NA,NA,0,TRUE
"1294","thanks guys!!!! I can't wait to see you guys either!!!!!! Its gonna be fun!!! Hopefully....","thanks guys i cant wait",6,"to","to",NA,NA,NA,NA,NA,NA,NA,NA,NA,0.0199999999967986,TRUE
"1295","Remember, any tile can be used on a wall, but only floor rated tiles can be used on a floor.","remember any tile can be used on a wall but only floor",13,"rated","lol","expo","rated",NA,NA,NA,NA,NA,NA,NA,0.0100000000020373,TRUE
"1296","milky coffee. paper. pen.","milky coffee",3,"paper","lol","late","forgot","silly","achieved","brewed","cumin","lovers","myselfhappy","paper",0.0199999999967986,TRUE
"1297","Red Letter News??","red letter",3,"news","news","e","daddy","everytime",NA,NA,NA,NA,NA,NA,0.0100000000020373,TRUE
"1298","packing, packing and more packing","packing packing and more",5,"packing","packing","quick","dorm",NA,NA,NA,NA,NA,NA,NA,0.0199999999967986,TRUE
"1299","I hope he does too(:","i hope he does",5,"too","see","great","enjoyed","well","youre","can","u","everything","wonderful","get",0.0100000000020373,FALSE
"1300","Thankful for my business and my very shrewd customers. Thank you #Houston !!!","thankful for my business and my very shrewd customers thank",11,"you","much","rt","god","im","though","service","one","happy","great","everyone",0.0200000000040745,FALSE
"1301","My girls surprised me this morning with the NOOKcolor from Barnes & Noble. Can't find the new book from but still very Cool!","my girls surprised me this morning with the nookcolor from barnes noble cant find the",16,"new","new","like","us","u","people","ill","real","someone","interesting","horrible",0.0199999999967986,TRUE
"1302","It was right then lol sorry bout that, my phone stopped working soon after I wrote that...but somehow it's back from the dead!","it was right then lol sorry bout that my",10,"phone","get","play","take","u","getting","phone","wit","lunch","crazy","jordans",0.0100000000020373,TRUE
"1303","counting the days to #techbowl!","counting the",3,"days",NA,NA,NA,NA,NA,NA,NA,NA,NA,NA,NA,FALSE
"1304","Okay so Freddie Mitchell started doing the ""belt"" in 2003. Aaron Rodgers still does it better.","okay so freddie mitchell started doing the belt in aaron",11,"rodgers","rodgers",NA,NA,NA,NA,NA,NA,NA,NA,NA,0.0199999999967986,TRUE
"1305","Shape of Things by Adam Hood","shape of things by",5,"adam","can","us","really","work","always","said","lol","s","people","happen",0,FALSE
"1306","so it has to be true! How exciting","so it has to be",6,"true","in","done","the","more","like","happy","lame","all",NA,NA,0,FALSE
"1307","That feeling when you feel like you're drifting apart from a really close friend :(","that feeling",3,"when","better","much","gonna","feel","great","u","well","tonight","jesus","extra",0.0100000000020373,FALSE
"1308","Me, too! That's what I was trying to convey. Looks much chewier w/ chocolate marbling.","me too thats what i was trying to convey",10,"looks","looks",NA,NA,NA,NA,NA,NA,NA,NA,NA,0,TRUE
"1309","Woo Hoo #Kings take them out","woo hoo take",4,"them","night","back","care","though","one","joy","show","place","away","look",0,FALSE
"1310","Aw is 23 years old this Saturday:) love you christopher x","aw is years old",5,"this","just","school","friend","still","soon","people","ass","today","guy","high",0.0100000000020373,FALSE
"1311","uh I thought I was following you on instagram! Im justrosystylin ill find u! See u Wednesday!","uh i thought i was following you on instagram",10,"im","follow","im","ouchie",NA,NA,NA,NA,NA,NA,NA,0.0200000000040745,TRUE
"1312","What a drag, Bulls.","what",2,"a",NA,NA,NA,NA,NA,NA,NA,NA,NA,NA,NA,FALSE
"1313","Convincing my little brother that nipples are alien satellites and tell them exactly where you are like a GPS.","convincing my little brother that nipples are alien satellites",10,"and","tell",NA,NA,NA,NA,NA,NA,NA,NA,NA,0,FALSE
"1314","Remember that you are never alone. God is always with you. (a2ib4ue) Let's get it :-)","remember that you are never alone god is always with",11,"you","good","now","like","think","welcome","wanted","love","buy","mind","free",0.0100000000020373,FALSE
"1315","Chopped blowin blue cheese","chopped blowin blue",4,"cheese","glad","money","field","uses","cheese","crowd","dream","sky","suits","tick",0.0199999999967986,TRUE
"1316","umm ""Anything"" and my favorite album has to be ""All For You""","umm anything and my",5,"favorite","else","can","favorite","without","put","life","yet","intriguing","less","nato",0.0100000000020373,TRUE
"1317","We heart Joey Arias! At BESsy for din din!","we heart joey arias at bessy for din",9,"din","din",NA,NA,NA,NA,NA,NA,NA,NA,NA,0.0199999999967986,TRUE
"1318","Don't name your newborn Phil.","dont",2,"name","know","think","care","want","forget","get","miss","really","feel","worry",0.0100000000020373,FALSE
"1319","My little brother has a twitter üëÄ follow him!","my little brother has a twitter",7,"ˇëÄ","account","lets","follow","much","im","welcome","year","excited","getting","look",0,FALSE
"1320","Thts wht I like to hear! RT : Lots of WOMEN ride motorcycles and wear helmets. I'm one of them! :)","thts wht i like to hear rt lots of women ride motorcycles and wear helmets im one",18,"of","of",NA,NA,NA,NA,NA,NA,NA,NA,NA,0.0199999999967986,TRUE
"1321","The Best Show. RT : Get ready! Tonight LIVE IN THE STUDIO comics superstar ! 8-11 PM EST! wfmu.org! RT this!","the best show rt get ready tonight live in the studio",12,"comics","got","right","apart","los","achievements","comics",NA,NA,NA,NA,0.0100000000020373,TRUE
"1322","Barbara Staiffer doing a great job representing NMNH! Muse awards","barbara",2,"staiffer","open","staiffer",NA,NA,NA,NA,NA,NA,NA,NA,0.0200000000040745,TRUE
"1323","Landed, completely by chance, in what could be the best kebab joint in the western hemisphere. The place isn't pretty, but Obama's been here","landed completely by chance in what could be the best kebab joint in",14,"the","birthday","western",NA,NA,NA,NA,NA,NA,NA,NA,0,FALSE
"1324","Love their pulled pork!","love their pulled",4,"pork","one","together","leaving","pork","highway",NA,NA,NA,NA,NA,0,TRUE
"1325","will be listening to bittersweet symphony all day","will be listening to bittersweet",6,"symphony","symphony",NA,NA,NA,NA,NA,NA,NA,NA,NA,0,TRUE
"1326","beat my first A rank","beat my first",4,"a","time","round","day","ever","even","thing","nights","say","lol","minutes",0.0199999999967986,FALSE
"1327","r u still mad at me?","r u still mad",5,"at","got","just","thing","crazy","planet","hatter","ui",NA,NA,NA,0,FALSE
"1328","get one of those bikes with big plastic floating tires and just pedal across the harbor.","get one of those bikes with big plastic",9,"floating","five","floating",NA,NA,NA,NA,NA,NA,NA,NA,0.0100000000020373,TRUE
"1329","Thee best episode was the 3rd episode of the 3rd season cuzz rebecca was there!;)","thee best episode was the rd episode of the rd season cuzz rebecca",14,"was","rebecca",NA,NA,NA,NA,NA,NA,NA,NA,NA,0.0199999999967986,FALSE
"1330","DAMN YOU! Ha ha ha ha","you ha ha ha",5,"ha","ha",NA,NA,NA,NA,NA,NA,NA,NA,NA,0.0100000000020373,TRUE
"1331",":O HAPPY BIRTHDAY!","o",2,"happy","im","happy","can","m","haha","clock","bruce","intrigued",NA,NA,0,TRUE
"1332","Any truth to the rumors of Vick coming to the Bills? Your offense woud be sick with TO and Vick! WOW!","any truth to the rumors of",7,"vick","day","best","world","night","us","year","yr","most","abounding","vick",0.0299999999988358,TRUE
"1333","When Martin Luther King was engaged in his movement, some of these people's ancestors were Dixiecrats, vigilantes, and wishing ill on him","when martin luther king was engaged in his movement some of these peoples ancestors were dixiecrats vigilantes and wishing ill on",22,"him","back","never","go","follow","just","take","check","call","keep","stay",0.0400000000008731,FALSE
"1334","That last tequila shot and I are NOT friends, right ?!?","that last tequila shot and i",7,"are","will","had","know","love","have",NA,NA,NA,NA,NA,0,FALSE
"1335","Something is not better than nothing. Call/e-mail your US Rep and urge them to vote NO on Waxman-Markley. It's not the answer.","something is not better than",6,"nothing","now","place","get","just","time","even","soon","question","watch","show",0.0100000000020373,FALSE
"1336","how about for good behavior you work on my mailing projects? I'm dying over here!","how about for good",5,"behavior","morning","luck","thing","day","one","start","time","cause","point","question",0.0199999999967986,FALSE
