"","origLine","wordsToPredictBy","wordNoToTest","testWord","prediction1","prediction2","prediction3","prediction4","prediction5","prediction6","prediction7","prediction8","prediction9","prediction10","timeToPredict","Correct"
"1","Chad has been awesome with the kids and holding down the fort while I work later than usual! The kids have been busy together playing Skylander on the XBox together, after Kyan cashed in his $$$ from his piggy bank. He wanted that game so bad and used his gift card from his birthday he has been saving and the money to get it (he never taps into that thing either, that is how we know he wanted it so bad). We made him count all of his money to make sure that he had enough! It was very cute to watch his reaction when he realized he did! He also does a very good job of letting Lola feel like she is playing too, by letting her switch out the characters! She loves it almost as much as him.","chad has been awesome with the kids and holding down the fort while i work later than usual the kids have been busy together playing skylander on the xbox together after kyan cashed in his from his piggy bank he wanted that game so bad and used his gift card from his birthday he has been saving and the money to get it he never taps into that thing either that is how we know he wanted it so bad we made him count all of his money to make sure that he had enough it was very cute to watch his reaction when he realized he did he also does",112,"a","get","see","good","found","happens","used","like","know","going","believe",0.0500000000029104,FALSE
"2","Although our beloved Cantab can‚Äôt claim the international recognition afforded the Station Inn, otherwise these two joints feel like twins separated by nothing more than distance. They share a complete lack of pretense that can‚Äôt be imitated or approximated. Their very ordinariness makes them special.","although our beloved cantab can‚Äôt claim the international recognition afforded the station inn otherwise these two joints feel like twins separated by nothing more than distance they share a complete lack of pretense that",35,"can‚Äôt","the",NA,NA,NA,NA,NA,NA,NA,NA,NA,0.0299999999988358,FALSE
"3","I am en-route to Cornwall again. 3/4 months of slog and sun and sea too. Always a job needs doing in a tourist town. I‚Äôm bringing my stuff back from 97 on Friday. Will need to cancel bills before I retreat. Not such a bad thing. Moved to Leeds with promise from Millies. That went nowhere. Move on.","i am enroute to cornwall again months of slog and sun and sea too always a job needs doing in a tourist",23,"town","season","town","group",NA,NA,NA,NA,NA,NA,NA,0.0299999999988358,TRUE
"4","The one thing that was astounding though was the support from the marshals ‚Äì they were all phenomenal for being out in the rain for so long and remaining so cheery and supportive. They were an amazing bunch. Owing to the nature of the course and very few closed roads meant that supporters who knew the area were able to skip around the course and a few people were seen about 5 or 6 times which was also super!!","the one thing that was astounding though was the support from the marshals ‚Äì they were all phenomenal for being out in the rain for so",27,"long","long",NA,NA,NA,NA,NA,NA,NA,NA,NA,0.0199999999967986,TRUE
"5","A neighbor recommended ‚ÄúChasing Fireflies‚Äù by Charles Martin. I‚Äôd never read anything by Martin before, although he was this neighbor‚Äôs favorite author. ‚ÄúFireflies‚Äù is the story of Chase, a journalist who never knew his parents and was adopted by ‚ÄúUnc,‚Äù a colorful resident of a small Georgia town whose sayings and kind heart make him a memorable character. Chase is investigating the story of another orphan, this one a mute boy pushed out of a car on train tracks just before a train hit and killed his loser custodial ‚Äúparent.‚Äù","a neighbor recommended ‚Äúchasing fireflies‚Äù by charles martin i‚Äôd never read anything by martin before although he was this neighbor‚Äôs favorite author ‚Äúfireflies‚Äù is the story of chase a journalist who never knew",34,"his","wanted","babies","going","immediately","id","time","much","good","take","just",0.0300000000061118,FALSE
"6","Fallout by Ellen Hopkins (p.1-140)","fallout",2,"by","ellen",NA,NA,NA,NA,NA,NA,NA,NA,NA,0.0199999999967986,FALSE
"7","April was a month for new beginnings. Firstly, I finally finished my exams, and if all is good, I‚Äôll be graduating in May. It still feels weird to know that the business degree I‚Äôve been working for four years is finally mine. So now I‚Äôm in the process of looking for a new job. Secondly, I finally began moving in with my boyfriend of four years, and that‚Äôs a bit nerve-wrecking. As for reading books, the last week of April gave me an opportunity to relax and enjoy a few stories. As you will see, I have not finished much, but I have successfully began several hefty novels. I am happy with the progress I‚Äôve made so far and the quality of books I‚Äôve picked to read. The Fellowship of the Ring is surprisingly easy to read, considering all my fears about Tolkien and his writing. I am loving A Clash of Kings even though this season took a few liberties concerning the plot. Master and Margarita is my first Russian novel in a long time, and I have to say it‚Äôs surprisingly refreshing. I had to postpone my Virginia Woolf experience for later, as I find that I am just not in the mood for it. I should be returning to it a bit later.","april was a month for new beginnings firstly i finally finished my exams and if all is good i‚Äôll be graduating in may it still feels weird to know that the business degree i‚Äôve been working for four years is finally mine so now i‚Äôm in the process of looking for a new job secondly i finally began moving in with my boyfriend of four years and that‚Äôs a bit nervewrecking as for reading books the last week of april gave me an opportunity to relax and enjoy a few stories as you will see i have not finished much but i have successfully began several hefty novels i am happy with the progress i‚Äôve",116,"made","though","called","given","moving","grant","invite",NA,NA,NA,NA,0,FALSE
"8","Contains DMAE which provides firming and toning benefits- Enhances facial contours- An anti-inflammatory that enhances the strength of other antioxidant therapiesVitamin C Ester - Patented- A powerful antioxidant that improves firmness and elasticity- Diminishes the appearance of fine lines, wrinkles and discoloration- Imparts a radiant, smooth and luminous appearance","contains dmae which provides firming",6,"and","toning",NA,NA,NA,NA,NA,NA,NA,NA,NA,0.0100000000020373,FALSE
"9","for I did not come to condemn the world but to save the world.","for i did not come to condemn the world but to save the",14,"world","best","try","god","world","sauce","couple","daughter","money","children","lives",0.0599999999976717,TRUE
"10","Come join us next Tuesday February 21 st for discussion on Chapter 3. We will talk about personal will, self control and the ability to stay true to ourselves as we travel through this life. The gathering is fun, free and another opportunity to meet new people.","come join us next tuesday february st for",9,"discussion","teresa","century","new","every","started","stop","details","current","black","june",0.0299999999988358,FALSE
"11","""The ANC had earlier approached the South Gauteng High Court to grant us leave to appeal its earlier ruling that the singing of the freedom song was unconstitutional and fitted the crime of incitement.","the anc had earlier approached the south gauteng high court to grant us leave to appeal its earlier ruling that the singing of the freedom song was",28,"unconstitutional","like","also","im","part","call","structure","called","took","thats","high",0.0400000000008731,FALSE
"12","¬ªScene 2: Shays‚Äô apartment¬´","‚scene shays‚Äô",3,"apartment‚",NA,NA,NA,NA,NA,NA,NA,NA,NA,NA,NA,FALSE
"13","‚ÄúIt‚Äôs no costume, Pricklewood, I‚Äôm the real McCoy.‚Äù I then got down onto the carpet, grasped the feet of the armchair with my toes and lifted it off the ground. ‚ÄúHow many humans do you know who can do that?‚Äù I asked.","‚Äúit‚Äôs no costume pricklewood i‚Äôm the real mccoy‚Äù i then got down onto the carpet grasped the feet of the armchair with my toes and lifted it off the ground ‚Äúhow many humans do you know who can",39,"do","see","get","say","make","take","also","imagine","just","still","tell",0.0299999999988358,FALSE
"14","And I very much doubt if it will end there. Because of all the foregoing factors, and the immediate crisis Murdoch faces, BSkyB‚Äôs movers know that he must do this deal‚Ä¶.or wind up in very bad shape as a business. There may also come a point at which BSkyB find Murdoch himself simply too toxic to have as a buyer anyway.","and i very much doubt if it will end there because of all the foregoing factors and the immediate crisis murdoch faces bskyb‚Äôs movers know that he must do this deal‚Äor wind up in very bad shape as a business there may also come a point at which bskyb find murdoch himself simply",54,"too","cant","beautiful","means","know","much","use","book","look","im","start",0.0199999999967986,FALSE
"15","Almighty and everlasting God, by whose Spirit the whole body of your faithful people is governed and sanctified: Receive our supplications and prayers which we offer before you for all members of your holy Church, that in their vocation and ministry they may truly and devoutly serve you; through our Lord and Savior Jesus Christ. Amen.","almighty and everlasting god by whose spirit the whole body of your faithful people is governed and sanctified receive our supplications and prayers which we offer before you for all members of your holy church that in their vocation and ministry they may truly and devoutly serve you through our lord and savior jesus christ",56,"amen","now","great","name","lives","spirit","jesus","says","died","shall","master",0.0100000000020373,FALSE
"16","How many times have you heard someone say that so-and-so is too nice to tell the person they‚Äôre seeing that they want to call it quits, too nice to address unfair working conditions with their employer or too nice to ask someone to stop using that seat on the subway as a foot stool? There certainly are people who are soft-spoken and decidedly non-confrontational. But that doesn‚Äôt mean they‚Äôre nicer relative to everyone else. It‚Äôs just their personality. You can be assertive, honest and even outspoken and still be a very nice person.","how many times have you heard someone say that soandso is too nice to tell the person they‚Äôre seeing that they want to call it quits too nice to address unfair working conditions with their employer or too nice to ask someone to stop using that seat on the subway as a foot stool there certainly are people who are softspoken and decidedly nonconfrontational but that doesn‚Äôt mean they‚Äôre nicer relative to everyone else it‚Äôs just their personality you can be assertive honest",84,"and","never","even","quite","left","cover","smell","body","drop","caring","opinion",0.0400000000008731,FALSE
"17","On The Lovin‚Äô People, he has the benefit of a good backing band consisting of Pretty Purdie on drums, Artie Butler on organ & piano, and Joe Mack and Bill Salter on bass. The band, who play both loose and funky without ever sounding sloppy, helped produce a more laid back vibe and Chandler sounds more relaxed than he did on the earlier album. He has some better songs on this one, too, such as the title cut warm, poppy number about...well, ‚ÄúLovin‚Äô People,‚Äù on which the presence of a chorus (made up on the spot of people who had gathered to provide assistance to a mothers‚Äô help organization) also helps temper Chandler‚Äôs unfortunate tendency towards over-earnestness. ‚ÄúThe Naked Fool‚Äù is about a relationship gone bad, which doesn‚Äôt have anything new to say but will have a few toes tapping. ‚ÄúSold Out, No More Reservations‚Äù is an interesting number about a male groupie, and ‚ÄúBound to Fly‚Äù has a nice soaring quality, and Chandler‚Äôs lyrics and delivery mesh well on it. If anything the problem here is that Chandler is sometimes eclipsed by his backing band‚Äîcheck ‚ÄúBehind Your Eyes‚Äù where the band goes off on some nice free jazz-psychedelic tangents while Chandler seems to be trying to channel Sammy Davis, Jr.","on the lovin‚Äô people he has the benefit of a good backing band consisting of pretty purdie on drums artie butler on piano and joe mack and bill salter on bass the band who play both loose and funky without ever sounding sloppy helped produce a more laid back vibe and chandler sounds more relaxed than he did on the earlier album he has some better songs on this one too such as the title cut warm poppy number aboutwell ‚Äúlovin‚Äô people‚Äù on which the presence of a chorus made up on the spot of people who had gathered to provide assistance to a mothers‚Äô help organization also helps temper chandler‚Äôs unfortunate tendency towards overearnestness ‚Äúthe fool‚Äù is about a relationship gone bad which doesn‚Äôt have anything new to say but will have a few toes tapping ‚Äúsold out no more reservations‚Äù is an interesting number about a male groupie and ‚Äúbound to fly‚Äù has a nice soaring quality and chandler‚Äôs lyrics and delivery mesh well on it if anything the problem here is that chandler is sometimes eclipsed by his backing",183,"band‚Äîcheck","campaign","band",NA,NA,NA,NA,NA,NA,NA,NA,0.0299999999988358,FALSE
"18","Whether you‚Äôre looking at investing in residential, commercial or industrial property, the Urban Redevelopment Authority‚Äôs (URA) area planning and guidelines will have a long-term impact on your property‚Äôs values.","whether you‚Äôre looking at investing in",7,"residential","live","put","instead","trench","heavily","millions",NA,NA,NA,NA,0.0299999999988358,FALSE
"19","Ah, Parga. How many times have we sat in Paxos, looking across at the mainland at night seeing twinkling lights in the far distance? How many times have we wondered just what was it like over there? Well now we know. Unfortunately the place with the twinkling lights was not Parga but some other little community. We got it wrong. Parga was on the itinerary anyway. We concluded it was not worth the detour; two resort-y bays separated by an ancient Turkish fort on a steep hill and a cluster of souvenir shops, tavernas and restaurants. The marina was unwelcoming - we moored alongside a rusting, capsized ferry - and the trudge to buy some provisions took us along a neglected rubbish strewn track. Thomas would not leave the boat for fear we were robbed. But hey! Pull up the gangplank, crack open a beer and experiment with cooking in the galley.","ah parga how many times have we sat in paxos looking across at the mainland at night seeing twinkling lights in the far distance how many times have we wondered just what was it like over there well now we know unfortunately the place with the twinkling lights was not",51,"parga","camera","far","thank","popped","parga","killed","dense","flood","chestnuts",NA,0.0299999999988358,TRUE
"20","I found myself chuckling out loud enough that the wife banished me to the easy chair in the living room at night (can't read this one in bed). I'd get up to get another soft drink and find that I had a big grin on my face.","i found myself chuckling out loud enough that the wife banished me to the easy chair in the living room at night cant read this one in bed id get up to get another soft drink",37,"and","find","lot","friends","made","experience","playing","clear","drive","feet","finished",0.0100000000020373,FALSE
"21","- Food and drink disliking. I‚Äôm not really sure what the correct term is for this, but I developed a dislike for almost all of the foods that I once liked, and couldn‚Äôt drink fizzy pop at all! I think I may have literally lived on pickled onion space raiders and fruit juice for the entire first trimester‚Ä¶and possibly a lot of the second.","food and drink disliking i‚Äôm not really sure what the",11,"correct","hell","iron","heck",NA,NA,NA,NA,NA,NA,NA,0.0400000000008731,FALSE
"22","Sphere: V = 4/3","sphere",2,"v","v","science",NA,NA,NA,NA,NA,NA,NA,NA,0.0100000000020373,TRUE
"23","Of course it goes without saying that all the music above would probably have been familiar to Gardel's audience, too. But it's not that widely known here. It's not difficult or inaccessible music, but it's not a routine part of the popular culture in the same way that it would have been when Gardel was playing El dia que mi quieras, or even as it was when my grandmother's relations were making their own entertainment in Australia with performances of Bizet's Au fond du temple saint.","of course it goes without saying that",8,"all","old","new","single","just","really","christ","lot","need","im","little",0.0299999999988358,FALSE
"24","‚ÄúHell is larger today than it was yesterday, because many of us have failed to pray.‚Äù‚ÄìDavid Smithers","‚Äú is larger",4,"today","media","even","today","society","mass","painting","bobbin","chucks","paintings","populations",0.0199999999967986,TRUE
"25","Even if you don‚Äôt like the so called ‚Äúscrewball comedy‚Äù, that some critic also called ‚Äúsex comedy without sex‚Äù, whose Trouble in Paradise gives a perfect example, you could enjoy two things from this movie: the typical Art Deco interior design (in Mme Colet house) and the beautiful gowns designed by Travis Banton (one of the most famous 1930 costume Designer) that show at its best this period style.","even if you don‚Äôt like the so called ‚Äúscrewball comedy‚Äù that some",13,"critic","women",NA,NA,NA,NA,NA,NA,NA,NA,NA,0.0100000000020373,FALSE
"26","Tomorrow only! May 2, 2012 bride bikini is offering our amazing customers a 5% discount off your entire purchase!!!","tomorrow only may bride bikini is offering our",9,"amazing","old","great","left","called","amazing","online","personality","various","helping","prizes",0.0200000000040745,TRUE
"27","Didn‚Äôt quite make church Sunday morning. Sleeping right up to check out causes a bit of a mad rush to get up and get out.","didn‚Äôt quite make church sunday morning sleeping right up to check out causes a bit of a",18,"mad","lot","few","little","man","person","mask","similar","child","murder","crime",0.0299999999988358,FALSE
"28","How can you start your day any other way than happy with that face wanting to cuddle with you first thing?","how can you start your day any other way than happy with that face wanting to cuddle with",19,"you","first","lots",NA,NA,NA,NA,NA,NA,NA,NA,0.0299999999988358,FALSE
"29","hold, to not let go","hold to not let",5,"go","go",NA,NA,NA,NA,NA,NA,NA,NA,NA,0.0199999999967986,TRUE
"30","And that is where we changed from being social beings amongst each other to digital social addicts.","and that is where we changed from being social beings amongst each other to",15,"digital","peoples",NA,NA,NA,NA,NA,NA,NA,NA,NA,0.0299999999988358,FALSE
"31","02 - It's All Over Now 04:01","its",2,"all",NA,NA,NA,NA,NA,NA,NA,NA,NA,NA,NA,FALSE
"32","Jethro responded, ‚ÄúWhat you are doing is not good. You and these people who come to you will only wear yourselves out.‚Äù Moses was the bottleneck of a system that was broken and creating dysfunction, wasting time, and wearing everyone out.","jethro responded ‚Äúwhat you are doing is not good you and these people who come to you will only wear yourselves",22,"out‚Äù","day","days","many","spent","running","damn","combined","pajamas","habitually","denim",0.0100000000020373,FALSE
"33","Sometimes, I just want to read a book. It‚Äôs kinda like Freud said, ‚Äúsometimes a cigar is just a cigar.‚Äù Well in my case, sometimes I just need to read an actual hard or soft cover book, feel the paper against my fingers, smell the newness or musty oldness. If it‚Äôs a new book, there is something quite satisfying about being the first one to crack it open. I love to turn the pages, hear the crinkle and switch as my fingers brush against the paper.","sometimes i just want to read a book it‚Äôs kinda like freud said ‚Äúsometimes a cigar is just a cigar‚Äù well in my case sometimes i just need to read an actual hard or soft cover book feel the paper against my fingers smell the newness or musty oldness if it‚Äôs a new book there is something quite satisfying about being the first one to it open i love to turn the pages hear",75,"the","get","people","think","tell","wars","read","words","reason","kids","children",0.0400000000008731,FALSE
"34","individually and as a band in the studio, along with interviews","individually and as",4,"a","soon","he","they",NA,NA,NA,NA,NA,NA,NA,0.0299999999988358,FALSE
"35","to do this in remembrance of Him. Luke 22:19","to",2,"do",NA,NA,NA,NA,NA,NA,NA,NA,NA,NA,NA,FALSE
"36","I think I did three sets of revisions in the end. The first involved clarifying the plot. I kept moving away from the main thread and rambling in different directions. Once I‚Äôd mastered that I had to switch some chapters round and cut some bits out then work a little on the dialogue. Plotting has been the most difficult part of writing so far. But through writing Shine, I studied plot hard, learned a lot and with my second book, Glitter, due out on Sept. 2nd, I had one small amount of editing to do. I kept waiting for Rachel to send the MS back with more to do when I discovered it was already with the copyeditor!","i think i did three sets of revisions in the end the first involved clarifying the plot i kept moving away from the main thread and rambling in different directions once i‚Äôd mastered that i had to switch some chapters round and cut some bits out then work a little on the dialogue plotting has been the most difficult part of writing so far but through writing shine i studied plot hard learned a lot and with my second book glitter due out on sept nd i had one small amount of editing to do i kept",98,"waiting","getting","trying","going","also","good","talking","england","mat","mind","thinking",0.0299999999988358,FALSE
"37","Caroline Saunders (Lab) 1,142","caroline",2,"saunders","saunders",NA,NA,NA,NA,NA,NA,NA,NA,NA,0.0100000000020373,TRUE
"38","Use a pan or kettle to capture the water you run while waiting for warm water to arrive at the faucet. The captured water can be used for other washing purposes.","use a pan or kettle to capture the water you run while waiting for warm water to arrive at the faucet the captured water can be used for other",30,"washing","say","now","new","many","describe","recipe","going","year","bit","make",0.0500000000029104,FALSE
"39","Her father smiled. ""They take just a tiny bit of your qi, your soul energy, when you're initiated and at various other points during your time there. I don't know how, but they make gold from it.""","her father smiled they take just a tiny bit of your qi your soul energy when youre initiated and at various other points during your time there i dont know how but",33,"they","can","think","im","like","get","much","will","everything","experience","know",0.0199999999967986,FALSE
"40","The City Council prefers to manage the council housing instead of an Arms Length Management Organisation in order to ‚Äúsave money by not having a separate organisation‚Äù.","the city council prefers to manage the council housing instead of an arms length management organisation in order to",20,"‚Äúsave","make",NA,NA,NA,NA,NA,NA,NA,NA,NA,0,FALSE
"41","This stuff is actually happening. It‚Äôs threatening our survival. And it‚Äôs not just the environment. And I‚Äôm writing it to know that, among the peaceful: you are not crazy for thinking that we are approaching a turning point in our country where the realities of decades of profit-over-all-else mentality are becoming not just undeniable, but are confronting us in our day to day lives in ways we did not think was possible in a country that now seems, in retrospect, to have been the least Western, least democratically-minded country to be considered so. And that turning point might require widespread civil disobedience, in the name of the environmental and economic survival of our country and our people (as well, of course, as the vast masses like us all around the world, in other countries).","this stuff is actually happening it‚Äôs threatening our survival and it‚Äôs not just the environment and i‚Äôm writing it to know that among the peaceful you are not crazy for thinking that we are approaching a turning point in our country where the realities of decades of profitoverallelse mentality are becoming not just undeniable but are confronting us in our day to day lives in ways we did not think was possible in a country that now seems in retrospect to",82,"have","least","kinda",NA,NA,NA,NA,NA,NA,NA,NA,0.0400000000008731,FALSE
"42","Sunday the festivities continued. I went BACK to Shadowbox to see Back to the Garden again. (Told ya I love that place). Then after that was over, I had to work at the store. It was Survivor finale night, and we do a special Survivor crop each season, so I had to go host that.","sunday the festivities continued i went back to shadowbox to see back to",14,"the","the","work","school","my",NA,NA,NA,NA,NA,NA,0.0199999999967986,TRUE
"43","1 Beauty Contest","beauty",2,"contest","just","life","group","wonder","within","sky","broken","looked","heads","coffee",0.0100000000020373,FALSE
