"785","So I found this great Acer Aspire on there, that really wasn‚Äôt all that expensive. So i decided to bid on it‚Ä¶ First mistake, because it took me bout 7 bids to get the other bidder off my back. The bidding fight stopped at the price of about 400 USD‚Ä¶ I was happy, cuz if I waited for another 23 hours, that laptop was mine. So I went to bed‚Ä¶ When i woke up, I recieved an email saying my bid was no longer the highest‚Ä¶ Someone had bid EXACTLY 2 USD more than me‚Ä¶ When I tried to bid over him, Ebay told me that the seller did not allow anymore bids‚Ä¶","so i found this great acer aspire on there that really wasn‚Äôt all that expensive so i decided to bid on it‚Ä first mistake because it",27,"took","is","was","means","makes",NA,NA,NA,NA,NA,NA,0.0100000000020373,FALSE
"786","(Where's the ""cure"" you ask? If that's the main reason you haven't been making jerky, well, come on down! I hate sodium nitrite. Imagine my surprise when at my Master Food Preserver Class, Barbara Ingham, Wisconsin's Extension food scientist and our teacher, said I didn't have to use it! There was a catch. Without cure in it, you will store it in the refrigerator. If you are going on a camping trip, etc., it will keep for 2 weeks out of the refrigerator, but not indefinitely. This more than covers me for a day long shopping trip, or Rick for a day of pheasant hunting.)","wheres the cure you ask if thats the main reason you havent been making jerky well come on down i hate sodium nitrite imagine my surprise when at my master food preserver class barbara ingham wisconsins extension food scientist and our teacher said i didnt have to use it there was a catch without cure in it you will store it in the refrigerator if you are going on a camping trip etc it will keep for weeks out of the refrigerator but not indefinitely this more than covers me for a day long",95,"shopping","time","term","ago","way","enough","long","story","black","distance","forgotten",0.0200000000040745,FALSE
"787","Gospel: Matthew 13:54-58","gospel",2,"matthew","indeed","matthew",NA,NA,NA,NA,NA,NA,NA,NA,0.0199999999967986,TRUE
"788","So the fat man sits down an‚Äô enjoys a treat","so the man sits down an‚Äô enjoys a",9,"treat","making","treat","walks",NA,NA,NA,NA,NA,NA,NA,0.0299999999988358,TRUE
"789","As we move through life, our opinions and ideas change. Sometimes we unconsciously or mindlessly operate from an older belief system when really we have shifted. We want to respond in one way, but we surprise ourselves by habitually responding in a different way. What do you believe, in the here and now? The following exercise gives you a chance to see","as we move through life our opinions and ideas change sometimes we",13,"unconsciously","just","seems","like","can","people","think","things","one","book","im",0.0100000000020373,FALSE
"790","It was nearly midnight at that point, so we camped at the gypsy camp which, while not exactly safe, is still safer than the bridge is for Tistann. He seems to be persona non-grata with the followers of Rodcet Nife, a priest of which is in the bridge tower. He‚Äôs attacked me before.","it was nearly midnight at that point so we camped at the gypsy camp which while not exactly safe is still safer than the bridge is for tistann he seems to be persona nongrata with the",37,"followers","new","help","kids","rules","same","other","right","loss","team","dead",0.0199999999967986,FALSE
"791","Simon Kurt Unsworth ‚Äì Mami Wata","simon kurt unsworth",4,"‚Äì","unsworth",NA,NA,NA,NA,NA,NA,NA,NA,NA,0.0299999999988358,FALSE
"792","Googleing define yarn nets me this result:","googleing define yarn nets me this",7,"result","good","result",NA,NA,NA,NA,NA,NA,NA,NA,0.0300000000061118,TRUE
"793","Q: What are the benefits to having Eyelash Extensions?","q what are the benefits to having",8,"eyelash","work",NA,NA,NA,NA,NA,NA,NA,NA,NA,0.0199999999967986,FALSE
"794","If you‚Äôre a ‚Äúreal‚Äù writer you sit down to write every day at the same time, without fail and you write for a few hours. This is the common wisdom. This is what we all must do if we‚Äôre to give ourselves the time to practice our craft. These are The Rules.","if you‚Äôre a ‚Äúreal‚Äù writer you sit down to write every day at the same time without fail and you write for a",24,"few","while","little","few","long","couple","day","short","moment","week","time",0.0199999999967986,TRUE
"795","One of the absolutely most frustrating things I've experience over the last week has been feeling helpless and useless. My husband goes to work every day and does absolutely nothing. While some departments are being stretched to their limit (or beyond), others are being under utilized.","one of the absolutely most",6,"frustrating","love","nothing","sure","right","man","beautiful","recommend","brilliant","glorious","hilarious",0.0299999999988358,FALSE
"796","So how does a student recruit a college?","so how does a student",6,"recruit","things","mine","whose","dr","moves","china","charles","aid","professor","loans",0.0100000000020373,FALSE
"797","The latest local offering from Old World Brewery, Eclipse Black IPA, is no exception to this trend. It isn‚Äôt hoppy in the traditional IPA sense but it‚Äôs plenty good and low enough in abv to serve as a decent session beer. I got wind of this release through Old World‚Äôs Facebook page and made a commitment to drop by as soon as possible in order not to miss it, along with another short run offering called, suggestively, ‚ÄúThe Prick.‚Äù I had my opportunity a couple weeks before Thanksgiving.","the latest local offering from old world brewery eclipse black ipa is no exception to this trend it isn‚Äôt hoppy in",22,"the","traditional","pine",NA,NA,NA,NA,NA,NA,NA,NA,0.0400000000008731,FALSE
"798","As always, there will be a Festival of Poker that includes a full tournament program, cash games and STT‚Äôs.","as always",3,"there","good","grateful","go","take","will","one","best","addressed","adored","imagined",0,FALSE
"799","On the up side, my daughter and her hubby just this week found a good last minute vacation deal for a week in Hawaii. So mid September during the 10 days Mr. Garden Muscle will be gone on a motorcycle trip to Colorado to the annual Fallen Firefighter ceremony I will be babysitting little Miss Dinah. It will be Girl Week at my house.","on the up side my daughter and her hubby just this week",13,"found","the","and","in","we",NA,NA,NA,NA,NA,NA,0,FALSE
"800","1) The Palestinians can‚Äôt disguise their crimes as military actions. The Israelis can. We can‚Äôt say ‚Äúthe Israelis don‚Äôt kill civilians;‚Äù at most, we can say that the extent of IDF operations makes it impossible to ascertain if the civilians that they kill are intended murders or not. The recent case of an old man killed in his sleep by IDF forces provides an excellent example of a totally unnecessary and highly suspicious death in which the soldier who pulled the trigger is acquitted based on his own testimony.","the palestinians can‚Äôt disguise their crimes as military actions the israelis can we can‚Äôt say ‚Äúthe israelis don‚Äôt civilians‚Äù at most we can say that the extent of idf operations makes it impossible",34,"to","see","look","without","short","speak","task","unlikely","ascertain","landing",NA,0.0400000000008731,FALSE
"801","i know this is nothing compared to all that cuteness you just took in...but i have been saying i would show some more recent pictures of the addition ;) it is coming along slow but steady....but the outside is finally getting CLOSE to being done! that was the goal anyway, and then we can work on the inside over the winter months.....","i know this is nothing compared to all that",10,"cuteness","has","walking","was",NA,NA,NA,NA,NA,NA,NA,0.0199999999967986,FALSE
"802","The second verse in this passage is 1 Thessalonians 4:18. ‚ÄúWherefore comfort one another with these words.‚Äù Why would we have to do that to fellow believers? Don‚Äôt they also have the indwelling Holy Spirit? Of course, but all too often, especially in times of distress, one is prone to think according to the flesh and not the Spirit.","the second verse in this passage is thessalonians ‚Äúwherefore comfort one another with these words‚Äù why would we have",20,"to","to","been","become","some","our",NA,NA,NA,NA,NA,0.0100000000020373,TRUE
"803","There lies a tension here between Kochan‚Äôs perceived true self, and his actual true self, forming confusion with masks at the heart of it all. With a mask hiding his true self, and a mask expressing his true self, is it possible to clearly define which mask does the hiding, and which allows for expression? And if both his true self and his false self take the form of a mask, is either of them really his ‚Äútrue self?‚Äù The title, Confessions of a Mask, suggests nothing exists beneath the mask; the confessions are coming from the mask, not from the person beneath the mask. Can he be his ‚Äútrue self‚Äù without a mask? And going along with that question, does he despise the mask? Or does he desire it?","there lies a tension here between kochan‚Äôs perceived true self and his actual true self forming confusion with masks at the heart of it all with a mask hiding his true self and a mask expressing his true self is it possible to clearly define which mask does the hiding and which allows for",55,"expression","people","little","members","women","blend","dog","users","expression","instructors","pull",0.0299999999988358,TRUE
"804","Every time I have an engagement with a large corporation, I always ask for the corporate data dictionary and 9 out of 10 times, they tell me they don‚Äôt have one. I fail to understand why a company with numerous databases do not have a single data dictionary that tells a definitive story of the business data that the company maintains and reports on.","every time i have an engagement with a large corporation i always ask for the corporate data dictionary and out of",22,"times","order","the",NA,NA,NA,NA,NA,NA,NA,NA,0.0200000000040745,FALSE
"805","Tossers ‚Äìliterally masturbaters. Means idiots.","tossers",2,"‚Äìliterally",NA,NA,NA,NA,NA,NA,NA,NA,NA,NA,NA,FALSE
"806","2006 Mid-Season NBA Breakdown of the Sacramento Kings","midseason",2,"nba","finale","nba",NA,NA,NA,NA,NA,NA,NA,NA,0.0100000000020373,TRUE
"807","If Peter had such an honoured position why did the Lord have to put him in his place in Matthew 16:25 when addressing him. The Lord said,","if peter had such an honoured position",8,"why","now","though","can","think","believe","close","lord","lower","abuse","clasped",0.0199999999967986,FALSE
"808","‚ÄîShowers with Beetles","‚Äîshowers",2,"with",NA,NA,NA,NA,NA,NA,NA,NA,NA,NA,NA,FALSE
"809","My experience has been that all dogs are smarter than I am, and they always know when I am packing treats and when I am not, and they are obedient when a treat is forthcoming and they may or may not be obedient otherwise, depending on their mood.","my experience has been that all dogs are smarter than i am and they always know when i am packing treats and when i am not",27,"and","sure","using","depressed","an",NA,NA,NA,NA,NA,NA,0.0199999999967986,FALSE
"810","Why is it that the gluten-free market is one of the fastest growing packaged food sectors right now?","why is it that the glutenfree market is one of the fastest growing",14,"packaged","growing","can","government","maybe","packaged","fond","fenceno","influential","nadine","pennsylvania",0.0100000000020373,TRUE
"811","And all the energy behind ‚Äúpro-life‚Äù","and all the energy",5,"behind","signature","going","much","better","th","probably","small","food","growing","behind",0.0400000000008731,TRUE
"812","Player sanctions are to come.","player",2,"sanctions","can","world","used","ball","league","sanctions",NA,NA,NA,NA,0.0100000000020373,TRUE
"813","2) Going to the pet store and watching the chameleons change color.","going",2,"to","back","try","come","well","go","take","blog","call","like","get",0,FALSE
"814","Goodbye, Jill. I'll never forget.","goodbye jill",3,"ill","ill","forming","kellys",NA,NA,NA,NA,NA,NA,NA,0.0199999999967986,TRUE
"815","HOSTED BY: ‚Äì The Nature Conservancy ‚Äì REI ‚Äì Harrah‚Äôs Reno","hosted by ‚Äì the",5,"nature",NA,NA,NA,NA,NA,NA,NA,NA,NA,NA,NA,FALSE
"816","So the next few years of Albert Pujols will give the Angels more value than any other player in the league possibly could. Unfortunately, the contract is not for five or six years, it is for 10 years and $254 million.","so the next few years of albert pujols will give the angels more value than any other player in the league possibly could unfortunately the contract is not for five or six",33,"years","months","years","weeks","finger","articles","retired","decades","inches","families","dollars",0.0299999999988358,TRUE
"817","A person in a higher state of consciousness is expected to know everything. But while the mind and the consciousness possess the ability to know everything, do they really need to know everything? ‚ÄúAll knowing‚Äù simply means being conscious of the essence of all you know. In this state, both knowledge and ignorance co-exist and complement each other. For instance, while playing a game, it is not knowing the result beforehand that makes the game sincere and fun. If one knew the result even while playing, the players (and the game) would lose their intensity.","a person in a higher state of consciousness",9,"is","can","family",NA,NA,NA,NA,NA,NA,NA,NA,0.0100000000020373,FALSE
"818","I think they decided that until he moves from El Paso, he needs to be on a preventative inhaler of some sorts. Steroids. Not fun for a baby.","i think they decided that until he moves from el paso he needs",14,"to","to",NA,NA,NA,NA,NA,NA,NA,NA,NA,0.0200000000040745,TRUE
"819","If you are interested in the national private midwifery scene, or trying to locate a midwife outside Victoria, please go to the APMA blog.","if",2,"you",NA,NA,NA,NA,NA,NA,NA,NA,NA,NA,NA,FALSE
"820","Her son was served with a civil claim ‚Äì a ‚Äúwarrant in debt‚Äù from the county for $397 dollars ‚Äì almost seven months after paying $190 in fines and court costs for his reckless driving.","her son was served with a civil claim ‚Äì a ‚Äúwarrant in debt‚Äù from the county for dollars ‚Äì almost",21,"seven","much","always","every","nothing","daily","immediately","day","sure","week","though",0,FALSE
"821","And like that, she was off, driving hellzapopping toward her house in Bexley.","and like that she was off driving hellzapopping toward her",11,"house","back","us","house","west","finally","rock","birth","north","east","christianity",0.0299999999988358,TRUE
"822","woman who has honorary degrees from several Jesuit universities.","woman who has honorary degrees",6,"from","making","different","several","success","meat","nighttime","f","fahrenheit",NA,NA,0.0199999999967986,FALSE
"823","6. Rosalee is a former addict and her brother, who helped her overcome her addiction, was dealing. I didn‚Äôt think it was plausible but I guess Freddy needed income.","rosalee is a former addict and her brother who helped her overcome her addiction was dealing i didn‚Äôt think it was plausible but",24,"i","guess","solution",NA,NA,NA,NA,NA,NA,NA,NA,0.0299999999988358,FALSE
"824","2 tsp coarse salt","tsp coarse",3,"salt","salt",NA,NA,NA,NA,NA,NA,NA,NA,NA,0.0500000000029104,TRUE
"825","The talents of Michael Barry has earned him time in a WWE ring in the past while his charisma and hard work is the reason so many fans call him MR Saturday Night.","the talents of michael barry",6,"has","earned","kerry","winfield",NA,NA,NA,NA,NA,NA,NA,0.0299999999988358,FALSE
"826","It was a lovely surprise to be joined by Father Leon Pereira O.P., who had decided to come to the vigil having been inspired by the great pro-life witness of Father Michael Williams, a young pro-life priest who died last week. Requiescat in pace.","it was a lovely surprise to be joined by father leon pereira op who had decided to come to the vigil having been inspired by the great prolife witness of father michael williams a",35,"young","young","explained",NA,NA,NA,NA,NA,NA,NA,NA,0.0100000000020373,TRUE
"827","6. Jabberjaw: (First aired 1976, ran until 1978) As part of the overall shark mania of the 1970s and shortly after the then-recent film Jaws, Hanna-Barbara Inc. released Jabberjaw--a Saturday morning animated series about a 15-foot talking great white shark. Jabberjaw was the drummer for a rock group made up of four teenagers who all lived in an underwater civilization in the year 2076. As Jabberjaw and his rock band buddies traveled to different underwater cities, they would encounter and attempt to conquer diabolic villains with plans to take over the undersea world. The format and writing for Jabberjaw was similar to that for Scooby-Doo and Josie and Pussycats, but for a time when people were scared out their minds of sharks, you've got to admit it was pretty cool to create one that was heroic and loveable.","jabberjaw first aired ran until as part of the overall shark",12,"mania","either","jabberjaw","mania",NA,NA,NA,NA,NA,NA,NA,0.0199999999967986,TRUE
"828","This interchange between the stable type and our fluid history is key. Our personality profile defines a mode of life in the face of changing events, and our development as a person has everything to do with how we do or do not manage to adapt those patterns to those events. Since those events manifest most clearly in our shadow function, we can talk about the way those functions both have a history and remain stable.","this interchange between the stable type and our fluid history is key our personality profile defines a mode of life in the face of changing events and our development as a person has everything to do with how",39,"we","the",NA,NA,NA,NA,NA,NA,NA,NA,NA,0.0299999999988358,FALSE
"829","(The poll is to the left of Margaret Wente‚Äôs article, about half way down)","the poll is to the left of margaret wente‚Äôs article about half",13,"way","way",NA,NA,NA,NA,NA,NA,NA,NA,NA,0.0100000000020373,TRUE
"830","So I mentioned that I was having trouble with an indie company. Unfortunately nothing has been fixed yet and there's nothing I can really do about it. The company in question is Hi Fi cosmetics. I've reviewed them in the past and absolutely love their products and the owner, Veronica, was always really nice and helpful so I'm really saddened to have to write this.","so i mentioned that i was having trouble with an indie company unfortunately nothing has been fixed yet and theres nothing i can",24,"really","see","get","still","say","take","tell","find","go","make","imagine",0.0200000000040745,FALSE
"831","Waist: 39"" (down 0.5""from last week)","waist",2,"down","lot","last","pattern","princess",NA,NA,NA,NA,NA,NA,0.0299999999988358,FALSE
"832","So, finally the unanswered question of succession to Mubarak. Although he hadn't officially announced yet, Hosni's son Gamal seemed a likely candidate to take over the reigns. Posters advocating a Gamal Mubarak presidency were already plastered all over downtown Alexandria. So at least they could keep it all in the family, you know, like the best dictators do.","so finally the unanswered",5,"question","questions","question","happened",NA,NA,NA,NA,NA,NA,NA,0,TRUE
"833","It is my take ‚Äî for whatever that‚Äôs worth ‚Äî that the kind of ads being run by the Romney Campaign and by the PACs supporting his candidacy are effective when viewed by 65-70% of likely voters. Here‚Äôs just one more.","it is my take ‚Äî for whatever that‚Äôs worth ‚Äî that the kind of ads being run by the romney campaign and by the pacs supporting his candidacy are effective when viewed by of",35,"likely","bit","made","small","son","likely","naive",NA,NA,NA,NA,0.0299999999988358,TRUE
"834","I am way more passionate about football this year than in the past- like feeling depressed the next day after the game when we don't win.","i am way more passionate about football this year than in the past like feeling depressed",17,"the","find","may","next","twittered",NA,NA,NA,NA,NA,NA,0.0299999999988358,FALSE
"835","Tomorrow, I'll read my cards again. Tomorrow, I'll knit something or plant something or rearrange the furniture. I'll make a plan. Right now, I'd like to walk some old places I've already been to times that no longer exist.","tomorrow ill read my cards again tomorrow ill knit",10,"something","something","x",NA,NA,NA,NA,NA,NA,NA,NA,0.0200000000040745,TRUE
"836","My boys got the S'mores cupcake and the Milk Chocolate. I got the Chocolate Marshmallow cupcake for myself and the Black & White and Red Velvet cupcakes as gifts! I really can't recommend a certain flavor because they were ALL good!!","my boys got the smores cupcake and the milk chocolate i got the chocolate marshmallow cupcake for myself and the black white and red velvet cupcakes as gifts i",30,"really","really","something","dont","occasion",NA,NA,NA,NA,NA,NA,0.0299999999988358,TRUE
"837","In doing so, they have learned another unintended fact. They know that millions of other people share their commitment to various ideals and causes. They now know they are not alone. They understand they have strength in numbers.","in doing so they have learned another unintended fact they know that millions of other people",17,"share","to",NA,NA,NA,NA,NA,NA,NA,NA,NA,0,FALSE
"838","I took them home and started the process of breaking them in to get them ready for Boston. I went on some short runs and eventually used them for my Sunday long runs. My feet sounded like they were plopping on the ground, like I had huge clown shoes on. My feet didn‚Äôt feel great, but I figured it was just because they were new.","i took them home and started the process of breaking them in to get them ready for boston i went on some short runs and eventually used them for my sunday long runs my feet sounded like they were plopping on the ground like i had",47,"huge","to","the","no","been","done","known","five","in","so",NA,0,FALSE
"839","I was probably nine or ten when I got the idea that beards developed gradually out of uncut sideburns and consequently refused to let my sideburns be trimmed for several consecutive haircuts. The barber teased me about Elvis. Other people wondered if I was trying to look like Spock. In different clothing and with a little curl, I would have looked more like a young Hasid. At some point, I figured out that no new hairs were about to start growing under my sideburns and stopped.","i was probably nine or ten when i got the idea that beards",14,"developed","developed",NA,NA,NA,NA,NA,NA,NA,NA,NA,0.0199999999967986,TRUE
"840","we are attaching the hop order so you are able to SPRING right on through","we are",3,"attaching","not","in","going","right","at","all",NA,NA,NA,NA,0.0299999999988358,FALSE
"841","There is some sort of sorcery involved in flan. The caramelized sugar that you line the moulds with, and that immediately turns solid, somehow turns into liquid caramel gold when you serve the flan. I don't know why - I think you have to have an in with the Mexican gods to get the real answers.","there is some sort of sorcery involved in flan the caramelized sugar that you line the moulds with and that immediately turns solid somehow turns into liquid caramel gold when",31,"you","reserves","around","serve","rush","butterflies","ipa","bars","coast","embossing","brad",0.0100000000020373,FALSE
"842","""Memory is the greatest curse ever inflicted on mankind,"" drama critic Jed Leland (Joseph Cotten) says at one point in the film and this line in many ways reflects what made this movie such a breakthrough. Citizen Kane explores a sort of existential mystery, attempting to encapsulate one man's life by deciphering the meaning of his dying word. Welles proved a wonder in his film debut, playing the title character, producing, directing and co-writing the movie ‚Äî all at the tender age of 25.","memory is the greatest curse ever inflicted on mankind drama critic jed leland joseph cotten says at one point in the film and this line in many ways reflects what made this movie such a breakthrough citizen kane explores a sort of existential mystery attempting to encapsulate one mans life by deciphering the meaning of his dying word welles proved a wonder in his film debut playing the title character producing directing and",74,"cowriting","create","cowriting",NA,NA,NA,NA,NA,NA,NA,NA,0.0299999999988358,TRUE
"843","Items from the Lefferts collection span centuries of history, from when the Lefferts family first settled in Flatbush in 1660. The family came to own large tracts of property, not only in Brooklyn, but in Queens County, Staten Island and New Jersey as well.","items from the lefferts collection span centuries of history from when the lefferts family first settled in flatbush in the family came to own large tracts of property not only in brooklyn but in queens county staten",38,"island","island",NA,NA,NA,NA,NA,NA,NA,NA,NA,0.0400000000008731,TRUE
"844","Do not live beyond your means. This takes time and a change in attitude to accomplish. The rise of consumer credit in the past few years has made it far too easy to buy items without being able to pay, and the bills are coming due. Spend some significant time studying your finances, and set a realistic budget to which you can stick.","do not live beyond your means",7,"this","takes","can","will","really","another","two","many","computer","dont","every",0.0299999999988358,FALSE
"845","14. Black is beautiful (alternate version instrumental)","black",2,"is","white","currant","hair","currants","cream","one","hand","man","door","woman",0.0199999999967986,FALSE
