"1209","The enjoyment factor of this show‚Ä¶ it may not have been obvious throughout the review, but I fucking loved watching this show. It is easily the best ‚Äòso bad it‚Äôs good‚Äô thing I‚Äôve watched in a long, long while. The trainwreck attraction of this was absolutely glorious, you just don‚Äôt get one on this scale like ever. The awful characters, the nonsensical plot, the contrived twists, all of it combined to make Guilty Crown outstandingly hilarious. Adding to the big joke that is this series is just how high profile it was ‚Äì the staff lineup, the budget, the studio, the fact that it‚Äôs a noitaminA series airing over two seasons, which so rarely happens with noitaminA, it looked so set to be a massive, massive thing and seeing it fail this fucking hard was absolutely hilarious. I‚Äôm glad I got to watch it as it aired, and I‚Äôm sad to see it go because I‚Äôll never get to see something as bad as Guilty Crown in this way for a long, long time.","the enjoyment factor of this show‚Ä it may not have been obvious throughout the review but i loved watching this show it is easily the",26,"best","find","think","best","start","read","probably","stop","lives","taken","changed",0.0299999999988358,TRUE
"1210","May the Easter Bunny twitch his whiskers at you and leave you something special... and chocolatey!","may the easter bunny twitch his whiskers",8,"at","leave",NA,NA,NA,NA,NA,NA,NA,NA,NA,0.0100000000020373,FALSE
"1211","In the final scene, Julia is present (disguised as a boy-servant to Proteus and obviously broken-hearted over P.'s pursuit of S.) as is Valentine, who is hidden and does not yet know that Proteus betrayed him. So ... in this setting, Proteus decides he's waited long enough for Silvia and tries to rape her; at which point, Valentine reveals himself and calls Proteus out for being the dick that he is; Proteus is all, Dude, I'm really sorry! And Valentine, who, remember, can't bear the thought of living without Silvia, says to Proteus, That's good enough for me! We're best buds again, and, furthermore, why don't you take my chick?","in the final scene julia is present disguised as a boyservant to proteus and obviously brokenhearted over ps pursuit of s as is valentine who is hidden and does not yet know that proteus betrayed him so in this setting proteus decides hes waited long enough for silvia and tries to her at which point valentine reveals himself and calls proteus out for being the that he is proteus is all dude im really sorry and valentine who remember cant bear the thought of living without silvia says to proteus thats good enough",94,"for","water","literally","see","now","know","time","much","people","will","one",0.0200000000040745,FALSE
"1212","4) A Sikh must keep hair and wear a turban.","a sikh must",4,"keep","also","say","go","made","keep","choose","provided","now","wait","use",0.0299999999988358,TRUE
"1213","You have made me feel this way‚Ä¶your love, your touch, your conversation,","you have made me",5,"feel","feel","think","so",NA,NA,NA,NA,NA,NA,NA,0.0199999999967986,TRUE
"1214","We had a wonderful response to our glitter and embossing challenge last week! Thank you to all who played!!","we had a wonderful response to our glitter",9,"and","soon","due","embossing","glueice",NA,NA,NA,NA,NA,NA,0.0100000000020373,FALSE
"1215","""Hey, mate, you mum's here."" Gilly gave him a shake on the shoulder. He wasn't anymore dressed for company than Jonah. Gilly was giving the baby a bottle. Gilly was in his pajama bottoms and barefooted.","hey mate you mums here gilly gave him a shake on the shoulder he wasnt anymore dressed for company than jonah gilly was giving the baby a bottle",29,"gilly","im","cup","let","next","already","knew","floor","gilly","homemade","wine",0.0199999999967986,TRUE
"1216","While working alone at a roadside motel, Michal is harassed by the mafia thugs who arrive to carry out a scheme for their boss, who owns the motel, and Michal will be the unfortunate victim of that scheme. Fleming's dialogue for his bad guys sounds like he copied it from a bad 1930s Bogart movie; however, the two thugs themselves are very well drawn and one of them even has metal teeth which must have inspired the Jaws character who appeared in the film version. The hostage situation he describes is also nail-biting. When James Bond, after getting a flat tire, shows up at the motel, we let out the breath we've been holding because the brave knight has arrived to rescue the damsel in distress. Bond is quickly recruited to save Vivienne (not that it takes much!) and he does so in typical fashion.","while working alone at a roadside motel michal is",10,"harassed","will","harassed",NA,NA,NA,NA,NA,NA,NA,NA,0.0100000000020373,TRUE
"1217","I also took away all of her electronic items, until her attitude improves. Then I called my husband and told him in a calm manner, after taking deep breaths, what happened. He agreed with me, saying, ‚ÄúYou are right.‚Äù Then he said, ‚ÄúBy the way, what‚Äôs for dinner tonight?‚Äù","i also took away all of her electronic items until her attitude improves then i called",17,"my","my",NA,NA,NA,NA,NA,NA,NA,NA,NA,0,TRUE
"1218","So now I am pulled towards a vacuum of no worries and okayness. Everything‚Äôs alright, until it explodes. By then, I will be worried and harried and buried by things I will need to do fast and all at the same time. When that time comes. Maybe I should just wait for that day.","so now i am pulled towards a vacuum of no worries and okayness everything‚Äôs",15,"alright",NA,NA,NA,NA,NA,NA,NA,NA,NA,NA,NA,FALSE
"1219","This child's birth will signify renewal...........","this",2,"childs",NA,NA,NA,NA,NA,NA,NA,NA,NA,NA,NA,FALSE
"1220","I garden for the critters and winged things","i garden for the critters",6,"and","winged",NA,NA,NA,NA,NA,NA,NA,NA,NA,0.0200000000040745,FALSE
"1221","will not make it through the cold tonight.‚Äù The rich man was also a pious man, a devoted man.","will not",3,"make","be",NA,NA,NA,NA,NA,NA,NA,NA,NA,0.0199999999967986,FALSE
"1222","On the 24th of April, searchers found him in the wreckage of a plane whose wings failed him. There's something heroic about Chesty's falling that way, through the night. It was a brave man's death. Unconquerable, even in death.","on the th of april searchers found him in",10,"the","the","his",NA,NA,NA,NA,NA,NA,NA,NA,0.0100000000020373,TRUE
"1223","Have I mentioned how perfect this weekend was?","have i mentioned how perfect this weekend",8,"was","was",NA,NA,NA,NA,NA,NA,NA,NA,NA,0.0199999999967986,TRUE
"1224","Murphy, on the other hand, has regularly gone on national television and cultivated not knowledge but its opposite, over and over again offering factually inaccurate statements.","murphy on the other hand has",7,"regularly","hand","said","can","back","dont","today","person","known","didnt","currently",0.0600000000049477,FALSE
"1225","she thinks it‚Äôs a bore./","she thinks it‚Äôs a",5,"bore","going","good","one","right","might","peg","cooking",NA,NA,NA,0.0299999999988358,FALSE
"1226","‚ÄúIs the master in?‚Äù Addison bit her lip nervously, one of her fingers poised at the corner of it as she tried not to bite her finger.","‚Äúis the",3,"master",NA,NA,NA,NA,NA,NA,NA,NA,NA,NA,NA,FALSE
"1227","Start colouring, and this is why it's handy to have a graphics tablet, you can you a mouse, it's just easier with something that resembles a pen.","start colouring",3,"and","first","handy","tips",NA,NA,NA,NA,NA,NA,NA,0.0299999999988358,FALSE
"1228","And that thought KILLED me!","and",2,"that",NA,NA,NA,NA,NA,NA,NA,NA,NA,NA,NA,FALSE
"1229","networking and educational opportunities to ‚Äúrising stars‚Äù in fashion","networking and educational opportunities to",6,"‚Äúrising","days","find","meet",NA,NA,NA,NA,NA,NA,NA,0.0299999999988358,FALSE
"1230","And people gave him his ‚Äúroom‚Äù too, because that‚Äôs","and",2,"people",NA,NA,NA,NA,NA,NA,NA,NA,NA,NA,NA,FALSE
"1231","Scott McCormick: The book is based on a cat I used to have named Mr Pants. He was a very precocious animal who used to have all sorts of adventures in my old neighborhood in Philadelphia. He seemed like an obvious inspiration for a children's book; however, when I tried to write one based on his real-life adventures, he suddenly didn't seem very interesting. After all, in kid's books, animals do all sorts of wild and crazy things. Snoopy gets into dogfights with the Red Baron... Mr Pants once got on a Septa bus. Not very interesting. So I shelved it.","scott mccormick the book is based on a cat i used to have named mr pants he was a very precocious animal who used to have all sorts of adventures in my old neighborhood in philadelphia he",38,"seemed","flyers","seemed",NA,NA,NA,NA,NA,NA,NA,NA,0.0299999999988358,TRUE
"1232","Time for some Feng Shui.","time for some",4,"feng","reason",NA,NA,NA,NA,NA,NA,NA,NA,NA,0.0200000000040745,FALSE
"1233","If you‚Äôre not a friend, you‚Äôre an enemy. It‚Äôs a fact that I‚Äôve struggled with for years and was only reinforced by attending school.","if you‚Äôre not a friend",6,"you‚Äôre","of",NA,NA,NA,NA,NA,NA,NA,NA,NA,0,FALSE
"1234","Dark is the night of fear, still of all sound.","dark is",3,"the",NA,NA,NA,NA,NA,NA,NA,NA,NA,NA,NA,FALSE
"1235","Here are some bones from yesterday‚Äôs press conference call with Jurgen Klinsmann.","here are",3,"some","some","just",NA,NA,NA,NA,NA,NA,NA,NA,0.0100000000020373,TRUE
"1236","High Sold: 29","high",2,"sold","school","level","frequency","hopes","low","power","street","days","im","s",0.0199999999967986,FALSE
"1237","It terrifies me to think of the trouble they could get into and how easily their lives could be changed by poor choices. So what do we do? We pray!! We pray that God would make them like Daniel- that they would choose to honor God if given the choice‚Ä¶that they would always choose to honor God.","it terrifies me to think of the trouble they could get into and how easily their lives could be changed by poor choices so what do we do we pray we pray that god would make them like daniel that they would choose to honor god if given the choice‚Äthat they would always choose to",56,"honor","honor","have",NA,NA,NA,NA,NA,NA,NA,NA,0.0100000000020373,TRUE
"1238","In New York","in new",3,"york","york",NA,NA,NA,NA,NA,NA,NA,NA,NA,0.0199999999967986,TRUE
"1239","‚Äú People can be so stupid, but I wanted to blend with everyone as quickly as I could,‚Äù he said.","‚Äú people can be so but i wanted to blend with everyone as quickly",15,"as","feel","yes","run","took","discovered","turn","funny","turning","discover","decent",0.0300000000061118,FALSE
"1240","I chose rum and the two of us have been friendly ever since.","i chose and the two of us have",9,"been","believe","know","just","can","little","military","see","time","much","back",0.0199999999967986,FALSE
"1241","So we really hope you'll play!","so we really",4,"hope","good","like","need","really","want","feel","care","great","enjoyed","sure",0,FALSE
"1242","March 8: 1.51 miles; 20 minutes 30 seconds","march miles",3,"minutes","day","find","away","minutes","well","saw","anything","figured","regular","outside",0,TRUE
"1243","One more thing, because the Chapel is a functioning one, it remains a holy place and so the guards periodically let out a mighty ‚ÄòShhhhhh‚Äô in unison. It would resonate and was quite powerful. Though it worked for a time, it was like putting a lid on a boiling pot. The pressure would eventually build and the lid/talking would eventually rise again. But I loved that they did not give up.","one more thing because the chapel is a functioning one it remains a holy place and so the guards periodically let out a mighty ‚Äòshhhhhh‚Äô in unison it would resonate and was quite powerful though it worked for a time it was like putting",45,"a","together","story","sugar","three","energy","aside","blood","entry","winter","moves",0,FALSE
"1244","more rum for me. And this:","more for me",4,"and","and","to","it","but","today","the","was","in",NA,NA,0.0299999999988358,TRUE
"1245","I did the research because I was interested in the effect that today‚Äôs strongly-gendered parenting might have on the adults who live in the color-coded worlds of their children. Also, I was looking for a simple way to test whether, or to what extent, color preferences were variable in adulthood (rather than genetic), and the gender of children seemed like a good, mostly-random experiment to test that.","i did the research because i was interested in the effect that today‚Äôs stronglygendered parenting might have on the adults who live in the colorcoded worlds of their children also i was looking for a simple way to test whether or to what extent color preferences were variable in adulthood rather than genetic and the",56,"gender","way","new","world","black","people","good","two","book","city","beautiful",0.0100000000020373,FALSE
"1246","Dads are special people. And don‚Äôt forget‚ÄîFather‚Äôs Day is June 17th! Give him the gift of a memory with our Daddy & Me portrait session. It‚Äôs the perfect way to commemorate the father-child bond. With a variety of set options, this session can be customized to complement the ages and personality of your little ones. As your children grow, these portraits will become treasured keepsakes that they will share with their own children.","dads are special people and don‚Äôt forget‚Äîfather‚Äôs day is june th give him the gift of a memory with our daddy me portrait session it‚Äôs the perfect way to commemorate the fatherchild bond with a variety of set options this session can be customized to complement the ages and personality of your little ones as your children",58,"grow","school","grow","see","can","also","always","tell","two","home","find",0.0299999999988358,TRUE
"1247","Am I thankful to see my son already searching the scriptures to lead others to truth? Yes!","am i thankful",4,"to","see","though","make","will","god",NA,NA,NA,NA,NA,0.0299999999988358,FALSE
"1248","It's going to be a year of peace for me, I need it to be.","its going to be a year of peace for me i",12,"need","have","know","told","am","would",NA,NA,NA,NA,NA,0.0200000000040745,FALSE
"1249","Sunday morning I awoke to the sounds of kids being bathed, and then as I was fixing breakfast he vacuumed the whole house without being asked. I was like woah, 2012, what did you do with 2011 Hubby because I LIKE IT!?!?!?!","sunday morning i awoke to the sounds of kids being bathed and then as i was fixing breakfast he vacuumed the whole house without being asked i was like woah what did you do with hubby because i like",40,"it","to","the","that","it","and","this",NA,NA,NA,NA,0.0299999999988358,TRUE
"1250","The MACC has listed numerous further concessions associated with Michael Chia as a result of its investigations (below), so why has the Chief Minister denied any dealings with Chia whatsoever? As Chairman of the Board of Trustees at Yayasan Sabah, he exerts ultimate approval over all timber licences, including those given to Chia.","the macc has listed numerous further concessions associated with michael chia as a result of its investigations below so",20,"why","chief",NA,NA,NA,NA,NA,NA,NA,NA,NA,0.0199999999967986,FALSE
"1251","On March 23, 1989 in Salt Lake City, the University of Utah held a press conference to announce the discovery of cold fusion, but the story had already been leaked to the world's most influential financial dailies, the Wall Street Journal and the Financial Times. Both papers continued to print unfailingly optimistic reports for weeks. Among those lured into the swamp was Randell Mills, a 1986 graduate of Harvard Medical School. Two years later Mills held a press conference of his own to announce that it wasn't fusion. It was better! Hydrogen atoms can shrink into ""hydrinos,"" releasing energy. With the 17th anniversary of cold fusion approaching, both papers are now running credulous stories about Mills and his company, BlackLight Power. BLP, which has never produced anything, is rumored to be preparing an IPO.","on march in salt lake city the university of utah held a press conference to",16,"announce","announce","one","may","call","run","attendees","heck","rulers",NA,NA,0.0100000000020373,TRUE
"1252","Green Food Coloring (1 drop blue/1 drop yellow)","green food coloring drop",5,"blue","just","two","look","soon","read","pulls","front","blue","points","matter",0.0199999999967986,TRUE
"1253","I believe that there is something for everyone, but certain factors can't help but influence peoples' buying habits in general. Constant talk in the media of purse strings naturally makes us more aware and more protective of them. But people still want to be creative, to enhance their surroundings, acquire something unique and irreplaceable, and what I have noticed recently is perhaps the more unique the better.","i believe that there is something for everyone but certain factors cant help but influence peoples buying habits in general constant talk in the media of purse strings naturally makes us more aware and more protective of them but",40,"people",NA,NA,NA,NA,NA,NA,NA,NA,NA,NA,NA,FALSE
"1254","And the painted ponies go up and down","and",2,"the",NA,NA,NA,NA,NA,NA,NA,NA,NA,NA,NA,FALSE
"1255","or Paypal at flairmwr@yahoo.com","or",2,"paypal",NA,NA,NA,NA,NA,NA,NA,NA,NA,NA,NA,FALSE
"1256","However, later in the day I went to Detroit to go to the North American International Auto Show, and in order to get to the People Mover, I had to walk through the Greektown casino (I didn't gamble). And guess what? I got carded. So I guess in the end, yesterday was a wash, age wise.","however later in the day i went to detroit to go to the north american international auto show",19,"and","world","week","know","year","just","white","never","easily","even","book",0.0299999999988358,FALSE
"1257","The best thing about cycling in France in undoubtedly the patisseries found in each village, where I consume various gastronomic delights each day. Every time I ride into a new town at lunchtime I seek out the nearest shop and watch where all the locals buy their bread. I still cannot work out what exactly the French do with their baguettes; everyone seems to visit the patisserie twice a day and leave with hands full of bread. I guess I have a certain lack of creativity‚Ä¶ at the moment my baguette meals involve dipping the bread into a vegemite jar ‚Äì yum! It was while having such a meal outside the Somme Museum in Albert that Garry and Dianne took pity on me and kindly bought me lunch. I needed the energy too after going off road along La Somme on a dirt track later in the day.","the best thing about cycling in france in undoubtedly the patisseries found in each village where i consume various gastronomic delights each day every time i ride into a new town at lunchtime i seek out the nearest shop and watch where all the locals buy their bread i still cannot work out what exactly the french do with their baguettes",62,"everyone","everyone",NA,NA,NA,NA,NA,NA,NA,NA,NA,0.0199999999967986,TRUE
"1258","Children are privately coached in India before kindergarten admissions. Hagwons or private, after hours ‚Äòcram schools‚Äô have become the focus of government ire in South Korea, with President Lee Myung-bak declaring ‚Äúone-size-fits-all government-led uniform curriculums and an education system that is locked only onto the college-entrance examination are not acceptable.‚Äù","children are privately coached in india before kindergarten admissions hagwons or private after hours ‚Äòcram schools‚Äô have become the focus of government ire in south korea with president lee myungbak declaring ‚Äúonesizefitsall governmentled uniform curriculums",36,"and","say","curriculums",NA,NA,NA,NA,NA,NA,NA,NA,0.0100000000020373,FALSE
"1259","OK so it's a dining room table but the dining room is full of my crafty stuff so to me it qualifies as a craft room. Gone are the days of tidying up my craft stuff after a session - so that I can go to bed - now now Mrs Sugar no smutty remarks thank you!!!","ok so its a dining room table but the dining room is full of my crafty stuff so to me it qualifies as a craft room gone are the days of tidying up my craft stuff",37,"after","like","get","also","back","good","home","cant","done","call","decided",0.0100000000020373,FALSE
"1260","How crazy is it that it's already May? It scares me how fast time passes, especially this Spring semester. Nonetheless, there are many things I'm looking forward to this summer. I can't wait to share them with you.","how crazy is it that its already may it scares me how fast time passes especially this spring semester nonetheless there are many things im",26,"looking","going","sure","really","happy","getting","just","gonna","talking","still","excited",0.0199999999967986,FALSE
"1261","Comment on my posts (just once each) U-X (Tuesday through Friday) ‚Äì one point","comment on my posts just once each ux tuesday",10,"through","wednesday","night","two","morning","looking","share","stopped","friday","february","linky",0.0100000000020373,FALSE
"1262","It would be overstated to suggest that the Volt is a ""loss leader"" in the traditional sense, or that the Plymouth convertible was a ""bait and switch"" tactic. Still, there are tantalizing points of similarity. In the auto industry as well,the interrelationship among the mark, the brand and the product are at once both more and less than that which meets the eye.","it would be overstated to suggest that the volt is a loss leader in the traditional sense or that the plymouth convertible was a bait and",27,"switch","half","bit","lot","great","little","whole","small","wave","few","switch",0,TRUE
"1263","Infuriatingly, most of the entries aren‚Äôt dated ‚Äì although the overall header relates mainly to 2003-4. But there can be no doubt that this is a hacked mobile phone message from Royals staying at their favourite Kenyan getaway between 1998 and 2001 ‚Äì most likely to Princes William or Harry ‚Äì between ten and thirteen years ago.","infuriatingly most of the entries aren‚Äôt dated ‚Äì although the overall header relates mainly to but there can be no doubt that this is a hacked mobile phone message from royals staying at their favourite kenyan getaway between and ‚Äì",41,"most",NA,NA,NA,NA,NA,NA,NA,NA,NA,NA,NA,FALSE
"1264","Coffey and crew create a swampy sound to complement Williams‚Äô vocals. This musical backdrop is a perfect fit for this collection of songs.","coffey and crew create a swampy sound",8,"to","like","asleep","just","look","right","might","left","trying","hunger","pretty",0.0299999999988358,FALSE
"1265","- soft yellow paper straws","soft yellow",3,"paper","new","paper","actually","cake","bottle","liqueur","orange","somehow","glow","silks",0.0100000000020373,TRUE
"1266","The Rt is Faux Metal BG and a collaged image with highlights in a Sakura Gelly Roll pen. I added some gold around the edge using Gold embossing powder.","the rt is faux metal bg and a collaged image with highlights in a sakura gelly roll pen i added some gold around the edge",26,"using","of",NA,NA,NA,NA,NA,NA,NA,NA,NA,0.0199999999967986,FALSE
"1267","She climbed up on bed, and traced her fingers along my neck and over my breasts. She gave it a slight squeeze and I inhaled softly. Her warmth, her kiss, her touch. It was perfect. ‚ÄùI love you,‚Äù she whispered into my ear and licked it with her tongue. The wet, slippery sound sent shivers down my spine. Her hand reached down and I felt her warmth as she rubbed my cold, wet skin making me release another flow of wetness. The pleasure it gave me was immense.","she climbed up on bed and traced her fingers along my neck and over my she gave it a slight squeeze and i inhaled softly her warmth her kiss her touch it was perfect ‚Äùi love you‚Äù she whispered into my ear and licked it with her tongue the wet slippery sound sent shivers down my spine her hand reached down and i felt her warmth as she rubbed my cold wet",73,"skin","bag","sheet","add","nothing","market","laundry","dirty","wet","skin","kiss",0.0500000000029104,TRUE
"1268","all Lurk and Loom and Lust,","all lurk and loom",5,"and","lust",NA,NA,NA,NA,NA,NA,NA,NA,NA,0.0100000000020373,FALSE
"1269","That by itself is not enough to ground a plane, because the fuel can be measured manually. But this led to several problems.","that by",3,"itself",NA,NA,NA,NA,NA,NA,NA,NA,NA,NA,NA,FALSE
"1270","The interior is chockablock with storage nooks and cubbies, plus no less than four beverage holders. It has supportive seats, and while visibility to the front and sides is good, like pretty much all new cars visibility to the rear is poor. Well, by 2014 there will be a rear-view camera.","the interior is chockablock with storage nooks and cubbies plus no less than four beverage holders it has supportive seats and while visibility to the front and sides is good like pretty much all new cars",37,"visibility","near","case","balance","hit","clothes","inevitably","visibility",NA,NA,NA,0.0100000000020373,TRUE
"1271","My goal is to finish the race injury free........hoping I can look good in the process as well.","my goal is to finish the race injury",9,"freehoping","get","something","left","kept","visible","clarke","freehoping",NA,NA,NA,0.0199999999967986,TRUE
"1272","I'm much too tired to watch TV","im much too tired",5,"to","one","start","feeling","today","took","thinking","tired","body","sad","watch",0.0100000000020373,FALSE
