"374","In April 2006, Leeds university authorities subjected Dr Frank Ellis to an Inquisition after he had an interview published in ‚ÄúLeeds Student"". Dr Ellis was sought out for the interview with political bias in mind because of his ‚Äúpeculiar and extreme views"". He and his interviewer ranged over many topics but what ignited prejudice against him were his remarks that the average black has a lower IQ than the average white or Asian; that he believed we need to introduce a policy of humane repatriation. There were the usual demonstrations by Unite Against Fascism. The University's decision was purely to persecute a man for holding the wrong opinion: he treated his students fairly and impartially as the interviewer acknowledged Dr Ellis‚Äôs ‚Äúexcellent rapport with his students and colleagues"". Further, Leeds have a system to prevent unfair marking as the candidate's paper is anonymous and each is marked by 3 different tutors. He was investigated by the West Yorkshire police for incitement to racial hatred. So what is the problem? Dr Ellis was not disciplined for his conduct towards his students, which was exemplary, but persecuted for not expressing the right thoughts on race. In an interview on Talk Sport Ian Collins screamed at Ellis, ‚ÄùYou're mad!‚Äù (7)","in april leeds university authorities subjected dr frank ellis to an inquisition after he had an interview published in ‚Äúleeds student dr ellis was sought out for the interview with political bias in mind because of his ‚Äúpeculiar and extreme views he and his interviewer ranged over many topics but what ignited prejudice against him were his remarks that the average black has a lower iq than the average white or asian that he believed we need to introduce a policy of humane repatriation there were the usual demonstrations by unite against fascism the universitys decision was purely to persecute a man for holding the wrong opinion he treated his students fairly and impartially as the interviewer acknowledged dr ellis‚Äôs ‚Äúexcellent rapport with his students and colleagues further leeds have a system to prevent unfair marking as the candidates paper is anonymous and each is marked by different tutors he was investigated by the west yorkshire police for incitement to",161,"racial","racial",NA,NA,NA,NA,NA,NA,NA,NA,NA,0.0499999999956344,TRUE
"375","But it cannot define you. Not any more. You are a wild pig rooting for truffles. You are a weasel about to rip the throat out of a rabbit. You are an entrepreneur. You are going to be rich, and you don't much care, within the law, how you are going to do it. Or what must be sacrificed in the attempt.","but it cannot define you not any more you are a wild pig rooting for truffles you are a weasel about to rip the throat out of a rabbit you are an entrepreneur you are going to be rich and you dont",43,"much","need",NA,NA,NA,NA,NA,NA,NA,NA,NA,0.0100000000020373,FALSE
"376","Right here we have a cross-pollination of a zombie flick, jungle action, Rambo shoot-em-up, voodoo horror and Friday the 13th gore job. This is like a discount closeout at the Everything Must Go Cliche Store with macho mercenaries, damsels in distress, harrowing escapes, creatures leaping out of the shadows, shocking bloody effects and an ending that is as nihilistic as it is stupid. It's like the film-makers had to do something with all of these leftovers from every other movie made in 1989 so they lumped them all in here, slapped a title on it and hoped for the best.","right here we have a crosspollination of a zombie flick jungle action rambo shootemup voodoo horror and friday the th gore job this is like a discount closeout at the everything must go cliche store with macho mercenaries damsels in distress harrowing escapes creatures leaping",46,"out","bed","ability","shadows",NA,NA,NA,NA,NA,NA,NA,0.0500000000029104,FALSE
"377","I sell Avon products and have list of houses canvassed, catalogues delivered, returned, due, orders, customer details, etc. Thankfully I enjoy making lists.","i sell avon products and have list of houses canvassed catalogues delivered returned due orders customer details etc thankfully i",21,"enjoy","enjoy","close","pleasure","lasagna","rectified",NA,NA,NA,NA,NA,0.0199999999967986,TRUE
"378","Heartbroken Corrie star Kym Marsh has begged fianc√© Jamie Lomas to come clean after cheating claims","heartbroken corrie star kym marsh has begged fianc„ jamie lomas to come",13,"clean","up","to","over",NA,NA,NA,NA,NA,NA,NA,0.0100000000020373,FALSE
"379","‚ÄúDear Sir,","‚Äúdear",2,"sir",NA,NA,NA,NA,NA,NA,NA,NA,NA,NA,NA,FALSE
"380","What is the reaction of man when Jesus Christ reveals Himself? We want to look at this in three ways and one of these will relate to you. Naturally we look at Saul of Tarsus. He had been blind spiritually, not comprehending the light. In John 1:5 we see this truth. And the light shineth in darkness; and the darkness comprehended it not.‚Äù Up to this point Saul did not recognise his spiritual condition of being in darkness.","what is the reaction of man when",8,"jesus","will","one","made","see","night","also","take","just","media","first",0.0500000000029104,FALSE
"381","7:20: I toast up some frozen waffles for Junebug.","i toast",3,"up","along","frozen",NA,NA,NA,NA,NA,NA,NA,NA,0.0299999999988358,FALSE
"382","Opinions of Counsel - Infringement/ Validity; content and handling by Christopher P. Isaac‚Äì Partner, Finnegan, Henderson, Farabow, Garrett & Dunner LLP, Reston, Virginia","opinions of counsel infringement validity content",7,"and","will","beer","provided","date","suddenly","appears","twilight","citizen","charging","consider",0.0100000000020373,FALSE
"383","Place 1 tbsp filling in the center of each wonton wrapper. Brush the edges of the wrappers with egg, and pinch the edges to seal into a square.","place tbsp filling in the center of each wonton wrapper brush the edges",14,"of","of",NA,NA,NA,NA,NA,NA,NA,NA,NA,0.0299999999988358,TRUE
"384","We operate in strict ways, for the benefit and survival of the pack. Everyone is important and everyone has their role to play. It is easy and everyone understands.","we operate in strict ways for the benefit",9,"and","of",NA,NA,NA,NA,NA,NA,NA,NA,NA,0.0199999999967986,FALSE
"385","Pure Shiraz from the Medlands vineyard on the Barossa Valley floor.","pure shiraz from",4,"the","medlands",NA,NA,NA,NA,NA,NA,NA,NA,NA,0.0100000000020373,FALSE
"386","‚ÄúAnd it happened, in the spring of the year, at the time kings go out to battle, that Joab led out the armed forces and ravaged the country of the people of Ammon, and came and besieged Rabbah. But David stayed at Jerusalem. And Joab defeated Rabbah and overthrew it.‚Äù 1 Chronicles 20:1","‚Äúand it happened in the spring of the year at the time kings go out to battle that joab led out the armed forces and ravaged the country of the people of ammon and came and besieged rabbah but",40,"david","david","overthrew",NA,NA,NA,NA,NA,NA,NA,NA,0.0400000000008731,TRUE
"387","I have two stories I would like to tell today, the first is both humorous and embarrassing. The second involves the published Author Chris D'Lacey","i have",3,"two","to","been","never","not","seen","the","found","had","an","really",0.0299999999988358,FALSE
"388","There are several varieties of kelp: true kelp, which thrives in cool seas; giant kelp, and bladder kelp, which grow in the North Pacific. Giant kelp is so named because it grows to 213 ft (65 m). Kelp anchors itself to rocky surfaces via tentacle-like roots. From these roots grows a slender stalk with long, leaf-like blades.","there are several",4,"varieties","years","times","new","weeks","old","days","people","little","minutes","dress",0.0100000000020373,FALSE
"389","MH: Thanks for playing along. Besides January's release of Giant Thief is there anything you'd like to mention to close us out?","mh thanks for playing along besides januarys release of",10,"giant","the",NA,NA,NA,NA,NA,NA,NA,NA,NA,0.0199999999967986,FALSE
"390","To quote from the ‚Äúpress release‚Äù accompanying the new episode:","to quote from",4,"the","sister","opening","verses","cleolinda","doctors","postedits",NA,NA,NA,NA,0.0500000000029104,FALSE
"391","And my son‚Äôs face-this much for honor‚Ä¶","and my son‚Äôs facethis",5,"much","much",NA,NA,NA,NA,NA,NA,NA,NA,NA,0.0100000000020373,TRUE
"392","After church I decided to wander over to the library and see if it's open on Sundays (it isn't), and on the way there I stopped at the Commonwealth Avenue mall. (Mall as in ""long, narrow park"", not ""place where you drink an Orange Julius and wish you had money"".)","after church i decided to wander over to the library and see if its open on sundays it isnt and on the way there i stopped at the commonwealth avenue mall mall as in long narrow park not place where you drink an",44,"orange","find","lot","friends","made","experience","playing","clear","drive","feet","finished",0.0499999999956344,FALSE
"393","11. Junkies feat. B. Productions (prod. by Fanatikus)","junkies",2,"feat","half","cd","feat",NA,NA,NA,NA,NA,NA,NA,0,TRUE
"394","One morning I was laying in bed praying about an ""Titanic idea"" when the prodigal son story popped into my mind. Was it possible that the seed of the idea I had so many years prior fit on the Titanic? I dug back through my old computer files and found the original prologue. Then, in my mind's eye, the story of a younger son, an older son, a woman who cared for them both--and the loving father--played out in my mind.","one morning i was laying in bed praying about an titanic idea when the prodigal son story popped into my mind was it possible that the seed of the idea i had so many years prior fit on the titanic i dug back through my old",47,"computer","man","daughter","beer","friend","son","girardin","lady","system","though","school",0.0100000000020373,FALSE
"395","Great cast, good music (seeing it again I note the little ""heroic action!"" stings and other tricks of the music more) and naturally lots of funny.","great cast good music seeing",6,"it","want","old","much","definitely","address","wonderful","live","size","loyal","dogs",0.0199999999967986,FALSE
"396","Heh...none really..except for Del McCoury (Friday 1:50 - 2:30 Austin Ventures Stage) ...go see them and clap your hands. Does anyone else think there should be a few more? Of course my rule with Bluegrass is 3 songs is just enough.","hehnone reallyexcept for del mccoury friday austin ventures stage go see them and",14,"clap","the","my","they",NA,NA,NA,NA,NA,NA,NA,0.0600000000049477,FALSE
"397","Though she walks a little slowly, she was still sharp and spunky, braving the morning heat to be able to express her gratitude.","though she walks a little slowly she was still",10,"sharp","want","quite","take","use","love","work","believe","needs","waiting","alive",0.0299999999988358,FALSE
"398","Have you played here recently? If so, please share your comments.","have you played here recently if",7,"so","discovered","just","really","saw","read","decided","tried","eat","chance","mentioned",0.0500000000029104,FALSE
"399","As a two-time beggar I will go,","as a",3,"twotime","result","whole","place","way","man","gift","kid",NA,NA,NA,0.0100000000020373,FALSE
"400","The Full Moon of April is usually called the Egg Moon. In Algonquian it is called Pink Moon. Other names are Sprouting Grass Moon, Fish Moon, Seed Moon, and Waking Moon. In Hindi it is known as Hanuman Jayanti. The Full Moon rises around sunset and sets around sunrise, the only night in the month when the Moon is in the sky all night long. The rest of the month, the Moon spends at least some time in the daytime sky.","the full moon of april is usually called the egg moon in algonquian it is called pink moon other names are sprouting grass moon fish moon seed moon and waking moon in hindi it is known as hanuman jayanti the full moon rises around sunset and sets around sunrise the only night",53,"in","night","sky","see","day","time","take","got","want","never","even",0.0199999999967986,FALSE
"401","PT: For many entrepreneurs, starting their company may be their first experience in a business management role ‚Äì how can strong leadership skills better assist them in their new endeavor?","pt for many entrepreneurs starting their company may be their first experience in",14,"a","world","guests","people","make","think","always","use","one","even","life",0.0299999999988358,FALSE
"402","With Hanna‚Äôs retreat from the spotlight and the failed media blackout controversy, the second half of Girls to the Front feels much different from the first. The LA Times Evelyn McDonnell put it simply: ‚ÄúIf the first part of Marcus‚Äô book is exhilarating, the end can be depressing. Instead of supporting ‚Äògirl love,‚Äô as they‚Äôd earlier vowed, members turned against one another and their male sympathizers.‚Äù Corin Tucker and others took Fugazi to task for its song ‚ÄúSuggestion‚Äù which describes sexual harassment from a female perspective. As Marcus points out, few other male bands of Fugazi‚Äôs reputation even broached the subject let alone accused its audience of complicity, yet to some in the RG it sounded ‚Äúlike a self righteous white boy appropriating girls‚Äô issues so he could appear more virtuous.‚Äù (116) Hanna dismissed similar efforts by other bands: ‚ÄúA lot of this white straight edge boy thing singing about sexism is so incredibly stupid to me, I just can‚Äôt even deal with it.‚Äù (229)","with hanna‚Äôs retreat from the spotlight and the failed media blackout controversy the second half of girls to the front feels much different from the first the la times evelyn mcdonnell put it simply ‚Äúif the first part of marcus‚Äô book is exhilarating the end can be depressing instead of supporting ‚Äògirl love‚Äô as they‚Äôd earlier vowed members turned against one another and their male sympathizers‚Äù corin tucker and others took fugazi to task for its song ‚Äúsuggestion‚Äù which describes harassment from",83,"a","female","arrests",NA,NA,NA,NA,NA,NA,NA,NA,0.0299999999988358,FALSE
"403","Rewards have no expiration date.","rewards have no expiration",5,"date","date",NA,NA,NA,NA,NA,NA,NA,NA,NA,0,TRUE
"404","The Russian Foreign Minister stressed that the Security Council should adopt what will be issued by the UN observers not by the group of the so-called Friends of Syria, adding‚Äù they say they will evaluate how the Syrian leadership is implementing Annan‚Äôs plan, which is unacceptable.‚Äù","the russian foreign minister stressed that the security council should adopt what will be issued by the un observers",20,"not","group",NA,NA,NA,NA,NA,NA,NA,NA,NA,0.0300000000061118,FALSE
"405","‚ÄúWhile alcoholic liver disease remains the number one killer linked to alcohol, more and more people are suffering from oral cancers ‚Äî and record drinking levels have undeniably played a part.‚Äù","‚Äúwhile alcoholic liver disease remains",6,"the","one","today","number","holy","wingate","tonight","quiet",NA,NA,NA,0.0199999999967986,FALSE
"406","Always visiting","always",2,"visiting","good","grateful","go","take","will","one","best","addressed","adored","imagined",0.0100000000020373,FALSE
"407","It has a smooth, clean interface, great community, and is a more than adequate tool for your daily 9GAG needs. Of course, much of the content is what you would consider to be NSFW, but in all honesty, you shouldn‚Äôt really be using 9GAG in the work place, now should you?","it has a smooth clean interface great community and is a more than adequate tool for your daily",19,"gag","basis","one","exercise","rate","lives","show","journey","star","five","struggle",0.0299999999988358,FALSE
"408","Originally I named these ‚ÄúSamincha ‚Äù #Blessed in Quechua# because that is how I feel when I wear them so I combined both names because it was a magical combination.In the Powhatan language Pocahontas means ‚Äúplayful one‚Äù Her birth name was Mataoaka.‚ÄùSamincha ‚Äú#means Blessed in Quechua# are: handmade of antiqued metal, seed bead, filigree , Coral, swarovski, crystal and Love ‚ô•","originally",2,"i","just","made","moved","named","built","meant","painted","played","located","denied",0.0199999999967986,FALSE
"409","- You can also eat the green leaves? Wash them, cut them into little slices and stir-fry them for a couple of minutes.","you can also",4,"eat","get","see","good","found","happens","used","like","know","going","believe",0.0100000000020373,FALSE
"410","We followed this road","we followed this",4,"road","single","one","little","hour","blog","big","staff","heart","action","arthur",0.0400000000008731,FALSE
"411","Real Ale Lost Gold IPA - the Dog and Duck Pub","real ale lost gold ipa",6,"the","day","used","dog","sense","dinner","styles","exception","nutty",NA,NA,0.0100000000020373,FALSE
"412","I second that motion? Anyone care to vote?","i second that motion",5,"anyone","picture","make","anyone","hot",NA,NA,NA,NA,NA,NA,0.0199999999967986,TRUE
"413","Mr Smith is now part of a global community of more than 500 ‚Äúcar lovers‚Äù brought together by internet forums.","mr smith is now part of a global community of more than ‚Äúcar lovers‚Äù",15,"brought",NA,NA,NA,NA,NA,NA,NA,NA,NA,NA,NA,FALSE
"414","Small bar in a great city, after seeing the size of the brew house, I am surprised we got any bottled stock of this at all!","small bar in a great city after seeing",9,"the","the",NA,NA,NA,NA,NA,NA,NA,NA,NA,0.0299999999988358,TRUE
"415","Well, we are at the half way stage of our birthday hop, the good news is that there is still a week left to enter. So, make sure you hop on over to our fabulous DT and leave us a message on our birthday hop posting to be eligible for entry into our prize draw.","well we are at the half way stage of our birthday hop the good news is that there is still a week left to enter so make sure you hop on over to our fabulous dt and leave us a message on our",44,"birthday","clear","times","leader","behind","birthday","journey","wants","satan","sent","kept",0.0100000000020373,TRUE
"416","A Zentangle¬Æ, in the traditional sense, is done in black and white with pencil shading. I was asked one time in a Zentangle class why it is that we only use black and white - and to that i answered Zentangle is designed to remove the obstacles that we place in front of ourselves when beginning art.","a zentangle‚ in the traditional sense is done in black and white with pencil",15,"shading","line","type","dowel","shading",NA,NA,NA,NA,NA,NA,0.0400000000008731,TRUE
"417","Some 1,000 protesters marched in Tel Aviv on Saturday night in a show of opposition to the possibility of an Israeli strike in Iran. Over 2,300 citizens confirmed their attendance on Facebook. The march, titled ""Israelis against a war with Iran,"" began at Habima Square and was expected to conclude with a rally at Meir Park.","some protesters marched in tel aviv on saturday night in a show of opposition to the possibility of an israeli strike in iran over citizens confirmed their attendance on facebook the march titled israelis against a war with iran began at habima square and was expected to conclude with a rally at",53,"meir","time","local","tomorrow","meir",NA,NA,NA,NA,NA,NA,0.069999999999709,TRUE
"418","I started saving again.","i",2,"started",NA,NA,NA,NA,NA,NA,NA,NA,NA,NA,NA,FALSE
"419","About the author: Nickolas Johnson is an Intern Scholar at the Oakland Institute (OI) majoring in Political Science at San Francisco State University. This backgrounder on Concord Agriculture in South Sudan is based on OI‚Äôs project, Understanding Land Investment Deals in Africa: Country Report South Sudan. Download the full report publication from this link.","about the author nickolas johnson is an intern scholar at the oakland institute oi majoring in political science at san francisco state university this backgrounder on concord agriculture in south sudan is based on oi‚Äôs project understanding land investment deals in africa country",44,"report","people","work","now","like","just","country","living","report","every","full",0.0200000000040745,TRUE
"420","""Isn't there a question about what we should be spending our money on?""","isnt there",3,"a",NA,NA,NA,NA,NA,NA,NA,NA,NA,NA,NA,FALSE
"421","Casey‚Äôs Contraptions:","casey‚Äôs",2,"contraptions",NA,NA,NA,NA,NA,NA,NA,NA,NA,NA,NA,FALSE
"422","city has authority to accept contracts for goods or services without approval of the City Council or the expected competitive bidding process. The face shields and aerial surveillance technology are the first use of this allowance.","city has authority to accept",6,"contracts","one","someone","without","women","india","action","apologies","contracts","patient","stigma",0,TRUE
"423","Regarding Health Benefits of public workers: I believe the current reform law calls for a return of this issue to the negotiable list of items in 2014. Under my administration, it shall remain a negotiable issue although, as with wages, we will strive to achieve uniformity throughout New Jersey.","regarding health benefits of public workers i believe the current reform law calls for a return of this issue to the negotiable list of items in under my administration it shall remain a negotiable issue although",37,"as","one","know","time","really","think","still","never","may","beautiful","ive",0,FALSE
"424","Just for today I will put my family into God's hands for safe keeping. He can sort out all of these details in ways I can't even imagine.","just for today i will put my family into gods hands for safe keeping he can sort out all of",21,"these","the","these","you","us","our","this","my","them","it","his",0.0199999999967986,TRUE
"425","brick red facades stare","brick red",3,"facades","capsicum","new","one","around","door","arm","person","side","pepper","dress",0.0199999999967986,FALSE
"426","You see, Harold convinced his followers, something ‚Äúdid‚Äù happen on May 21. It just didn‚Äôt happen where anyone could see it. It was a ‚Äúspiritual‚Äù event. God judged the world on that day, and closed the door to salvation. (Like when God closed the door on Noah‚Äôs Ark once Noah and family were inside.) Only those who were inside the Ship on that day will be saved when the Ultimate End comes on October 21 and the whole world is destroyed. The job of Family Radio now is only to ‚Äúfeed the sheep‚Äù inside the Ark. Only five more months to sail, and then all the waiting will be over. Really. Guaranteed.","you see harold convinced his followers something ‚Äúdid‚Äù happen on may it just didn‚Äôt happen where anyone could see it it was a ‚Äúspiritual‚Äù event god judged the world on that day and closed the door to salvation like when god closed the door on noah‚Äôs ark once noah and family were inside only those who were inside the ship on that day will be saved when",68,"the","day","also","computer","room","however","ultimate","leftover","joint",NA,NA,0.0299999999988358,FALSE
"427","09. Petit Kid Everett","petit kid",3,"everett","say","even","getting","right","cut","movie","makes","doesnt","wants","jump",0.0100000000020373,FALSE
"428","This Immature perched too close to Delilah. She wouldn‚Äôt have any of this & flew straight at it! She even raised her talons when they almost clashed!","this immature perched too close to delilah she wouldn‚Äôt have any of this flew straight at it she even raised her talons when",24,"they","almost",NA,NA,NA,NA,NA,NA,NA,NA,NA,0.0500000000029104,FALSE
"429","Harvesting Maple Syrup.","harvesting",2,"maple","water","seeds","maple",NA,NA,NA,NA,NA,NA,NA,0.0199999999967986,TRUE
"430","someone you have never met in person,","someone",2,"you","else","going","love","can","say","like","just","never","give","feel",0.0299999999988358,FALSE
"431","I had pointed out that even the anti-Catholic writer William Roberts calls this merely ""the opinion of its Roman editors"". Bob replies:","i had pointed",4,"out","one","even","heart","james","direction","ambiguity",NA,NA,NA,NA,0.0299999999988358,FALSE
"432","Adding emotion to your list of motives will support you even longer e.g learning the language because your grandparents come from a different country, or you would like to better understand that handsome exchange student....","adding emotion to your list of motives will support you even longer eg learning the language because your grandparents come from a different country",25,"or","people","work","now","like","just","country","living","report","every","full",0,FALSE
"433","But the thoughts are trickling back, and I know that the more I write, the more they'll start flooding back, and so relief is in sight there, too.","but the thoughts are trickling back and i know that the more i write the more theyll start flooding back and so relief is in",26,"sight","the","many","cloth",NA,NA,NA,NA,NA,NA,NA,0.0300000000061118,FALSE
"434","""Ekalesia Niue (Niuean Church - a Protestant church closely related to the London Missionary Society) 61.1%, Latter-Day Saints 8.8%, Roman Catholic 7.2%, Jehovah's Witnesses 2.4%, Seventh-Day Adventist 1.4%, other 8.4%, unspecified 8.7%, none 1.9% (2001 census)"".","ekalesia niue niuean church a protestant church closely related to the london missionary",14,"society","guys","society",NA,NA,NA,NA,NA,NA,NA,NA,0.0199999999967986,TRUE
"435","Her mother explained that each of these objects had faced the same","her mother explained that each of these objects had faced",11,"the","man","choosing","rules","continual","litigants",NA,NA,NA,NA,NA,0,FALSE
